.tmp_miopen/gfx90a68.HIP.2_20_0_f185a6464-dirty.ufdb.txt
3-640-640-3x3-16-320-320-32-1x1-2x2-1x1-0-NCHW-FP16-F=ConvBinWinogradRxSf2x3g1:1.25328,0,miopenConvolutionFwdAlgoWinograd;ConvBinWinogradRxSf3x2:0.853122,0,miopenConvolutionFwdAlgoWinograd;GemmFwdRest:3.92704,5529600,miopenConvolutionFwdAlgoGEMM;ConvDirectNaiveConvFwd:4.77553,0,miopenConvolutionFwdAlgoDirect
16-320-320-3x3-32-160-160-32-1x1-2x2-1x1-0-NCHW-FP16-F=ConvBinWinogradRxSf2x3g1:0.715681,0,miopenConvolutionFwdAlgoWinograd;ConvBinWinogradRxSf3x2:0.423041,0,miopenConvolutionFwdAlgoWinograd;GemmFwdRest:1.67424,7372800,miopenConvolutionFwdAlgoGEMM;ConvDirectNaiveConvFwd:11.0527,0,miopenConvolutionFwdAlgoDirect
32-160-160-1x1-32-160-160-32-0x0-1x1-1x1-0-NCHW-FP16-F=ConvBinWinogradRxSf2x3g1:0.413921,0,miopenConvolutionFwdAlgoWinograd;ConvBinWinogradRxSf3x2:0.278721,0,miopenConvolutionFwdAlgoWinograd;GemmFwd1x1_0_1:0.1312,0,miopenConvolutionFwdAlgoGEMM;ConvDirectNaiveConvFwd:4.07265,0,miopenConvolutionFwdAlgoDirect
16-160-160-3x3-8-160-160-32-1x1-1x1-1x1-0-NCHW-FP16-F=ConvBinWinogradRxSf2x3g1:0.29472,0,miopenConvolutionFwdAlgoWinograd;ConvBinWinogradRxSf3x2:0.397121,0,miopenConvolutionFwdAlgoWinograd;GemmFwdRest:1.77664,7372800,miopenConvolutionFwdAlgoGEMM;ConvDirectNaiveConvFwd:5.04865,0,miopenConvolutionFwdAlgoDirect
8-160-160-3x3-16-160-160-32-1x1-1x1-1x1-0-NCHW-FP16-F=ConvBinWinogradRxSf2x3g1:0.229921,0,miopenConvolutionFwdAlgoWinograd;ConvBinWinogradRxSf3x2:0.28816,0,miopenConvolutionFwdAlgoWinograd;GemmFwdRest:1.09568,3686400,miopenConvolutionFwdAlgoGEMM;ConvDirectNaiveConvFwd:2.99521,0,miopenConvolutionFwdAlgoDirect
48-160-160-1x1-64-160-160-32-0x0-1x1-1x1-0-NCHW-FP16-F=ConvBinWinogradRxSf2x3g1:1.0096,0,miopenConvolutionFwdAlgoWinograd;ConvBinWinogradRxSf3x2:0.604961,0,miopenConvolutionFwdAlgoWinograd;GemmFwd1x1_0_1:0.226241,0,miopenConvolutionFwdAlgoGEMM;ConvDirectNaiveConvFwd:10.1008,0,miopenConvolutionFwdAlgoDirect
64-160-160-3x3-64-80-80-32-1x1-2x2-1x1-0-NCHW-FP16-F=ConvBinWinogradRxSf2x3g1:1.12832,0,miopenConvolutionFwdAlgoWinograd;ConvBinWinogradRxSf3x2:0.655041,0,miopenConvolutionFwdAlgoWinograd;GemmFwdRest:1.89952,7372800,miopenConvolutionFwdAlgoGEMM;ConvDirectNaiveConvFwd:19.1002,0,miopenConvolutionFwdAlgoDirect
64-80-80-1x1-64-80-80-32-0x0-1x1-1x1-0-NCHW-FP16-F=ConvBinWinogradRxSf2x3g1:0.337281,0,miopenConvolutionFwdAlgoWinograd;ConvBinWinogradRxSf3x2:0.21584,0,miopenConvolutionFwdAlgoWinograd;GemmFwd1x1_0_1:0.08704,0,miopenConvolutionFwdAlgoGEMM;ConvDirectNaiveConvFwd:3.33057,0,miopenConvolutionFwdAlgoDirect
32-80-80-3x3-16-80-80-32-1x1-1x1-1x1-0-NCHW-FP16-F=ConvBinWinogradRxSf2x3g1:0.13344,0,miopenConvolutionFwdAlgoWinograd;ConvBinWinogradRxSf3x2:0.197761,0,miopenConvolutionFwdAlgoWinograd;GemmFwdRest:1.31072,3686400,miopenConvolutionFwdAlgoGEMM;ConvDirectNaiveConvFwd:2.85441,0,miopenConvolutionFwdAlgoDirect
16-80-80-3x3-32-80-80-32-1x1-1x1-1x1-0-NCHW-FP16-F=ConvBinWinogradRxSf2x3g1:0.10064,0,miopenConvolutionFwdAlgoWinograd;ConvBinWinogradRxSf3x2:0.13808,0,miopenConvolutionFwdAlgoWinograd;GemmFwdRest:1.17248,1843200,miopenConvolutionFwdAlgoGEMM;ConvDirectNaiveConvFwd:2.45024,0,miopenConvolutionFwdAlgoDirect
96-80-80-1x1-128-80-80-32-0x0-1x1-1x1-0-NCHW-FP16-F=ConvBinWinogradRxSf2x3g1:0.876162,0,miopenConvolutionFwdAlgoWinograd;ConvBinWinogradRxSf3x2:0.485601,0,miopenConvolutionFwdAlgoWinograd;GemmFwd1x1_0_1:0.10784,0,miopenConvolutionFwdAlgoGEMM;ConvDirectNaiveConvFwd:9.09234,0,miopenConvolutionFwdAlgoDirect
128-80-80-3x3-128-40-40-32-1x1-2x2-1x1-0-NCHW-FP16-F=ConvBinWinogradRxSf2x3g1:1.12208,0,miopenConvolutionFwdAlgoWinograd;ConvBinWinogradRxSf3x2:0.674881,0,miopenConvolutionFwdAlgoWinograd;GemmFwdRest:1.7408,3686400,miopenConvolutionFwdAlgoGEMM;ConvDirectNaiveConvFwd:19.4333,0,miopenConvolutionFwdAlgoDirect
128-40-40-1x1-128-40-40-32-0x0-1x1-1x1-0-NCHW-FP16-F=ConvBinWinogradRxSf2x3g1:0.315521,0,miopenConvolutionFwdAlgoWinograd;ConvBinWinogradRxSf3x2:0.19808,0,miopenConvolutionFwdAlgoWinograd;GemmFwd1x1_0_1:0.08896,0,miopenConvolutionFwdAlgoGEMM;ConvDirectNaiveConvFwd:3.19313,0,miopenConvolutionFwdAlgoDirect
64-40-40-1x1-32-40-40-32-0x0-1x1-1x1-0-NCHW-FP16-F=ConvBinWinogradRxSf2x3g1:0.069601,0,miopenConvolutionFwdAlgoWinograd;ConvBinWinogradRxSf3x2:0.05968,0,miopenConvolutionFwdAlgoWinograd;GemmFwd1x1_0_1:0.02816,0,miopenConvolutionFwdAlgoGEMM;ConvDirectNaiveConvFwd:0.536161,0,miopenConvolutionFwdAlgoDirect
32-40-40-3x3-32-40-40-32-1x1-1x1-1x1-0-NCHW-FP16-F=ConvBinWinogradRxSf2x3g1:0.05888,0,miopenConvolutionFwdAlgoWinograd;ConvBinWinogradRxSf3x2:0.080001,0,miopenConvolutionFwdAlgoWinograd;GemmFwdRest:1.00352,921600,miopenConvolutionFwdAlgoGEMM;ConvDirectNaiveConvFwd:1.31632,0,miopenConvolutionFwdAlgoDirect
64-40-40-1x1-64-40-40-32-0x0-1x1-1x1-0-NCHW-FP16-F=ConvBinWinogradRxSf2x3g1:0.11136,0,miopenConvolutionFwdAlgoWinograd;ConvBinWinogradRxSf3x2:0.084961,0,miopenConvolutionFwdAlgoWinograd;GemmFwd1x1_0_1:0.04096,0,miopenConvolutionFwdAlgoGEMM;ConvDirectNaiveConvFwd:0.881282,0,miopenConvolutionFwdAlgoDirect
192-40-40-1x1-128-40-40-32-0x0-1x1-1x1-0-NCHW-FP16-F=ConvBinWinogradRxSf2x3g1:0.437441,0,miopenConvolutionFwdAlgoWinograd;ConvBinWinogradRxSf3x2:0.25744,0,miopenConvolutionFwdAlgoWinograd;GemmFwd1x1_0_1:0.09872,0,miopenConvolutionFwdAlgoGEMM;ConvDirectNaiveConvFwd:4.75761,0,miopenConvolutionFwdAlgoDirect
128-40-40-3x3-256-20-20-32-1x1-2x2-1x1-0-NCHW-FP16-F=ConvBinWinogradRxSf2x3g1:0.600161,0,miopenConvolutionFwdAlgoWinograd;ConvBinWinogradRxSf3x2:0.358401,0,miopenConvolutionFwdAlgoWinograd;GemmFwdRest:1.24416,921600,miopenConvolutionFwdAlgoGEMM;ConvDirectNaiveConvFwd:11.349,0,miopenConvolutionFwdAlgoDirect
256-20-20-1x1-256-20-20-32-0x0-1x1-1x1-0-NCHW-FP16-F=ConvBinWinogradRxSf2x3g1:0.3048,0,miopenConvolutionFwdAlgoWinograd;ConvBinWinogradRxSf3x2:0.187841,0,miopenConvolutionFwdAlgoWinograd;GemmFwd1x1_0_1:0.1224,0,miopenConvolutionFwdAlgoGEMM;ConvDirectNaiveConvFwd:3.41937,0,miopenConvolutionFwdAlgoDirect
128-20-20-1x1-64-20-20-32-0x0-1x1-1x1-0-NCHW-FP16-F=ConvBinWinogradRxSf2x3g1:0.07088,0,miopenConvolutionFwdAlgoWinograd;ConvBinWinogradRxSf3x2:0.06,0,miopenConvolutionFwdAlgoWinograd;GemmFwd1x1_0_1:0.02496,0,miopenConvolutionFwdAlgoGEMM;ConvDirectNaiveConvFwd:0.510241,0,miopenConvolutionFwdAlgoDirect
64-20-20-3x3-64-20-20-32-1x1-1x1-1x1-0-NCHW-FP16-F=ConvBinWinogradRxSf2x3g1:0.054561,0,miopenConvolutionFwdAlgoWinograd;ConvBinWinogradRxSf3x2:0.07488,0,miopenConvolutionFwdAlgoWinograd;GemmFwdRest:0.94208,460800,miopenConvolutionFwdAlgoGEMM;ConvDirectNaiveConvFwd:1.23536,0,miopenConvolutionFwdAlgoDirect
128-20-20-1x1-128-20-20-32-0x0-1x1-1x1-0-NCHW-FP16-F=ConvBinWinogradRxSf2x3g1:0.10304,0,miopenConvolutionFwdAlgoWinograd;ConvBinWinogradRxSf3x2:0.07856,0,miopenConvolutionFwdAlgoWinograd;GemmFwd1x1_0_1:0.05136,0,miopenConvolutionFwdAlgoGEMM;ConvDirectNaiveConvFwd:0.923362,0,miopenConvolutionFwdAlgoDirect
384-20-20-1x1-256-20-20-32-0x0-1x1-1x1-0-NCHW-FP16-F=ConvBinWinogradRxSf2x3g1:0.425441,0,miopenConvolutionFwdAlgoWinograd;ConvBinWinogradRxSf3x2:0.244321,0,miopenConvolutionFwdAlgoWinograd;GemmFwd1x1_0_1:0.056,0,miopenConvolutionFwdAlgoGEMM;ConvDirectNaiveConvFwd:5.11473,0,miopenConvolutionFwdAlgoDirect
128-20-20-1x1-256-20-20-32-0x0-1x1-1x1-0-NCHW-FP16-F=ConvBinWinogradRxSf2x3g1:0.175841,0,miopenConvolutionFwdAlgoWinograd;ConvBinWinogradRxSf3x2:0.11984,0,miopenConvolutionFwdAlgoWinograd;GemmFwd1x1_0_1:0.07824,0,miopenConvolutionFwdAlgoGEMM;ConvDirectNaiveConvFwd:1.72384,0,miopenConvolutionFwdAlgoDirect
128-20-20-3x3-128-20-20-32-1x1-1x1-1x1-0-NCHW-FP16-F_g128=ConvBinWinogradRxSf2x3:0.361281,0,miopenConvolutionFwdAlgoWinograd;ConvBinWinogradRxSf3x2:0.463201,0,miopenConvolutionFwdAlgoWinograd;GemmFwdRest:1.15712,921600,miopenConvolutionFwdAlgoGEMM;ConvDirectNaiveConvFwd:0.0712,0,miopenConvolutionFwdAlgoDirect
256-20-20-1x1-128-20-20-32-0x0-1x1-1x1-0-NCHW-FP16-F=ConvBinWinogradRxSf2x3g1:0.167521,0,miopenConvolutionFwdAlgoWinograd;ConvBinWinogradRxSf3x2:0.10816,0,miopenConvolutionFwdAlgoWinograd;GemmFwd1x1_0_1:0.06416,0,miopenConvolutionFwdAlgoGEMM;ConvDirectNaiveConvFwd:1.81568,0,miopenConvolutionFwdAlgoDirect
256-20-20-1x1-1280-20-20-32-0x0-1x1-1x1-0-NCHW-FP16-F=ConvBinWinogradRxSf2x3g1:1.32496,0,miopenConvolutionFwdAlgoWinograd;ConvBinWinogradRxSf3x2:0.706561,0,miopenConvolutionFwdAlgoWinograd;GemmFwd1x1_0_1:0.173761,0,miopenConvolutionFwdAlgoGEMM;ConvDirectNaiveConvFwd:15.7287,0,miopenConvolutionFwdAlgoDirect
1280-20-20-1x1-256-20-20-32-0x0-1x1-1x1-0-NCHW-FP16-W=GemmWrw1x1_stride1:0.46768,0,miopenConvolutionBwdWeightsAlgoGEMM;ConvDirectNaiveConvWrw:99.0783,0,miopenConvolutionBwdWeightsAlgoDirect
3-640-640-3x3-16-320-320-8-1x1-2x2-1x1-0-NCHW-FP16-F=ConvBinWinogradRxSf2x3g1:0.34432,0,miopenConvolutionFwdAlgoWinograd;ConvBinWinogradRxSf3x2:0.253761,0,miopenConvolutionFwdAlgoWinograd;GemmFwdRest:0.67968,5529600,miopenConvolutionFwdAlgoGEMM;ConvDirectNaiveConvFwd:3.30017,0,miopenConvolutionFwdAlgoDirect
16-320-320-3x3-32-160-160-8-1x1-2x2-1x1-0-NCHW-FP16-F=ConvBinWinogradRxSf2x3g1:0.205441,0,miopenConvolutionFwdAlgoWinograd;ConvBinWinogradRxSf3x2:0.12784,0,miopenConvolutionFwdAlgoWinograd;GemmFwdRest:0.41216,7372800,miopenConvolutionFwdAlgoGEMM;ConvDirectNaiveConvFwd:4.68721,0,miopenConvolutionFwdAlgoDirect
32-160-160-1x1-32-160-160-8-0x0-1x1-1x1-0-NCHW-FP16-F=ConvBinWinogradRxSf2x3g1:0.1312,0,miopenConvolutionFwdAlgoWinograd;ConvBinWinogradRxSf3x2:0.10544,0,miopenConvolutionFwdAlgoWinograd;GemmFwd1x1_0_1:0.04496,0,miopenConvolutionFwdAlgoGEMM;ConvDirectNaiveConvFwd:1.9848,0,miopenConvolutionFwdAlgoDirect
16-160-160-3x3-8-160-160-8-1x1-1x1-1x1-0-NCHW-FP16-F=ConvBinWinogradRxSf2x3g1:0.09456,0,miopenConvolutionFwdAlgoWinograd;ConvBinWinogradRxSf3x2:0.1296,0,miopenConvolutionFwdAlgoWinograd;GemmFwdRest:0.33024,7372800,miopenConvolutionFwdAlgoGEMM;ConvDirectNaiveConvFwd:4.14193,0,miopenConvolutionFwdAlgoDirect
8-160-160-3x3-16-160-160-8-1x1-1x1-1x1-0-NCHW-FP16-F=ConvBinWinogradRxSf2x3g1:0.08352,0,miopenConvolutionFwdAlgoWinograd;ConvBinWinogradRxSf3x2:0.11136,0,miopenConvolutionFwdAlgoWinograd;GemmFwdRest:0.270088,3686400,miopenConvolutionFwdAlgoGEMM;ConvDirectNaiveConvFwd:2.15472,0,miopenConvolutionFwdAlgoDirect
48-160-160-1x1-64-160-160-8-0x0-1x1-1x1-0-NCHW-FP16-F=ConvBinWinogradRxSf2x3g1:0.279041,0,miopenConvolutionFwdAlgoWinograd;ConvBinWinogradRxSf3x2:0.184,0,miopenConvolutionFwdAlgoWinograd;GemmFwd1x1_0_1:0.06864,0,miopenConvolutionFwdAlgoGEMM;ConvDirectNaiveConvFwd:3.30641,0,miopenConvolutionFwdAlgoDirect
64-160-160-3x3-64-80-80-8-1x1-2x2-1x1-0-NCHW-FP16-F=ConvBinWinogradRxSf2x3g1:0.316641,0,miopenConvolutionFwdAlgoWinograd;ConvBinWinogradRxSf3x2:0.20192,0,miopenConvolutionFwdAlgoWinograd;GemmFwdRest:0.45696,7372800,miopenConvolutionFwdAlgoGEMM;ConvDirectNaiveConvFwd:6.06385,0,miopenConvolutionFwdAlgoDirect
64-80-80-1x1-64-80-80-8-0x0-1x1-1x1-0-NCHW-FP16-F=ConvBinWinogradRxSf2x3g1:0.11888,0,miopenConvolutionFwdAlgoWinograd;ConvBinWinogradRxSf3x2:0.09504,0,miopenConvolutionFwdAlgoWinograd;GemmFwd1x1_0_1:0.03168,0,miopenConvolutionFwdAlgoGEMM;ConvDirectNaiveConvFwd:1.09344,0,miopenConvolutionFwdAlgoDirect
32-80-80-3x3-16-80-80-8-1x1-1x1-1x1-0-NCHW-FP16-F=ConvBinWinogradRxSf2x3g1:0.0608,0,miopenConvolutionFwdAlgoWinograd;ConvBinWinogradRxSf3x2:0.08016,0,miopenConvolutionFwdAlgoWinograd;GemmFwdRest:0.32,3686400,miopenConvolutionFwdAlgoGEMM;ConvDirectNaiveConvFwd:2.01552,0,miopenConvolutionFwdAlgoDirect
16-80-80-3x3-32-80-80-8-1x1-1x1-1x1-0-NCHW-FP16-F=ConvBinWinogradRxSf2x3g1:0.0504,0,miopenConvolutionFwdAlgoWinograd;ConvBinWinogradRxSf3x2:0.06464,0,miopenConvolutionFwdAlgoWinograd;GemmFwdRest:0.28032,1843200,miopenConvolutionFwdAlgoGEMM;ConvDirectNaiveConvFwd:1.12016,0,miopenConvolutionFwdAlgoDirect
96-80-80-1x1-128-80-80-8-0x0-1x1-1x1-0-NCHW-FP16-F=ConvBinWinogradRxSf2x3g1:0.251361,0,miopenConvolutionFwdAlgoWinograd;ConvBinWinogradRxSf3x2:0.16384,0,miopenConvolutionFwdAlgoWinograd;GemmFwd1x1_0_1:0.0384,0,miopenConvolutionFwdAlgoGEMM;ConvDirectNaiveConvFwd:3.00369,0,miopenConvolutionFwdAlgoDirect
128-80-80-3x3-128-40-40-8-1x1-2x2-1x1-0-NCHW-FP16-F=ConvBinWinogradRxSf2x3g1:0.312161,0,miopenConvolutionFwdAlgoWinograd;ConvBinWinogradRxSf3x2:0.19328,0,miopenConvolutionFwdAlgoWinograd;GemmFwdRest:0.42624,3686400,miopenConvolutionFwdAlgoGEMM;ConvDirectNaiveConvFwd:5.94897,0,miopenConvolutionFwdAlgoDirect
128-40-40-1x1-128-40-40-8-0x0-1x1-1x1-0-NCHW-FP16-F=ConvBinWinogradRxSf2x3g1:0.109761,0,miopenConvolutionFwdAlgoWinograd;ConvBinWinogradRxSf3x2:0.08736,0,miopenConvolutionFwdAlgoWinograd;GemmFwd1x1_0_1:0.0336,0,miopenConvolutionFwdAlgoGEMM;ConvDirectNaiveConvFwd:1.04192,0,miopenConvolutionFwdAlgoDirect
64-40-40-1x1-32-40-40-8-0x0-1x1-1x1-0-NCHW-FP16-F=ConvBinWinogradRxSf2x3g1:0.042881,0,miopenConvolutionFwdAlgoWinograd;ConvBinWinogradRxSf3x2:0.0496,0,miopenConvolutionFwdAlgoWinograd;GemmFwd1x1_0_1:0.0184,0,miopenConvolutionFwdAlgoGEMM;ConvDirectNaiveConvFwd:0.276,0,miopenConvolutionFwdAlgoDirect
32-40-40-3x3-32-40-40-8-1x1-1x1-1x1-0-NCHW-FP16-F=ConvBinWinogradRxSf2x3g1:0.0432,0,miopenConvolutionFwdAlgoWinograd;ConvBinWinogradRxSf3x2:0.05904,0,miopenConvolutionFwdAlgoWinograd;GemmFwdRest:0.24064,921600,miopenConvolutionFwdAlgoGEMM;ConvDirectNaiveConvFwd:0.644322,0,miopenConvolutionFwdAlgoDirect
64-40-40-1x1-64-40-40-8-0x0-1x1-1x1-0-NCHW-FP16-F=ConvBinWinogradRxSf2x3g1:0.053281,0,miopenConvolutionFwdAlgoWinograd;ConvBinWinogradRxSf3x2:0.04944,0,miopenConvolutionFwdAlgoWinograd;GemmFwd1x1_0_1:0.02208,0,miopenConvolutionFwdAlgoGEMM;ConvDirectNaiveConvFwd:0.304961,0,miopenConvolutionFwdAlgoDirect
192-40-40-1x1-128-40-40-8-0x0-1x1-1x1-0-NCHW-FP16-F=ConvBinWinogradRxSf2x3g1:0.13792,0,miopenConvolutionFwdAlgoWinograd;ConvBinWinogradRxSf3x2:0.09488,0,miopenConvolutionFwdAlgoWinograd;GemmFwd1x1_0_1:0.03616,0,miopenConvolutionFwdAlgoGEMM;ConvDirectNaiveConvFwd:1.5784,0,miopenConvolutionFwdAlgoDirect
128-40-40-3x3-256-20-20-8-1x1-2x2-1x1-0-NCHW-FP16-F=ConvBinWinogradRxSf2x3g1:0.17952,0,miopenConvolutionFwdAlgoWinograd;ConvBinWinogradRxSf3x2:0.12096,0,miopenConvolutionFwdAlgoWinograd;GemmFwdRest:0.30848,921600,miopenConvolutionFwdAlgoGEMM;ConvDirectNaiveConvFwd:3.17473,0,miopenConvolutionFwdAlgoDirect
256-20-20-1x1-256-20-20-8-0x0-1x1-1x1-0-NCHW-FP16-F=ConvBinWinogradRxSf2x3g1:0.110721,0,miopenConvolutionFwdAlgoWinograd;ConvBinWinogradRxSf3x2:0.08832,0,miopenConvolutionFwdAlgoWinograd;GemmFwd1x1_0_1:0.04336,0,miopenConvolutionFwdAlgoGEMM;ConvDirectNaiveConvFwd:0.976002,0,miopenConvolutionFwdAlgoDirect
128-20-20-1x1-64-20-20-8-0x0-1x1-1x1-0-NCHW-FP16-F=ConvBinWinogradRxSf2x3g1:0.05424,0,miopenConvolutionFwdAlgoWinograd;ConvBinWinogradRxSf3x2:0.058081,0,miopenConvolutionFwdAlgoWinograd;GemmFwd1x1_0_1:0.01776,0,miopenConvolutionFwdAlgoGEMM;ConvDirectNaiveConvFwd:0.18,0,miopenConvolutionFwdAlgoDirect
64-20-20-3x3-64-20-20-8-1x1-1x1-1x1-0-NCHW-FP16-F=ConvBinWinogradRxSf2x3g1:0.04608,0,miopenConvolutionFwdAlgoWinograd;ConvBinWinogradRxSf3x2:0.074881,0,miopenConvolutionFwdAlgoWinograd;GemmFwdRest:0.23936,460800,miopenConvolutionFwdAlgoGEMM;ConvDirectNaiveConvFwd:0.426081,0,miopenConvolutionFwdAlgoDirect
128-20-20-1x1-128-20-20-8-0x0-1x1-1x1-0-NCHW-FP16-F=ConvBinWinogradRxSf2x3g1:0.05184,0,miopenConvolutionFwdAlgoWinograd;ConvBinWinogradRxSf3x2:0.058721,0,miopenConvolutionFwdAlgoWinograd;GemmFwd1x1_0_1:0.02416,0,miopenConvolutionFwdAlgoGEMM;ConvDirectNaiveConvFwd:0.30832,0,miopenConvolutionFwdAlgoDirect
384-20-20-1x1-256-20-20-8-0x0-1x1-1x1-0-NCHW-FP16-F=ConvBinWinogradRxSf2x3g1:0.13504,0,miopenConvolutionFwdAlgoWinograd;ConvBinWinogradRxSf3x2:0.09488,0,miopenConvolutionFwdAlgoWinograd;GemmFwd1x1_0_1:0.02848,0,miopenConvolutionFwdAlgoGEMM;ConvDirectNaiveConvFwd:1.47312,0,miopenConvolutionFwdAlgoDirect
128-20-20-1x1-256-20-20-8-0x0-1x1-1x1-0-NCHW-FP16-F=ConvBinWinogradRxSf2x3g1:0.07216,0,miopenConvolutionFwdAlgoWinograd;ConvBinWinogradRxSf3x2:0.062561,0,miopenConvolutionFwdAlgoWinograd;GemmFwd1x1_0_1:0.03136,0,miopenConvolutionFwdAlgoGEMM;ConvDirectNaiveConvFwd:0.502561,0,miopenConvolutionFwdAlgoDirect
128-20-20-3x3-128-20-20-8-1x1-1x1-1x1-0-NCHW-FP16-F_g128=ConvBinWinogradRxSf2x3:0.151681,0,miopenConvolutionFwdAlgoWinograd;ConvBinWinogradRxSf3x2:0.19424,0,miopenConvolutionFwdAlgoWinograd;GemmFwdRest:0.27776,921600,miopenConvolutionFwdAlgoGEMM;ConvDirectNaiveConvFwd:0.03424,0,miopenConvolutionFwdAlgoDirect
256-20-20-1x1-128-20-20-8-0x0-1x1-1x1-0-NCHW-FP16-F=ConvBinWinogradRxSf2x3g1:0.06528,0,miopenConvolutionFwdAlgoWinograd;ConvBinWinogradRxSf3x2:0.07392,0,miopenConvolutionFwdAlgoWinograd;GemmFwd1x1_0_1:0.02736,0,miopenConvolutionFwdAlgoGEMM;ConvDirectNaiveConvFwd:0.612161,0,miopenConvolutionFwdAlgoDirect
256-20-20-1x1-1280-20-20-8-0x0-1x1-1x1-0-NCHW-FP16-F=ConvBinWinogradRxSf2x3g1:0.3624,0,miopenConvolutionFwdAlgoWinograd;ConvBinWinogradRxSf3x2:0.21472,0,miopenConvolutionFwdAlgoWinograd;GemmFwd1x1_0_1:0.0632,0,miopenConvolutionFwdAlgoGEMM;ConvDirectNaiveConvFwd:4.04705,0,miopenConvolutionFwdAlgoDirect
1280-20-20-1x1-256-20-20-8-0x0-1x1-1x1-0-NCHW-FP16-W=GemmWrw1x1_stride1:0.12432,0,miopenConvolutionBwdWeightsAlgoGEMM;ConvDirectNaiveConvWrw:24.6383,0,miopenConvolutionBwdWeightsAlgoDirect
3-640-640-3x3-16-320-320-64-1x1-2x2-1x1-0-NCHW-FP16-F=ConvBinWinogradRxSf2x3g1:2.45649,0,miopenConvolutionFwdAlgoWinograd;ConvBinWinogradRxSf3x2:1.6504,0,miopenConvolutionFwdAlgoWinograd;GemmFwdRest:5.43744,5529600,miopenConvolutionFwdAlgoGEMM;ConvDirectNaiveConvFwd:8.61314,0,miopenConvolutionFwdAlgoDirect
16-320-320-3x3-32-160-160-64-1x1-2x2-1x1-0-NCHW-FP16-F=ConvBinWinogradRxSf2x3g1:1.39248,0,miopenConvolutionFwdAlgoWinograd;ConvBinWinogradRxSf3x2:0.789442,0,miopenConvolutionFwdAlgoWinograd;GemmFwdRest:3.31776,7372800,miopenConvolutionFwdAlgoGEMM;ConvDirectNaiveConvFwd:19.3544,0,miopenConvolutionFwdAlgoDirect
32-160-160-1x1-32-160-160-64-0x0-1x1-1x1-0-NCHW-FP16-F=ConvBinWinogradRxSf2x3g1:0.792481,0,miopenConvolutionFwdAlgoWinograd;ConvBinWinogradRxSf3x2:0.505122,0,miopenConvolutionFwdAlgoWinograd;GemmFwd1x1_0_1:0.24304,0,miopenConvolutionFwdAlgoGEMM;ConvDirectNaiveConvFwd:6.80977,0,miopenConvolutionFwdAlgoDirect
16-160-160-3x3-8-160-160-64-1x1-1x1-1x1-0-NCHW-FP16-F=ConvBinWinogradRxSf2x3g1:0.542721,0,miopenConvolutionFwdAlgoWinograd;ConvBinWinogradRxSf3x2:0.726401,0,miopenConvolutionFwdAlgoWinograd;GemmFwdRest:2.816,7372800,miopenConvolutionFwdAlgoGEMM;ConvDirectNaiveConvFwd:6.19313,0,miopenConvolutionFwdAlgoDirect
8-160-160-3x3-16-160-160-64-1x1-1x1-1x1-0-NCHW-FP16-F=ConvBinWinogradRxSf2x3g1:0.427681,0,miopenConvolutionFwdAlgoWinograd;ConvBinWinogradRxSf3x2:0.526721,0,miopenConvolutionFwdAlgoWinograd;GemmFwdRest:2.16064,3686400,miopenConvolutionFwdAlgoGEMM;ConvDirectNaiveConvFwd:5.14593,0,miopenConvolutionFwdAlgoDirect
48-160-160-1x1-64-160-160-64-0x0-1x1-1x1-0-NCHW-FP16-F=ConvBinWinogradRxSf2x3g1:1.97312,0,miopenConvolutionFwdAlgoWinograd;ConvBinWinogradRxSf3x2:1.13712,0,miopenConvolutionFwdAlgoWinograd;GemmFwd1x1_0_1:0.439201,0,miopenConvolutionFwdAlgoGEMM;ConvDirectNaiveConvFwd:18.876,0,miopenConvolutionFwdAlgoDirect
64-160-160-3x3-64-80-80-64-1x1-2x2-1x1-0-NCHW-FP16-F=ConvBinWinogradRxSf2x3g1:2.22288,0,miopenConvolutionFwdAlgoWinograd;ConvBinWinogradRxSf3x2:1.23328,0,miopenConvolutionFwdAlgoWinograd;GemmFwdRest:3.6455,7372800,miopenConvolutionFwdAlgoGEMM;ConvDirectNaiveConvFwd:36.3572,0,miopenConvolutionFwdAlgoDirect
64-80-80-1x1-64-80-80-64-0x0-1x1-1x1-0-NCHW-FP16-F=ConvBinWinogradRxSf2x3g1:0.642722,0,miopenConvolutionFwdAlgoWinograd;ConvBinWinogradRxSf3x2:0.380161,0,miopenConvolutionFwdAlgoWinograd;GemmFwd1x1_0_1:0.1536,0,miopenConvolutionFwdAlgoGEMM;ConvDirectNaiveConvFwd:6.22769,0,miopenConvolutionFwdAlgoDirect
32-80-80-3x3-16-80-80-64-1x1-1x1-1x1-0-NCHW-FP16-F=ConvBinWinogradRxSf2x3g1:0.21776,0,miopenConvolutionFwdAlgoWinograd;ConvBinWinogradRxSf3x2:0.331361,0,miopenConvolutionFwdAlgoWinograd;GemmFwdRest:2.44736,3686400,miopenConvolutionFwdAlgoGEMM;ConvDirectNaiveConvFwd:4.90449,0,miopenConvolutionFwdAlgoDirect
16-80-80-3x3-32-80-80-64-1x1-1x1-1x1-0-NCHW-FP16-F=ConvBinWinogradRxSf2x3g1:0.1648,0,miopenConvolutionFwdAlgoWinograd;ConvBinWinogradRxSf3x2:0.227201,0,miopenConvolutionFwdAlgoWinograd;GemmFwdRest:1.8944,1843200,miopenConvolutionFwdAlgoGEMM;ConvDirectNaiveConvFwd:4.32497,0,miopenConvolutionFwdAlgoDirect
96-80-80-1x1-128-80-80-64-0x0-1x1-1x1-0-NCHW-FP16-F=ConvBinWinogradRxSf2x3g1:1.71344,0,miopenConvolutionFwdAlgoWinograd;ConvBinWinogradRxSf3x2:0.913922,0,miopenConvolutionFwdAlgoWinograd;GemmFwd1x1_0_1:0.194881,0,miopenConvolutionFwdAlgoGEMM;ConvDirectNaiveConvFwd:17.4538,0,miopenConvolutionFwdAlgoDirect
128-80-80-3x3-128-40-40-64-1x1-2x2-1x1-0-NCHW-FP16-F=ConvBinWinogradRxSf2x3g1:2.15904,0,miopenConvolutionFwdAlgoWinograd;ConvBinWinogradRxSf3x2:1.30176,0,miopenConvolutionFwdAlgoWinograd;GemmFwdRest:3.44064,3686400,miopenConvolutionFwdAlgoGEMM;ConvDirectNaiveConvFwd:37.6196,0,miopenConvolutionFwdAlgoDirect
128-40-40-1x1-128-40-40-64-0x0-1x1-1x1-0-NCHW-FP16-F=ConvBinWinogradRxSf2x3g1:0.573121,0,miopenConvolutionFwdAlgoWinograd;ConvBinWinogradRxSf3x2:0.343361,0,miopenConvolutionFwdAlgoWinograd;GemmFwd1x1_0_1:0.168,0,miopenConvolutionFwdAlgoGEMM;ConvDirectNaiveConvFwd:6.09777,0,miopenConvolutionFwdAlgoDirect
64-40-40-1x1-32-40-40-64-0x0-1x1-1x1-0-NCHW-FP16-F=ConvBinWinogradRxSf2x3g1:0.112481,0,miopenConvolutionFwdAlgoWinograd;ConvBinWinogradRxSf3x2:0.08768,0,miopenConvolutionFwdAlgoWinograd;GemmFwd1x1_0_1:0.04256,0,miopenConvolutionFwdAlgoGEMM;ConvDirectNaiveConvFwd:0.884002,0,miopenConvolutionFwdAlgoDirect
32-40-40-3x3-32-40-40-64-1x1-1x1-1x1-0-NCHW-FP16-F=ConvBinWinogradRxSf2x3g1:0.08512,0,miopenConvolutionFwdAlgoWinograd;ConvBinWinogradRxSf3x2:0.1224,0,miopenConvolutionFwdAlgoWinograd;GemmFwdRest:1.90464,921600,miopenConvolutionFwdAlgoGEMM;ConvDirectNaiveConvFwd:2.28993,0,miopenConvolutionFwdAlgoDirect
64-40-40-1x1-64-40-40-64-0x0-1x1-1x1-0-NCHW-FP16-F=ConvBinWinogradRxSf2x3g1:0.188961,0,miopenConvolutionFwdAlgoWinograd;ConvBinWinogradRxSf3x2:0.13296,0,miopenConvolutionFwdAlgoWinograd;GemmFwd1x1_0_1:0.06704,0,miopenConvolutionFwdAlgoGEMM;ConvDirectNaiveConvFwd:1.64432,0,miopenConvolutionFwdAlgoDirect
192-40-40-1x1-128-40-40-64-0x0-1x1-1x1-0-NCHW-FP16-F=ConvBinWinogradRxSf2x3g1:0.816802,0,miopenConvolutionFwdAlgoWinograd;ConvBinWinogradRxSf3x2:0.471361,0,miopenConvolutionFwdAlgoWinograd;GemmFwd1x1_0_1:0.18336,0,miopenConvolutionFwdAlgoGEMM;ConvDirectNaiveConvFwd:9.10802,0,miopenConvolutionFwdAlgoDirect
128-40-40-3x3-256-20-20-64-1x1-2x2-1x1-0-NCHW-FP16-F=ConvBinWinogradRxSf2x3g1:1.15936,0,miopenConvolutionFwdAlgoWinograd;ConvBinWinogradRxSf3x2:0.728001,0,miopenConvolutionFwdAlgoWinograd;GemmFwdRest:2.49856,921600,miopenConvolutionFwdAlgoGEMM;ConvDirectNaiveConvFwd:22.3629,0,miopenConvolutionFwdAlgoDirect
256-20-20-1x1-256-20-20-64-0x0-1x1-1x1-0-NCHW-FP16-F=ConvBinWinogradRxSf2x3g1:0.567361,0,miopenConvolutionFwdAlgoWinograd;ConvBinWinogradRxSf3x2:0.341601,0,miopenConvolutionFwdAlgoWinograd;GemmFwd1x1_0_1:0.227681,0,miopenConvolutionFwdAlgoGEMM;ConvDirectNaiveConvFwd:6.66577,0,miopenConvolutionFwdAlgoDirect
128-20-20-1x1-64-20-20-64-0x0-1x1-1x1-0-NCHW-FP16-F=ConvBinWinogradRxSf2x3g1:0.10304,0,miopenConvolutionFwdAlgoWinograd;ConvBinWinogradRxSf3x2:0.07728,0,miopenConvolutionFwdAlgoWinograd;GemmFwd1x1_0_1:0.03552,0,miopenConvolutionFwdAlgoGEMM;ConvDirectNaiveConvFwd:0.946562,0,miopenConvolutionFwdAlgoDirect
64-20-20-3x3-64-20-20-64-1x1-1x1-1x1-0-NCHW-FP16-F=ConvBinWinogradRxSf2x3g1:0.06976,0,miopenConvolutionFwdAlgoWinograd;ConvBinWinogradRxSf3x2:0.110881,0,miopenConvolutionFwdAlgoWinograd;GemmFwdRest:1.91488,460800,miopenConvolutionFwdAlgoGEMM;ConvDirectNaiveConvFwd:2.2728,0,miopenConvolutionFwdAlgoDirect
128-20-20-1x1-128-20-20-64-0x0-1x1-1x1-0-NCHW-FP16-F=ConvBinWinogradRxSf2x3g1:0.17056,0,miopenConvolutionFwdAlgoWinograd;ConvBinWinogradRxSf3x2:0.1192,0,miopenConvolutionFwdAlgoWinograd;GemmFwd1x1_0_1:0.086241,0,miopenConvolutionFwdAlgoGEMM;ConvDirectNaiveConvFwd:1.75488,0,miopenConvolutionFwdAlgoDirect
384-20-20-1x1-256-20-20-64-0x0-1x1-1x1-0-NCHW-FP16-F=ConvBinWinogradRxSf2x3g1:0.814562,0,miopenConvolutionFwdAlgoWinograd;ConvBinWinogradRxSf3x2:0.464801,0,miopenConvolutionFwdAlgoWinograd;GemmFwd1x1_0_1:0.09952,0,miopenConvolutionFwdAlgoGEMM;ConvDirectNaiveConvFwd:9.9661,0,miopenConvolutionFwdAlgoDirect
128-20-20-1x1-256-20-20-64-0x0-1x1-1x1-0-NCHW-FP16-F=ConvBinWinogradRxSf2x3g1:0.31328,0,miopenConvolutionFwdAlgoWinograd;ConvBinWinogradRxSf3x2:0.197281,0,miopenConvolutionFwdAlgoWinograd;GemmFwd1x1_0_1:0.13936,0,miopenConvolutionFwdAlgoGEMM;ConvDirectNaiveConvFwd:3.36113,0,miopenConvolutionFwdAlgoDirect
128-20-20-3x3-128-20-20-64-1x1-1x1-1x1-0-NCHW-FP16-F_g128=ConvBinWinogradRxSf2x3:0.636801,0,miopenConvolutionFwdAlgoWinograd;ConvBinWinogradRxSf3x2:0.804802,0,miopenConvolutionFwdAlgoWinograd;GemmFwdRest:2.18112,921600,miopenConvolutionFwdAlgoGEMM;ConvDirectNaiveConvFwd:0.110561,0,miopenConvolutionFwdAlgoDirect
256-20-20-1x1-128-20-20-64-0x0-1x1-1x1-0-NCHW-FP16-F=ConvBinWinogradRxSf2x3g1:0.29616,0,miopenConvolutionFwdAlgoWinograd;ConvBinWinogradRxSf3x2:0.18688,0,miopenConvolutionFwdAlgoWinograd;GemmFwd1x1_0_1:0.11152,0,miopenConvolutionFwdAlgoGEMM;ConvDirectNaiveConvFwd:3.46577,0,miopenConvolutionFwdAlgoDirect
256-20-20-1x1-1280-20-20-64-0x0-1x1-1x1-0-NCHW-FP16-F=ConvBinWinogradRxSf2x3g1:2.60977,0,miopenConvolutionFwdAlgoWinograd;ConvBinWinogradRxSf3x2:1.47808,0,miopenConvolutionFwdAlgoWinograd;GemmFwd1x1_0_1:0.337281,0,miopenConvolutionFwdAlgoGEMM;ConvDirectNaiveConvFwd:31.2661,0,miopenConvolutionFwdAlgoDirect
3-640-640-3x3-16-320-320-48-1x1-2x2-1x1-0-NCHW-FP16-F=ConvBinWinogradRxSf2x3g1:1.85792,0,miopenConvolutionFwdAlgoWinograd;ConvBinWinogradRxSf3x2:1.2536,0,miopenConvolutionFwdAlgoWinograd;GemmFwdRest:4.07808,5529600,miopenConvolutionFwdAlgoGEMM;ConvDirectNaiveConvFwd:6.24529,0,miopenConvolutionFwdAlgoDirect
16-320-320-3x3-32-160-160-48-1x1-2x2-1x1-0-NCHW-FP16-F=ConvBinWinogradRxSf2x3g1:1.0504,0,miopenConvolutionFwdAlgoWinograd;ConvBinWinogradRxSf3x2:0.587841,0,miopenConvolutionFwdAlgoWinograd;GemmFwdRest:2.496,7372800,miopenConvolutionFwdAlgoGEMM;ConvDirectNaiveConvFwd:14.592,0,miopenConvolutionFwdAlgoDirect
32-160-160-1x1-32-160-160-48-0x0-1x1-1x1-0-NCHW-FP16-F=ConvBinWinogradRxSf2x3g1:0.600002,0,miopenConvolutionFwdAlgoWinograd;ConvBinWinogradRxSf3x2:0.38096,0,miopenConvolutionFwdAlgoWinograd;GemmFwd1x1_0_1:0.188321,0,miopenConvolutionFwdAlgoGEMM;ConvDirectNaiveConvFwd:5.29041,0,miopenConvolutionFwdAlgoDirect
16-160-160-3x3-8-160-160-48-1x1-1x1-1x1-0-NCHW-FP16-F=ConvBinWinogradRxSf2x3g1:0.415681,0,miopenConvolutionFwdAlgoWinograd;ConvBinWinogradRxSf3x2:0.557281,0,miopenConvolutionFwdAlgoWinograd;GemmFwdRest:2.08896,7372800,miopenConvolutionFwdAlgoGEMM;ConvDirectNaiveConvFwd:5.57281,0,miopenConvolutionFwdAlgoDirect
8-160-160-3x3-16-160-160-48-1x1-1x1-1x1-0-NCHW-FP16-F=ConvBinWinogradRxSf2x3g1:0.3288,0,miopenConvolutionFwdAlgoWinograd;ConvBinWinogradRxSf3x2:0.408001,0,miopenConvolutionFwdAlgoWinograd;GemmFwdRest:1.62816,3686400,miopenConvolutionFwdAlgoGEMM;ConvDirectNaiveConvFwd:3.89617,0,miopenConvolutionFwdAlgoDirect
48-160-160-1x1-64-160-160-48-0x0-1x1-1x1-0-NCHW-FP16-F=ConvBinWinogradRxSf2x3g1:1.48544,0,miopenConvolutionFwdAlgoWinograd;ConvBinWinogradRxSf3x2:0.869122,0,miopenConvolutionFwdAlgoWinograd;GemmFwd1x1_0_1:0.33456,0,miopenConvolutionFwdAlgoGEMM;ConvDirectNaiveConvFwd:14.4746,0,miopenConvolutionFwdAlgoDirect
64-160-160-3x3-64-80-80-48-1x1-2x2-1x1-0-NCHW-FP16-F=ConvBinWinogradRxSf2x3g1:1.69136,0,miopenConvolutionFwdAlgoWinograd;ConvBinWinogradRxSf3x2:0.949922,0,miopenConvolutionFwdAlgoWinograd;GemmFwdRest:2.83392,7372800,miopenConvolutionFwdAlgoGEMM;ConvDirectNaiveConvFwd:27.662,0,miopenConvolutionFwdAlgoDirect
64-80-80-1x1-64-80-80-48-0x0-1x1-1x1-0-NCHW-FP16-F=ConvBinWinogradRxSf2x3g1:0.496001,0,miopenConvolutionFwdAlgoWinograd;ConvBinWinogradRxSf3x2:0.295841,0,miopenConvolutionFwdAlgoWinograd;GemmFwd1x1_0_1:0.11248,0,miopenConvolutionFwdAlgoGEMM;ConvDirectNaiveConvFwd:4.77233,0,miopenConvolutionFwdAlgoDirect
32-80-80-3x3-16-80-80-48-1x1-1x1-1x1-0-NCHW-FP16-F=ConvBinWinogradRxSf2x3g1:0.175521,0,miopenConvolutionFwdAlgoWinograd;ConvBinWinogradRxSf3x2:0.25184,0,miopenConvolutionFwdAlgoWinograd;GemmFwdRest:1.8432,3686400,miopenConvolutionFwdAlgoGEMM;ConvDirectNaiveConvFwd:3.78369,0,miopenConvolutionFwdAlgoDirect
16-80-80-3x3-32-80-80-48-1x1-1x1-1x1-0-NCHW-FP16-F=ConvBinWinogradRxSf2x3g1:0.13424,0,miopenConvolutionFwdAlgoWinograd;ConvBinWinogradRxSf3x2:0.177441,0,miopenConvolutionFwdAlgoWinograd;GemmFwdRest:1.41312,1843200,miopenConvolutionFwdAlgoGEMM;ConvDirectNaiveConvFwd:3.32529,0,miopenConvolutionFwdAlgoDirect
96-80-80-1x1-128-80-80-48-0x0-1x1-1x1-0-NCHW-FP16-F=ConvBinWinogradRxSf2x3g1:1.29408,0,miopenConvolutionFwdAlgoWinograd;ConvBinWinogradRxSf3x2:0.703201,0,miopenConvolutionFwdAlgoWinograd;GemmFwd1x1_0_1:0.150241,0,miopenConvolutionFwdAlgoGEMM;ConvDirectNaiveConvFwd:13.2571,0,miopenConvolutionFwdAlgoDirect
128-80-80-3x3-128-40-40-48-1x1-2x2-1x1-0-NCHW-FP16-F=ConvBinWinogradRxSf2x3g1:1.67088,0,miopenConvolutionFwdAlgoWinograd;ConvBinWinogradRxSf3x2:0.989442,0,miopenConvolutionFwdAlgoWinograd;GemmFwdRest:2.60352,3686400,miopenConvolutionFwdAlgoGEMM;ConvDirectNaiveConvFwd:28.4148,0,miopenConvolutionFwdAlgoDirect
128-40-40-1x1-128-40-40-48-0x0-1x1-1x1-0-NCHW-FP16-F=ConvBinWinogradRxSf2x3g1:0.455201,0,miopenConvolutionFwdAlgoWinograd;ConvBinWinogradRxSf3x2:0.273761,0,miopenConvolutionFwdAlgoWinograd;GemmFwd1x1_0_1:0.1272,0,miopenConvolutionFwdAlgoGEMM;ConvDirectNaiveConvFwd:4.64241,0,miopenConvolutionFwdAlgoDirect
64-40-40-1x1-32-40-40-48-0x0-1x1-1x1-0-NCHW-FP16-F=ConvBinWinogradRxSf2x3g1:0.09104,0,miopenConvolutionFwdAlgoWinograd;ConvBinWinogradRxSf3x2:0.07648,0,miopenConvolutionFwdAlgoWinograd;GemmFwd1x1_0_1:0.03472,0,miopenConvolutionFwdAlgoGEMM;ConvDirectNaiveConvFwd:0.691842,0,miopenConvolutionFwdAlgoDirect
32-40-40-3x3-32-40-40-48-1x1-1x1-1x1-0-NCHW-FP16-F=ConvBinWinogradRxSf2x3g1:0.0712,0,miopenConvolutionFwdAlgoWinograd;ConvBinWinogradRxSf3x2:0.102081,0,miopenConvolutionFwdAlgoWinograd;GemmFwdRest:1.48224,921600,miopenConvolutionFwdAlgoGEMM;ConvDirectNaiveConvFwd:1.77648,0,miopenConvolutionFwdAlgoDirect
64-40-40-1x1-64-40-40-48-0x0-1x1-1x1-0-NCHW-FP16-F=ConvBinWinogradRxSf2x3g1:0.15024,0,miopenConvolutionFwdAlgoWinograd;ConvBinWinogradRxSf3x2:0.10784,0,miopenConvolutionFwdAlgoWinograd;GemmFwd1x1_0_1:0.055041,0,miopenConvolutionFwdAlgoGEMM;ConvDirectNaiveConvFwd:1.26128,0,miopenConvolutionFwdAlgoDirect
192-40-40-1x1-128-40-40-48-0x0-1x1-1x1-0-NCHW-FP16-F=ConvBinWinogradRxSf2x3g1:0.639521,0,miopenConvolutionFwdAlgoWinograd;ConvBinWinogradRxSf3x2:0.36368,0,miopenConvolutionFwdAlgoWinograd;GemmFwd1x1_0_1:0.140801,0,miopenConvolutionFwdAlgoGEMM;ConvDirectNaiveConvFwd:6.92978,0,miopenConvolutionFwdAlgoDirect
128-40-40-3x3-256-20-20-48-1x1-2x2-1x1-0-NCHW-FP16-F=ConvBinWinogradRxSf2x3g1:0.876482,0,miopenConvolutionFwdAlgoWinograd;ConvBinWinogradRxSf3x2:0.548161,0,miopenConvolutionFwdAlgoWinograd;GemmFwdRest:1.85856,921600,miopenConvolutionFwdAlgoGEMM;ConvDirectNaiveConvFwd:16.853,0,miopenConvolutionFwdAlgoDirect
256-20-20-1x1-256-20-20-48-0x0-1x1-1x1-0-NCHW-FP16-F=ConvBinWinogradRxSf2x3g1:0.433761,0,miopenConvolutionFwdAlgoWinograd;ConvBinWinogradRxSf3x2:0.27024,0,miopenConvolutionFwdAlgoWinograd;GemmFwd1x1_0_1:0.174721,0,miopenConvolutionFwdAlgoGEMM;ConvDirectNaiveConvFwd:5.05409,0,miopenConvolutionFwdAlgoDirect
128-20-20-1x1-64-20-20-48-0x0-1x1-1x1-0-NCHW-FP16-F=ConvBinWinogradRxSf2x3g1:0.08496,0,miopenConvolutionFwdAlgoWinograd;ConvBinWinogradRxSf3x2:0.0776,0,miopenConvolutionFwdAlgoWinograd;GemmFwd1x1_0_1:0.03136,0,miopenConvolutionFwdAlgoGEMM;ConvDirectNaiveConvFwd:0.723681,0,miopenConvolutionFwdAlgoDirect
64-20-20-3x3-64-20-20-48-1x1-1x1-1x1-0-NCHW-FP16-F=ConvBinWinogradRxSf2x3g1:0.063521,0,miopenConvolutionFwdAlgoWinograd;ConvBinWinogradRxSf3x2:0.1104,0,miopenConvolutionFwdAlgoWinograd;GemmFwdRest:1.42848,460800,miopenConvolutionFwdAlgoGEMM;ConvDirectNaiveConvFwd:1.73344,0,miopenConvolutionFwdAlgoDirect
128-20-20-1x1-128-20-20-48-0x0-1x1-1x1-0-NCHW-FP16-F=ConvBinWinogradRxSf2x3g1:0.136,0,miopenConvolutionFwdAlgoWinograd;ConvBinWinogradRxSf3x2:0.1024,0,miopenConvolutionFwdAlgoWinograd;GemmFwd1x1_0_1:0.06864,0,miopenConvolutionFwdAlgoGEMM;ConvDirectNaiveConvFwd:1.33856,0,miopenConvolutionFwdAlgoDirect
384-20-20-1x1-256-20-20-48-0x0-1x1-1x1-0-NCHW-FP16-F=ConvBinWinogradRxSf2x3g1:0.620801,0,miopenConvolutionFwdAlgoWinograd;ConvBinWinogradRxSf3x2:0.354401,0,miopenConvolutionFwdAlgoWinograd;GemmFwd1x1_0_1:0.07888,0,miopenConvolutionFwdAlgoGEMM;ConvDirectNaiveConvFwd:7.54802,0,miopenConvolutionFwdAlgoDirect
128-20-20-1x1-256-20-20-48-0x0-1x1-1x1-0-NCHW-FP16-F=ConvBinWinogradRxSf2x3g1:0.2424,0,miopenConvolutionFwdAlgoWinograd;ConvBinWinogradRxSf3x2:0.16096,0,miopenConvolutionFwdAlgoWinograd;GemmFwd1x1_0_1:0.10928,0,miopenConvolutionFwdAlgoGEMM;ConvDirectNaiveConvFwd:2.54273,0,miopenConvolutionFwdAlgoDirect
128-20-20-3x3-128-20-20-48-1x1-1x1-1x1-0-NCHW-FP16-F_g128=ConvBinWinogradRxSf2x3:0.506401,0,miopenConvolutionFwdAlgoWinograd;ConvBinWinogradRxSf3x2:0.632482,0,miopenConvolutionFwdAlgoWinograd;GemmFwdRest:1.67424,921600,miopenConvolutionFwdAlgoGEMM;ConvDirectNaiveConvFwd:0.08608,0,miopenConvolutionFwdAlgoDirect
256-20-20-1x1-128-20-20-48-0x0-1x1-1x1-0-NCHW-FP16-F=ConvBinWinogradRxSf2x3g1:0.230561,0,miopenConvolutionFwdAlgoWinograd;ConvBinWinogradRxSf3x2:0.15248,0,miopenConvolutionFwdAlgoWinograd;GemmFwd1x1_0_1:0.08976,0,miopenConvolutionFwdAlgoGEMM;ConvDirectNaiveConvFwd:2.64961,0,miopenConvolutionFwdAlgoDirect
256-20-20-1x1-1280-20-20-48-0x0-1x1-1x1-0-NCHW-FP16-F=ConvBinWinogradRxSf2x3g1:1.95952,0,miopenConvolutionFwdAlgoWinograd;ConvBinWinogradRxSf3x2:1.08864,0,miopenConvolutionFwdAlgoWinograd;GemmFwd1x1_0_1:0.25232,0,miopenConvolutionFwdAlgoGEMM;ConvDirectNaiveConvFwd:23.4762,0,miopenConvolutionFwdAlgoDirect
3-640-640-3x3-16-320-320-1-1x1-2x2-1x1-0-NCHW-FP16-F=ConvBinWinogradRxSf2x3g1:0.08032,0,miopenConvolutionFwdAlgoWinograd;ConvBinWinogradRxSf3x2:0.08144,0,miopenConvolutionFwdAlgoWinograd;GemmFwdRest:0.087521,5529600,miopenConvolutionFwdAlgoGEMM;ConvDirectNaiveConvFwd:3.37361,0,miopenConvolutionFwdAlgoDirect
16-320-320-3x3-32-160-160-1-1x1-2x2-1x1-0-NCHW-FP16-F=ConvBinWinogradRxSf2x3g1:0.0552,0,miopenConvolutionFwdAlgoWinograd;ConvBinWinogradRxSf3x2:0.05184,0,miopenConvolutionFwdAlgoWinograd;GemmFwdRest:0.051361,7372800,miopenConvolutionFwdAlgoGEMM;ConvDirectNaiveConvFwd:4.01489,0,miopenConvolutionFwdAlgoDirect
32-160-160-1x1-32-160-160-1-0x0-1x1-1x1-0-NCHW-FP16-F=ConvBinWinogradRxSf2x3g1:0.04512,0,miopenConvolutionFwdAlgoWinograd;ConvBinWinogradRxSf3x2:0.0496,0,miopenConvolutionFwdAlgoWinograd;GemmFwd1x1_0_1:0.02064,0,miopenConvolutionFwdAlgoGEMM;ConvDirectNaiveConvFwd:1.86864,0,miopenConvolutionFwdAlgoDirect
16-160-160-3x3-8-160-160-1-1x1-1x1-1x1-0-NCHW-FP16-F=ConvBinWinogradRxSf2x3g1:0.03872,0,miopenConvolutionFwdAlgoWinograd;ConvBinWinogradRxSf3x2:0.04704,0,miopenConvolutionFwdAlgoWinograd;GemmFwdRest:0.0424,7372800,miopenConvolutionFwdAlgoGEMM;ConvDirectNaiveConvFwd:4.12529,0,miopenConvolutionFwdAlgoDirect
8-160-160-3x3-16-160-160-1-1x1-1x1-1x1-0-NCHW-FP16-F=ConvBinWinogradRxSf2x3g1:0.036481,0,miopenConvolutionFwdAlgoWinograd;ConvBinWinogradRxSf3x2:0.04448,0,miopenConvolutionFwdAlgoWinograd;GemmFwdRest:0.032,3686400,miopenConvolutionFwdAlgoGEMM;ConvDirectNaiveConvFwd:1.93201,0,miopenConvolutionFwdAlgoDirect
48-160-160-1x1-64-160-160-1-0x0-1x1-1x1-0-NCHW-FP16-F=ConvBinWinogradRxSf2x3g1:0.06432,0,miopenConvolutionFwdAlgoWinograd;ConvBinWinogradRxSf3x2:0.06256,0,miopenConvolutionFwdAlgoWinograd;GemmFwd1x1_0_1:0.02224,0,miopenConvolutionFwdAlgoGEMM;ConvDirectNaiveConvFwd:2.90113,0,miopenConvolutionFwdAlgoDirect
64-160-160-3x3-64-80-80-1-1x1-2x2-1x1-0-NCHW-FP16-F=ConvBinWinogradRxSf2x3g1:0.075201,0,miopenConvolutionFwdAlgoWinograd;ConvBinWinogradRxSf3x2:0.08256,0,miopenConvolutionFwdAlgoWinograd;GemmFwdRest:0.05744,7372800,miopenConvolutionFwdAlgoGEMM;ConvDirectNaiveConvFwd:4.61009,0,miopenConvolutionFwdAlgoDirect
64-80-80-1x1-64-80-80-1-0x0-1x1-1x1-0-NCHW-FP16-F=ConvBinWinogradRxSf2x3g1:0.0504,0,miopenConvolutionFwdAlgoWinograd;ConvBinWinogradRxSf3x2:0.06032,0,miopenConvolutionFwdAlgoWinograd;GemmFwd1x1_0_1:0.01712,0,miopenConvolutionFwdAlgoGEMM;ConvDirectNaiveConvFwd:0.963842,0,miopenConvolutionFwdAlgoDirect
32-80-80-3x3-16-80-80-1-1x1-1x1-1x1-0-NCHW-FP16-F=ConvBinWinogradRxSf2x3g1:0.03984,0,miopenConvolutionFwdAlgoWinograd;ConvBinWinogradRxSf3x2:0.05552,0,miopenConvolutionFwdAlgoWinograd;GemmFwdRest:0.04064,3686400,miopenConvolutionFwdAlgoGEMM;ConvDirectNaiveConvFwd:1.87809,0,miopenConvolutionFwdAlgoDirect
16-80-80-3x3-32-80-80-1-1x1-1x1-1x1-0-NCHW-FP16-F=ConvBinWinogradRxSf2x3g1:0.0416,0,miopenConvolutionFwdAlgoWinograd;ConvBinWinogradRxSf3x2:0.05008,0,miopenConvolutionFwdAlgoWinograd;GemmFwdRest:0.03008,1843200,miopenConvolutionFwdAlgoGEMM;ConvDirectNaiveConvFwd:0.927682,0,miopenConvolutionFwdAlgoDirect
96-80-80-1x1-128-80-80-1-0x0-1x1-1x1-0-NCHW-FP16-F=ConvBinWinogradRxSf2x3g1:0.06576,0,miopenConvolutionFwdAlgoWinograd;ConvBinWinogradRxSf3x2:0.06224,0,miopenConvolutionFwdAlgoWinograd;GemmFwd1x1_0_1:0.0272,0,miopenConvolutionFwdAlgoGEMM;ConvDirectNaiveConvFwd:1.46608,0,miopenConvolutionFwdAlgoDirect
128-80-80-3x3-128-40-40-1-1x1-2x2-1x1-0-NCHW-FP16-F=ConvBinWinogradRxSf2x3g1:0.10688,0,miopenConvolutionFwdAlgoWinograd;ConvBinWinogradRxSf3x2:0.117281,0,miopenConvolutionFwdAlgoWinograd;GemmFwdRest:0.05312,3686400,miopenConvolutionFwdAlgoGEMM;ConvDirectNaiveConvFwd:2.61169,0,miopenConvolutionFwdAlgoDirect
128-40-40-1x1-128-40-40-1-0x0-1x1-1x1-0-NCHW-FP16-F=ConvBinWinogradRxSf2x3g1:0.06048,0,miopenConvolutionFwdAlgoWinograd;ConvBinWinogradRxSf3x2:0.07056,0,miopenConvolutionFwdAlgoWinograd;GemmFwd1x1_0_1:0.0184,0,miopenConvolutionFwdAlgoGEMM;ConvDirectNaiveConvFwd:0.546561,0,miopenConvolutionFwdAlgoDirect
64-40-40-1x1-32-40-40-1-0x0-1x1-1x1-0-NCHW-FP16-F=ConvBinWinogradRxSf2x3g1:0.04128,0,miopenConvolutionFwdAlgoWinograd;ConvBinWinogradRxSf3x2:0.05168,0,miopenConvolutionFwdAlgoWinograd;GemmFwd1x1_0_1:0.01568,0,miopenConvolutionFwdAlgoGEMM;ConvDirectNaiveConvFwd:0.276801,0,miopenConvolutionFwdAlgoDirect
32-40-40-3x3-32-40-40-1-1x1-1x1-1x1-0-NCHW-FP16-F=ConvBinWinogradRxSf2x3g1:0.04096,0,miopenConvolutionFwdAlgoWinograd;ConvBinWinogradRxSf3x2:0.06016,0,miopenConvolutionFwdAlgoWinograd;GemmFwdRest:0.03024,921600,miopenConvolutionFwdAlgoGEMM;ConvDirectNaiveConvFwd:0.560161,0,miopenConvolutionFwdAlgoDirect
64-40-40-1x1-64-40-40-1-0x0-1x1-1x1-0-NCHW-FP16-F=ConvBinWinogradRxSf2x3g1:0.04672,0,miopenConvolutionFwdAlgoWinograd;ConvBinWinogradRxSf3x2:0.05344,0,miopenConvolutionFwdAlgoWinograd;GemmFwd1x1_0_1:0.01568,0,miopenConvolutionFwdAlgoGEMM;ConvDirectNaiveConvFwd:0.284,0,miopenConvolutionFwdAlgoDirect
192-40-40-1x1-128-40-40-1-0x0-1x1-1x1-0-NCHW-FP16-F=ConvBinWinogradRxSf2x3g1:0.05856,0,miopenConvolutionFwdAlgoWinograd;ConvBinWinogradRxSf3x2:0.06544,0,miopenConvolutionFwdAlgoWinograd;GemmFwd1x1_0_1:0.01824,0,miopenConvolutionFwdAlgoGEMM;ConvDirectNaiveConvFwd:0.806562,0,miopenConvolutionFwdAlgoDirect
128-40-40-3x3-256-20-20-1-1x1-2x2-1x1-0-NCHW-FP16-F=ConvBinWinogradRxSf2x3g1:0.11008,0,miopenConvolutionFwdAlgoWinograd;ConvBinWinogradRxSf3x2:0.1208,0,miopenConvolutionFwdAlgoWinograd;GemmFwdRest:0.03984,921600,miopenConvolutionFwdAlgoGEMM;ConvDirectNaiveConvFwd:0.783682,0,miopenConvolutionFwdAlgoDirect
256-20-20-1x1-256-20-20-1-0x0-1x1-1x1-0-NCHW-FP16-F=ConvBinWinogradRxSf2x3g1:0.0768,0,miopenConvolutionFwdAlgoWinograd;ConvBinWinogradRxSf3x2:0.085601,0,miopenConvolutionFwdAlgoWinograd;GemmFwd1x1_0_1:0.01776,0,miopenConvolutionFwdAlgoGEMM;ConvDirectNaiveConvFwd:0.318241,0,miopenConvolutionFwdAlgoDirect
128-20-20-1x1-64-20-20-1-0x0-1x1-1x1-0-NCHW-FP16-F=ConvBinWinogradRxSf2x3g1:0.05168,0,miopenConvolutionFwdAlgoWinograd;ConvBinWinogradRxSf3x2:0.0592,0,miopenConvolutionFwdAlgoWinograd;GemmFwd1x1_0_1:0.0184,0,miopenConvolutionFwdAlgoGEMM;ConvDirectNaiveConvFwd:0.164481,0,miopenConvolutionFwdAlgoDirect
64-20-20-3x3-64-20-20-1-1x1-1x1-1x1-0-NCHW-FP16-F=ConvBinWinogradRxSf2x3g1:0.04208,0,miopenConvolutionFwdAlgoWinograd;ConvBinWinogradRxSf3x2:0.073281,0,miopenConvolutionFwdAlgoWinograd;GemmFwdRest:0.02976,460800,miopenConvolutionFwdAlgoGEMM;ConvDirectNaiveConvFwd:0.307361,0,miopenConvolutionFwdAlgoDirect
128-20-20-1x1-128-20-20-1-0x0-1x1-1x1-0-NCHW-FP16-F=ConvBinWinogradRxSf2x3g1:0.052,0,miopenConvolutionFwdAlgoWinograd;ConvBinWinogradRxSf3x2:0.05936,0,miopenConvolutionFwdAlgoWinograd;GemmFwd1x1_0_1:0.01696,0,miopenConvolutionFwdAlgoGEMM;ConvDirectNaiveConvFwd:0.17008,0,miopenConvolutionFwdAlgoDirect
384-20-20-1x1-256-20-20-1-0x0-1x1-1x1-0-NCHW-FP16-F=ConvBinWinogradRxSf2x3g1:0.07808,0,miopenConvolutionFwdAlgoWinograd;ConvBinWinogradRxSf3x2:0.08576,0,miopenConvolutionFwdAlgoWinograd;GemmFwd1x1_0_1:0.0328,0,miopenConvolutionFwdAlgoGEMM;ConvDirectNaiveConvFwd:0.466722,0,miopenConvolutionFwdAlgoDirect
128-20-20-1x1-256-20-20-1-0x0-1x1-1x1-0-NCHW-FP16-F=ConvBinWinogradRxSf2x3g1:0.05216,0,miopenConvolutionFwdAlgoWinograd;ConvBinWinogradRxSf3x2:0.05952,0,miopenConvolutionFwdAlgoWinograd;GemmFwd1x1_0_1:0.01664,0,miopenConvolutionFwdAlgoGEMM;ConvDirectNaiveConvFwd:0.164481,0,miopenConvolutionFwdAlgoDirect
128-20-20-3x3-128-20-20-1-1x1-1x1-1x1-0-NCHW-FP16-F_g128=ConvBinWinogradRxSf2x3:0.082561,0,miopenConvolutionFwdAlgoWinograd;ConvBinWinogradRxSf3x2:0.07824,0,miopenConvolutionFwdAlgoWinograd;GemmFwdRest:0.03456,921600,miopenConvolutionFwdAlgoGEMM;ConvDirectNaiveConvFwd:0.02224,0,miopenConvolutionFwdAlgoDirect
256-20-20-1x1-128-20-20-1-0x0-1x1-1x1-0-NCHW-FP16-F=ConvBinWinogradRxSf2x3g1:0.06864,0,miopenConvolutionFwdAlgoWinograd;ConvBinWinogradRxSf3x2:0.07424,0,miopenConvolutionFwdAlgoWinograd;GemmFwd1x1_0_1:0.01792,0,miopenConvolutionFwdAlgoGEMM;ConvDirectNaiveConvFwd:0.331361,0,miopenConvolutionFwdAlgoDirect
256-20-20-1x1-1280-20-20-1-0x0-1x1-1x1-0-NCHW-FP16-F=ConvBinWinogradRxSf2x3g1:0.0976,0,miopenConvolutionFwdAlgoWinograd;ConvBinWinogradRxSf3x2:0.07504,0,miopenConvolutionFwdAlgoWinograd;GemmFwd1x1_0_1:0.02384,0,miopenConvolutionFwdAlgoGEMM;ConvDirectNaiveConvFwd:0.651682,0,miopenConvolutionFwdAlgoDirect
3-640-640-3x3-16-320-320-1-1x1-2x2-1x1-0-NCHW-FP32-F=ConvBinWinogradRxSf2x3g1:0.07632,0,miopenConvolutionFwdAlgoWinograd;ConvBinWinogradRxSf3x2:0.068161,0,miopenConvolutionFwdAlgoWinograd;ConvAsmImplicitGemmGTCDynamicFwdXdlopsNHWC:0.07072,11470592,miopenConvolutionFwdAlgoImplicitGEMM;GemmFwdRest:0.10624,11059200,miopenConvolutionFwdAlgoGEMM;ConvDirectNaiveConvFwd:3.37137,0,miopenConvolutionFwdAlgoDirect
16-320-320-3x3-32-160-160-1-1x1-2x2-1x1-0-NCHW-FP32-F=ConvBinWinogradRxSf2x3g1:0.06624,0,miopenConvolutionFwdAlgoWinograd;ConvBinWinogradRxSf3x2:0.0584,0,miopenConvolutionFwdAlgoWinograd;ConvAsmImplicitGemmGTCDynamicFwdXdlopsNHWC:0.0616,9848832,miopenConvolutionFwdAlgoImplicitGEMM;GemmFwdRest:0.06416,14745600,miopenConvolutionFwdAlgoGEMM;ConvDirectNaiveConvFwd:4.20545,0,miopenConvolutionFwdAlgoDirect
32-160-160-1x1-32-160-160-1-0x0-1x1-1x1-0-NCHW-FP32-F=ConvBinWinogradRxSf2x3g1:0.04768,0,miopenConvolutionFwdAlgoWinograd;ConvBinWinogradRxSf3x2:0.05216,0,miopenConvolutionFwdAlgoWinograd;ConvAsmImplicitGemmGTCDynamicFwdXdlopsNHWC:0.03936,6553600,miopenConvolutionFwdAlgoImplicitGEMM;GemmFwd1x1_0_1:0.02544,0,miopenConvolutionFwdAlgoGEMM;ConvDirectNaiveConvFwd:1.96048,0,miopenConvolutionFwdAlgoDirect
16-160-160-3x3-8-160-160-1-1x1-1x1-1x1-0-NCHW-FP32-F=ConvBinWinogradRxSf2x3g1:0.04352,0,miopenConvolutionFwdAlgoWinograd;ConvBinWinogradRxSf3x2:0.0584,0,miopenConvolutionFwdAlgoWinograd;ConvAsmImplicitGemmGTCDynamicFwdXdlopsNHWC:0.04784,2462208,miopenConvolutionFwdAlgoImplicitGEMM;GemmFwdRest:0.064,14745600,miopenConvolutionFwdAlgoGEMM;ConvDirectNaiveConvFwd:4.37489,0,miopenConvolutionFwdAlgoDirect
8-160-160-3x3-16-160-160-1-1x1-1x1-1x1-0-NCHW-FP32-F=ConvBinWinogradRxSf2x3g1:0.04176,0,miopenConvolutionFwdAlgoWinograd;ConvBinWinogradRxSf3x2:0.05072,0,miopenConvolutionFwdAlgoWinograd;ConvAsmImplicitGemmGTCDynamicFwdXdlopsNHWC:0.04608,2462208,miopenConvolutionFwdAlgoImplicitGEMM;GemmFwdRest:0.04272,7372800,miopenConvolutionFwdAlgoGEMM;ConvDirectNaiveConvFwd:2.14945,0,miopenConvolutionFwdAlgoDirect
48-160-160-1x1-64-160-160-1-0x0-1x1-1x1-0-NCHW-FP32-F=ConvBinWinogradRxSf2x3g1:0.08096,0,miopenConvolutionFwdAlgoWinograd;ConvBinWinogradRxSf3x2:0.0696,0,miopenConvolutionFwdAlgoWinograd;ConvAsmImplicitGemmGTCDynamicFwdXdlopsNHWC:0.05184,11468800,miopenConvolutionFwdAlgoImplicitGEMM;GemmFwd1x1_0_1:0.02464,0,miopenConvolutionFwdAlgoGEMM;ConvDirectNaiveConvFwd:2.93729,0,miopenConvolutionFwdAlgoDirect
64-160-160-3x3-64-80-80-1-1x1-2x2-1x1-0-NCHW-FP32-F=ConvBinWinogradRxSf2x3g1:0.09264,0,miopenConvolutionFwdAlgoWinograd;ConvBinWinogradRxSf3x2:0.09904,0,miopenConvolutionFwdAlgoWinograd;ConvAsmImplicitGemmGTCDynamicFwdXdlopsNHWC:0.06768,8339456,miopenConvolutionFwdAlgoImplicitGEMM;GemmFwdRest:0.064,14745600,miopenConvolutionFwdAlgoGEMM;ConvDirectNaiveConvFwd:4.29473,0,miopenConvolutionFwdAlgoDirect
64-80-80-1x1-64-80-80-1-0x0-1x1-1x1-0-NCHW-FP32-F=ConvBinWinogradRxSf2x3g1:0.05056,0,miopenConvolutionFwdAlgoWinograd;ConvBinWinogradRxSf3x2:0.05664,0,miopenConvolutionFwdAlgoWinograd;ConvAsmImplicitGemmGTCDynamicFwdXdlopsNHWC:0.032961,3276800,miopenConvolutionFwdAlgoImplicitGEMM;GemmFwd1x1_0_1:0.02016,0,miopenConvolutionFwdAlgoGEMM;ConvDirectNaiveConvFwd:1.01248,0,miopenConvolutionFwdAlgoDirect
32-80-80-3x3-16-80-80-1-1x1-1x1-1x1-0-NCHW-FP32-F=ConvBinWinogradRxSf2x3g1:0.041601,0,miopenConvolutionFwdAlgoWinograd;ConvBinWinogradRxSf3x2:0.07008,0,miopenConvolutionFwdAlgoWinograd;ConvAsmImplicitGemmGTCDynamicFwdXdlopsNHWC:0.03744,1247232,miopenConvolutionFwdAlgoImplicitGEMM;GemmFwdRest:0.03952,7372800,miopenConvolutionFwdAlgoGEMM;ConvDirectNaiveConvFwd:2.06176,0,miopenConvolutionFwdAlgoDirect
16-80-80-3x3-32-80-80-1-1x1-1x1-1x1-0-NCHW-FP32-F=ConvBinWinogradRxSf2x3g1:0.028,0,miopenConvolutionFwdAlgoWinograd;ConvBinWinogradRxSf3x2:0.04416,0,miopenConvolutionFwdAlgoWinograd;ConvAsmImplicitGemmGTCDynamicFwdXdlopsNHWC:0.040801,1247232,miopenConvolutionFwdAlgoImplicitGEMM;GemmFwdRest:0.03328,3686400,miopenConvolutionFwdAlgoGEMM;ConvDirectNaiveConvFwd:1.0224,0,miopenConvolutionFwdAlgoDirect
96-80-80-1x1-128-80-80-1-0x0-1x1-1x1-0-NCHW-FP32-F=ConvBinWinogradRxSf2x3g1:0.07712,0,miopenConvolutionFwdAlgoWinograd;ConvBinWinogradRxSf3x2:0.06496,0,miopenConvolutionFwdAlgoWinograd;ConvAsmImplicitGemmGTCDynamicFwdXdlopsNHWC:0.04592,5734400,miopenConvolutionFwdAlgoImplicitGEMM;GemmFwd1x1_0_1:0.02304,0,miopenConvolutionFwdAlgoGEMM;ConvDirectNaiveConvFwd:1.53376,0,miopenConvolutionFwdAlgoDirect
128-80-80-3x3-128-40-40-1-1x1-2x2-1x1-0-NCHW-FP32-F=ConvBinWinogradRxSf2x3g1:0.14256,0,miopenConvolutionFwdAlgoWinograd;ConvBinWinogradRxSf3x2:0.150081,0,miopenConvolutionFwdAlgoWinograd;ConvAsmImplicitGemmGTCDynamicFwdXdlopsNHWC:0.05216,4685824,miopenConvolutionFwdAlgoImplicitGEMM;GemmFwdRest:0.0576,7372800,miopenConvolutionFwdAlgoGEMM;ConvDirectNaiveConvFwd:2.58177,0,miopenConvolutionFwdAlgoDirect
128-40-40-1x1-128-40-40-1-0x0-1x1-1x1-0-NCHW-FP32-F=ConvBinWinogradRxSf2x3g1:0.06336,0,miopenConvolutionFwdAlgoWinograd;ConvBinWinogradRxSf3x2:0.06944,0,miopenConvolutionFwdAlgoWinograd;ConvAsmImplicitGemmGTCDynamicFwdXdlopsNHWC:0.02928,1638400,miopenConvolutionFwdAlgoImplicitGEMM;GemmFwd1x1_0_1:0.02112,0,miopenConvolutionFwdAlgoGEMM;ConvDirectNaiveConvFwd:0.593921,0,miopenConvolutionFwdAlgoDirect
64-40-40-1x1-32-40-40-1-0x0-1x1-1x1-0-NCHW-FP32-F=ConvBinWinogradRxSf2x3g1:0.0504,0,miopenConvolutionFwdAlgoWinograd;ConvBinWinogradRxSf3x2:0.05664,0,miopenConvolutionFwdAlgoWinograd;ConvAsmImplicitGemmGTCDynamicFwdXdlopsNHWC:0.0256,614400,miopenConvolutionFwdAlgoImplicitGEMM;GemmFwd1x1_0_1:0.02032,0,miopenConvolutionFwdAlgoGEMM;ConvDirectNaiveConvFwd:0.2912,0,miopenConvolutionFwdAlgoDirect
32-40-40-3x3-32-40-40-1-1x1-1x1-1x1-0-NCHW-FP32-F=ConvBinWinogradRxSf2x3g1:0.04368,0,miopenConvolutionFwdAlgoWinograd;ConvBinWinogradRxSf3x2:0.06912,0,miopenConvolutionFwdAlgoWinograd;ConvAsmImplicitGemmGTCDynamicFwdXdlopsNHWC:0.03488,446464,miopenConvolutionFwdAlgoImplicitGEMM;GemmFwdRest:0.03344,1843200,miopenConvolutionFwdAlgoGEMM;ConvDirectNaiveConvFwd:0.620001,0,miopenConvolutionFwdAlgoDirect
64-40-40-1x1-64-40-40-1-0x0-1x1-1x1-0-NCHW-FP32-F=ConvBinWinogradRxSf2x3g1:0.049281,0,miopenConvolutionFwdAlgoWinograd;ConvBinWinogradRxSf3x2:0.0576,0,miopenConvolutionFwdAlgoWinograd;ConvAsmImplicitGemmGTCDynamicFwdXdlopsNHWC:0.02704,819200,miopenConvolutionFwdAlgoImplicitGEMM;GemmFwd1x1_0_1:0.01968,0,miopenConvolutionFwdAlgoGEMM;ConvDirectNaiveConvFwd:0.295681,0,miopenConvolutionFwdAlgoDirect
192-40-40-1x1-128-40-40-1-0x0-1x1-1x1-0-NCHW-FP32-F=ConvBinWinogradRxSf2x3g1:0.06496,0,miopenConvolutionFwdAlgoWinograd;ConvBinWinogradRxSf3x2:0.06704,0,miopenConvolutionFwdAlgoWinograd;ConvAsmImplicitGemmGTCDynamicFwdXdlopsNHWC:0.03216,2048000,miopenConvolutionFwdAlgoImplicitGEMM;GemmFwd1x1_0_1:0.02272,0,miopenConvolutionFwdAlgoGEMM;ConvDirectNaiveConvFwd:0.873922,0,miopenConvolutionFwdAlgoDirect
128-40-40-3x3-256-20-20-1-1x1-2x2-1x1-0-NCHW-FP32-F=ConvBinWinogradRxSf2x3g1:0.14272,0,miopenConvolutionFwdAlgoWinograd;ConvBinWinogradRxSf3x2:0.1488,0,miopenConvolutionFwdAlgoWinograd;ConvAsmImplicitGemmGTCDynamicFwdXdlopsNHWC:0.05184,2408448,miopenConvolutionFwdAlgoImplicitGEMM;GemmFwdRest:0.04256,1843200,miopenConvolutionFwdAlgoGEMM;ConvDirectNaiveConvFwd:0.740322,0,miopenConvolutionFwdAlgoDirect
256-20-20-1x1-256-20-20-1-0x0-1x1-1x1-0-NCHW-FP32-F=ConvBinWinogradRxSf2x3g1:0.087681,0,miopenConvolutionFwdAlgoWinograd;ConvBinWinogradRxSf3x2:0.09424,0,miopenConvolutionFwdAlgoWinograd;ConvAsmImplicitGemmGTCDynamicFwdXdlopsNHWC:0.0304,819200,miopenConvolutionFwdAlgoImplicitGEMM;GemmFwd1x1_0_1:0.02208,0,miopenConvolutionFwdAlgoGEMM;ConvDirectNaiveConvFwd:0.33536,0,miopenConvolutionFwdAlgoDirect
128-20-20-1x1-64-20-20-1-0x0-1x1-1x1-0-NCHW-FP32-F=ConvBinWinogradRxSf2x3g1:0.06288,0,miopenConvolutionFwdAlgoWinograd;ConvBinWinogradRxSf3x2:0.07024,0,miopenConvolutionFwdAlgoWinograd;ConvAsmImplicitGemmGTCDynamicFwdXdlopsNHWC:0.02576,307200,miopenConvolutionFwdAlgoImplicitGEMM;GemmFwd1x1_0_1:0.01984,0,miopenConvolutionFwdAlgoGEMM;ConvDirectNaiveConvFwd:0.17104,0,miopenConvolutionFwdAlgoDirect
64-20-20-3x3-64-20-20-1-1x1-1x1-1x1-0-NCHW-FP32-F=ConvBinWinogradRxSf2x3g1:0.03408,0,miopenConvolutionFwdAlgoWinograd;ConvBinWinogradRxSf3x2:0.074721,0,miopenConvolutionFwdAlgoWinograd;ConvAsmImplicitGemmGTCDynamicFwdXdlopsNHWC:0.03632,352256,miopenConvolutionFwdAlgoImplicitGEMM;GemmFwdRest:0.03472,921600,miopenConvolutionFwdAlgoGEMM;ConvDirectNaiveConvFwd:0.339201,0,miopenConvolutionFwdAlgoDirect
128-20-20-1x1-128-20-20-1-0x0-1x1-1x1-0-NCHW-FP32-F=ConvBinWinogradRxSf2x3g1:0.05184,0,miopenConvolutionFwdAlgoWinograd;ConvBinWinogradRxSf3x2:0.0528,0,miopenConvolutionFwdAlgoWinograd;ConvAsmImplicitGemmGTCDynamicFwdXdlopsNHWC:0.02416,409600,miopenConvolutionFwdAlgoImplicitGEMM;GemmFwd1x1_0_1:0.01936,0,miopenConvolutionFwdAlgoGEMM;ConvDirectNaiveConvFwd:0.174401,0,miopenConvolutionFwdAlgoDirect
384-20-20-1x1-256-20-20-1-0x0-1x1-1x1-0-NCHW-FP32-F=ConvBinWinogradRxSf2x3g1:0.10384,0,miopenConvolutionFwdAlgoWinograd;ConvBinWinogradRxSf3x2:0.104,0,miopenConvolutionFwdAlgoWinograd;ConvAsmImplicitGemmGTCDynamicFwdXdlopsNHWC:0.02976,1024000,miopenConvolutionFwdAlgoImplicitGEMM;GemmFwd1x1_0_1:0.02656,0,miopenConvolutionFwdAlgoGEMM;ConvDirectNaiveConvFwd:0.497921,0,miopenConvolutionFwdAlgoDirect
128-20-20-1x1-256-20-20-1-0x0-1x1-1x1-0-NCHW-FP32-F=ConvBinWinogradRxSf2x3g1:0.05296,0,miopenConvolutionFwdAlgoWinograd;ConvBinWinogradRxSf3x2:0.0528,0,miopenConvolutionFwdAlgoWinograd;ConvAsmImplicitGemmGTCDynamicFwdXdlopsNHWC:0.02528,614400,miopenConvolutionFwdAlgoImplicitGEMM;GemmFwd1x1_0_1:0.01936,0,miopenConvolutionFwdAlgoGEMM;ConvDirectNaiveConvFwd:0.17744,0,miopenConvolutionFwdAlgoDirect
128-20-20-3x3-128-20-20-1-1x1-1x1-1x1-0-NCHW-FP32-F_g128=ConvBinWinogradRxSf2x3:0.070561,0,miopenConvolutionFwdAlgoWinograd;ConvBinWinogradRxSf3x2:0.07376,0,miopenConvolutionFwdAlgoWinograd;GemmFwdRest:0.04032,1843200,miopenConvolutionFwdAlgoGEMM;ConvDirectNaiveConvFwd:0.0232,0,miopenConvolutionFwdAlgoDirect
256-20-20-1x1-128-20-20-1-0x0-1x1-1x1-0-NCHW-FP32-F=ConvBinWinogradRxSf2x3g1:0.07904,0,miopenConvolutionFwdAlgoWinograd;ConvBinWinogradRxSf3x2:0.07504,0,miopenConvolutionFwdAlgoWinograd;ConvAsmImplicitGemmGTCDynamicFwdXdlopsNHWC:0.02608,614400,miopenConvolutionFwdAlgoImplicitGEMM;GemmFwd1x1_0_1:0.02144,0,miopenConvolutionFwdAlgoGEMM;ConvDirectNaiveConvFwd:0.334401,0,miopenConvolutionFwdAlgoDirect
256-20-20-1x1-1280-20-20-1-0x0-1x1-1x1-0-NCHW-FP32-F=ConvBinWinogradRxSf2x3g1:0.13264,0,miopenConvolutionFwdAlgoWinograd;ConvBinWinogradRxSf3x2:0.08192,0,miopenConvolutionFwdAlgoWinograd;ConvAsmImplicitGemmGTCDynamicFwdXdlopsNHWC:0.053441,2457600,miopenConvolutionFwdAlgoImplicitGEMM;GemmFwd1x1_0_1:0.02704,0,miopenConvolutionFwdAlgoGEMM;ConvDirectNaiveConvFwd:0.647682,0,miopenConvolutionFwdAlgoDirect
3-640-640-3x3-16-320-320-16-1x1-2x2-1x1-0-NCHW-FP32-F=ConvBinWinogradRxSf2x3g1:0.720322,0,miopenConvolutionFwdAlgoWinograd;ConvBinWinogradRxSf3x2:0.464001,0,miopenConvolutionFwdAlgoWinograd;ConvAsmImplicitGemmGTCDynamicFwdXdlopsNHWC:0.568161,183502592,miopenConvolutionFwdAlgoImplicitGEMM;GemmFwdRest:1.10336,11059200,miopenConvolutionFwdAlgoGEMM;ConvDirectNaiveConvFwd:3.96769,0,miopenConvolutionFwdAlgoDirect
16-320-320-3x3-32-160-160-16-1x1-2x2-1x1-0-NCHW-FP32-F=ConvBinWinogradRxSf2x3g1:0.547521,0,miopenConvolutionFwdAlgoWinograd;ConvBinWinogradRxSf3x2:0.310401,0,miopenConvolutionFwdAlgoWinograd;ConvAsmImplicitGemmGTCDynamicFwdXdlopsNHWC:0.543362,157304832,miopenConvolutionFwdAlgoImplicitGEMM;GemmFwdRest:1.00096,14745600,miopenConvolutionFwdAlgoGEMM;ConvDirectNaiveConvFwd:6.53265,0,miopenConvolutionFwdAlgoDirect
32-160-160-1x1-32-160-160-16-0x0-1x1-1x1-0-NCHW-FP32-F=ConvBinWinogradRxSf2x3g1:0.307201,0,miopenConvolutionFwdAlgoWinograd;ConvBinWinogradRxSf3x2:0.208961,0,miopenConvolutionFwdAlgoWinograd;ConvAsmImplicitGemmGTCDynamicFwdXdlopsNHWC:0.30288,104857600,miopenConvolutionFwdAlgoImplicitGEMM;GemmFwd1x1_0_1:0.1136,0,miopenConvolutionFwdAlgoGEMM;ConvDirectNaiveConvFwd:2.21728,0,miopenConvolutionFwdAlgoDirect
16-160-160-3x3-8-160-160-16-1x1-1x1-1x1-0-NCHW-FP32-F=ConvBinWinogradRxSf2x3g1:0.19056,0,miopenConvolutionFwdAlgoWinograd;ConvBinWinogradRxSf3x2:0.284801,0,miopenConvolutionFwdAlgoWinograd;ConvAsmImplicitGemmGTCDynamicFwdXdlopsNHWC:0.281281,39326208,miopenConvolutionFwdAlgoImplicitGEMM;GemmFwdRest:0.87552,14745600,miopenConvolutionFwdAlgoGEMM;ConvDirectNaiveConvFwd:4.50945,0,miopenConvolutionFwdAlgoDirect
8-160-160-3x3-16-160-160-16-1x1-1x1-1x1-0-NCHW-FP32-F=ConvBinWinogradRxSf2x3g1:0.14304,0,miopenConvolutionFwdAlgoWinograd;ConvBinWinogradRxSf3x2:0.194241,0,miopenConvolutionFwdAlgoWinograd;ConvAsmImplicitGemmGTCDynamicFwdXdlopsNHWC:0.309121,39326208,miopenConvolutionFwdAlgoImplicitGEMM;GemmFwdRest:0.66816,7372800,miopenConvolutionFwdAlgoGEMM;ConvDirectNaiveConvFwd:2.36657,0,miopenConvolutionFwdAlgoDirect
48-160-160-1x1-64-160-160-16-0x0-1x1-1x1-0-NCHW-FP32-F=ConvBinWinogradRxSf2x3g1:0.757121,0,miopenConvolutionFwdAlgoWinograd;ConvBinWinogradRxSf3x2:0.442081,0,miopenConvolutionFwdAlgoWinograd;ConvAsmImplicitGemmGTCDynamicFwdXdlopsNHWC:0.561761,183500800,miopenConvolutionFwdAlgoImplicitGEMM;GemmFwd1x1_0_1:0.15776,0,miopenConvolutionFwdAlgoGEMM;ConvDirectNaiveConvFwd:6.13233,0,miopenConvolutionFwdAlgoDirect
64-160-160-3x3-64-80-80-16-1x1-2x2-1x1-0-NCHW-FP32-F=ConvBinWinogradRxSf2x3g1:0.954722,0,miopenConvolutionFwdAlgoWinograd;ConvBinWinogradRxSf3x2:0.533761,0,miopenConvolutionFwdAlgoWinograd;ConvAsmImplicitGemmGTCDynamicFwdXdlopsNHWC:0.702081,131219456,miopenConvolutionFwdAlgoImplicitGEMM;GemmFwdRest:1.00866,14745600,miopenConvolutionFwdAlgoGEMM;ConvDirectNaiveConvFwd:13.6629,0,miopenConvolutionFwdAlgoDirect
64-80-80-1x1-64-80-80-16-0x0-1x1-1x1-0-NCHW-FP32-F=ConvBinWinogradRxSf2x3g1:0.266561,0,miopenConvolutionFwdAlgoWinograd;ConvBinWinogradRxSf3x2:0.16736,0,miopenConvolutionFwdAlgoWinograd;ConvAsmImplicitGemmGTCDynamicFwdXdlopsNHWC:0.192801,52428800,miopenConvolutionFwdAlgoImplicitGEMM;GemmFwd1x1_0_1:0.09792,0,miopenConvolutionFwdAlgoGEMM;ConvDirectNaiveConvFwd:2.04272,0,miopenConvolutionFwdAlgoDirect
32-80-80-3x3-16-80-80-16-1x1-1x1-1x1-0-NCHW-FP32-F=ConvBinWinogradRxSf2x3g1:0.096,0,miopenConvolutionFwdAlgoWinograd;ConvBinWinogradRxSf3x2:0.148641,0,miopenConvolutionFwdAlgoWinograd;ConvAsmImplicitGemmGTCDynamicFwdXdlopsNHWC:0.14624,19679232,miopenConvolutionFwdAlgoImplicitGEMM;GemmFwdRest:0.5888,7372800,miopenConvolutionFwdAlgoGEMM;ConvDirectNaiveConvFwd:2.39968,0,miopenConvolutionFwdAlgoDirect
16-80-80-3x3-32-80-80-16-1x1-1x1-1x1-0-NCHW-FP32-F=ConvBinWinogradRxSf2x3g1:0.06896,0,miopenConvolutionFwdAlgoWinograd;ConvBinWinogradRxSf3x2:0.09744,0,miopenConvolutionFwdAlgoWinograd;ConvAsmImplicitGemmGTCDynamicFwdXdlopsNHWC:0.11152,19679232,miopenConvolutionFwdAlgoImplicitGEMM;GemmFwdRest:0.52224,3686400,miopenConvolutionFwdAlgoGEMM;ConvDirectNaiveConvFwd:1.4288,0,miopenConvolutionFwdAlgoDirect
96-80-80-1x1-128-80-80-16-0x0-1x1-1x1-0-NCHW-FP32-F=ConvBinWinogradRxSf2x3g1:0.693281,0,miopenConvolutionFwdAlgoWinograd;ConvBinWinogradRxSf3x2:0.389761,0,miopenConvolutionFwdAlgoWinograd;ConvAsmImplicitGemmGTCDynamicFwdXdlopsNHWC:0.305281,91750400,miopenConvolutionFwdAlgoImplicitGEMM;GemmFwd1x1_0_1:0.12528,0,miopenConvolutionFwdAlgoGEMM;ConvDirectNaiveConvFwd:4.95329,0,miopenConvolutionFwdAlgoDirect
128-80-80-3x3-128-40-40-16-1x1-2x2-1x1-0-NCHW-FP32-F=ConvBinWinogradRxSf2x3g1:0.929442,0,miopenConvolutionFwdAlgoWinograd;ConvBinWinogradRxSf3x2:0.509602,0,miopenConvolutionFwdAlgoWinograd;ConvAsmImplicitGemmGTCDynamicFwdXdlopsNHWC:0.42112,66125824,miopenConvolutionFwdAlgoImplicitGEMM;GemmFwdRest:0.896,7372800,miopenConvolutionFwdAlgoGEMM;ConvDirectNaiveConvFwd:12.4051,0,miopenConvolutionFwdAlgoDirect
128-40-40-1x1-128-40-40-16-0x0-1x1-1x1-0-NCHW-FP32-F=ConvBinWinogradRxSf2x3g1:0.252001,0,miopenConvolutionFwdAlgoWinograd;ConvBinWinogradRxSf3x2:0.16208,0,miopenConvolutionFwdAlgoWinograd;ConvAsmImplicitGemmGTCDynamicFwdXdlopsNHWC:0.127361,26214400,miopenConvolutionFwdAlgoImplicitGEMM;GemmFwd1x1_0_1:0.10752,0,miopenConvolutionFwdAlgoGEMM;ConvDirectNaiveConvFwd:1.71584,0,miopenConvolutionFwdAlgoDirect
64-40-40-1x1-32-40-40-16-0x0-1x1-1x1-0-NCHW-FP32-F=ConvBinWinogradRxSf2x3g1:0.0624,0,miopenConvolutionFwdAlgoWinograd;ConvBinWinogradRxSf3x2:0.05824,0,miopenConvolutionFwdAlgoWinograd;ConvAsmImplicitGemmGTCDynamicFwdXdlopsNHWC:0.06096,9830400,miopenConvolutionFwdAlgoImplicitGEMM;GemmFwd1x1_0_1:0.03472,0,miopenConvolutionFwdAlgoGEMM;ConvDirectNaiveConvFwd:0.31744,0,miopenConvolutionFwdAlgoDirect
32-40-40-3x3-32-40-40-16-1x1-1x1-1x1-0-NCHW-FP32-F=ConvBinWinogradRxSf2x3g1:0.05232,0,miopenConvolutionFwdAlgoWinograd;ConvBinWinogradRxSf3x2:0.071201,0,miopenConvolutionFwdAlgoWinograd;ConvAsmImplicitGemmGTCDynamicFwdXdlopsNHWC:0.07968,6590464,miopenConvolutionFwdAlgoImplicitGEMM;GemmFwdRest:0.50176,1843200,miopenConvolutionFwdAlgoGEMM;ConvDirectNaiveConvFwd:0.790402,0,miopenConvolutionFwdAlgoDirect
64-40-40-1x1-64-40-40-16-0x0-1x1-1x1-0-NCHW-FP32-F=ConvBinWinogradRxSf2x3g1:0.0824,0,miopenConvolutionFwdAlgoWinograd;ConvBinWinogradRxSf3x2:0.06656,0,miopenConvolutionFwdAlgoWinograd;ConvAsmImplicitGemmGTCDynamicFwdXdlopsNHWC:0.0736,13107200,miopenConvolutionFwdAlgoImplicitGEMM;GemmFwd1x1_0_1:0.02656,0,miopenConvolutionFwdAlgoGEMM;ConvDirectNaiveConvFwd:0.551361,0,miopenConvolutionFwdAlgoDirect
192-40-40-1x1-128-40-40-16-0x0-1x1-1x1-0-NCHW-FP32-F=ConvBinWinogradRxSf2x3g1:0.352481,0,miopenConvolutionFwdAlgoWinograd;ConvBinWinogradRxSf3x2:0.200321,0,miopenConvolutionFwdAlgoWinograd;ConvAsmImplicitGemmGTCDynamicFwdXdlopsNHWC:0.15312,32768000,miopenConvolutionFwdAlgoImplicitGEMM;GemmFwd1x1_0_1:0.13216,0,miopenConvolutionFwdAlgoGEMM;ConvDirectNaiveConvFwd:2.58865,0,miopenConvolutionFwdAlgoDirect
128-40-40-3x3-256-20-20-16-1x1-2x2-1x1-0-NCHW-FP32-F=ConvBinWinogradRxSf2x3g1:0.481921,0,miopenConvolutionFwdAlgoWinograd;ConvBinWinogradRxSf3x2:0.26864,0,miopenConvolutionFwdAlgoWinograd;ConvAsmImplicitGemmGTCDynamicFwdXdlopsNHWC:0.19744,20840448,miopenConvolutionFwdAlgoImplicitGEMM;GemmFwdRest:0.6784,1843200,miopenConvolutionFwdAlgoGEMM;ConvDirectNaiveConvFwd:7.16786,0,miopenConvolutionFwdAlgoDirect
256-20-20-1x1-256-20-20-16-0x0-1x1-1x1-0-NCHW-FP32-F=ConvBinWinogradRxSf2x3g1:0.25024,0,miopenConvolutionFwdAlgoWinograd;ConvBinWinogradRxSf3x2:0.152321,0,miopenConvolutionFwdAlgoWinograd;ConvAsmImplicitGemmGTCDynamicFwdXdlopsNHWC:0.08672,13107200,miopenConvolutionFwdAlgoImplicitGEMM;GemmFwd1x1_0_1:0.09488,0,miopenConvolutionFwdAlgoGEMM;ConvDirectNaiveConvFwd:1.80256,0,miopenConvolutionFwdAlgoDirect
128-20-20-1x1-64-20-20-16-0x0-1x1-1x1-0-NCHW-FP32-F=ConvBinWinogradRxSf2x3g1:0.056161,0,miopenConvolutionFwdAlgoWinograd;ConvBinWinogradRxSf3x2:0.05968,0,miopenConvolutionFwdAlgoWinograd;ConvAsmImplicitGemmGTCDynamicFwdXdlopsNHWC:0.0376,4915200,miopenConvolutionFwdAlgoImplicitGEMM;GemmFwd1x1_0_1:0.02768,0,miopenConvolutionFwdAlgoGEMM;ConvDirectNaiveConvFwd:0.333601,0,miopenConvolutionFwdAlgoDirect
64-20-20-3x3-64-20-20-16-1x1-1x1-1x1-0-NCHW-FP32-F=ConvBinWinogradRxSf2x3g1:0.03856,0,miopenConvolutionFwdAlgoWinograd;ConvBinWinogradRxSf3x2:0.07712,0,miopenConvolutionFwdAlgoWinograd;ConvAsmImplicitGemmGTCDynamicFwdXdlopsNHWC:0.051521,3424256,miopenConvolutionFwdAlgoImplicitGEMM;GemmFwdRest:0.54528,921600,miopenConvolutionFwdAlgoGEMM;ConvDirectNaiveConvFwd:0.705282,0,miopenConvolutionFwdAlgoDirect
128-20-20-1x1-128-20-20-16-0x0-1x1-1x1-0-NCHW-FP32-F=ConvBinWinogradRxSf2x3g1:0.08272,0,miopenConvolutionFwdAlgoWinograd;ConvBinWinogradRxSf3x2:0.060481,0,miopenConvolutionFwdAlgoWinograd;ConvAsmImplicitGemmGTCDynamicFwdXdlopsNHWC:0.04976,6553600,miopenConvolutionFwdAlgoImplicitGEMM;GemmFwd1x1_0_1:0.04464,0,miopenConvolutionFwdAlgoGEMM;ConvDirectNaiveConvFwd:0.518561,0,miopenConvolutionFwdAlgoDirect
384-20-20-1x1-256-20-20-16-0x0-1x1-1x1-0-NCHW-FP32-F=ConvBinWinogradRxSf2x3g1:0.345601,0,miopenConvolutionFwdAlgoWinograd;ConvBinWinogradRxSf3x2:0.188641,0,miopenConvolutionFwdAlgoWinograd;ConvAsmImplicitGemmGTCDynamicFwdXdlopsNHWC:0.10944,16384000,miopenConvolutionFwdAlgoImplicitGEMM;GemmFwd1x1_0_1:0.09504,0,miopenConvolutionFwdAlgoGEMM;ConvDirectNaiveConvFwd:2.68417,0,miopenConvolutionFwdAlgoDirect
128-20-20-1x1-256-20-20-16-0x0-1x1-1x1-0-NCHW-FP32-F=ConvBinWinogradRxSf2x3g1:0.137601,0,miopenConvolutionFwdAlgoWinograd;ConvBinWinogradRxSf3x2:0.0872,0,miopenConvolutionFwdAlgoWinograd;ConvAsmImplicitGemmGTCDynamicFwdXdlopsNHWC:0.068,9830400,miopenConvolutionFwdAlgoImplicitGEMM;GemmFwd1x1_0_1:0.05072,0,miopenConvolutionFwdAlgoGEMM;ConvDirectNaiveConvFwd:0.922082,0,miopenConvolutionFwdAlgoDirect
128-20-20-3x3-128-20-20-16-1x1-1x1-1x1-0-NCHW-FP32-F_g128=ConvBinWinogradRxSf2x3:0.2072,0,miopenConvolutionFwdAlgoWinograd;ConvBinWinogradRxSf3x2:0.24976,0,miopenConvolutionFwdAlgoWinograd;GemmFwdRest:0.63744,1843200,miopenConvolutionFwdAlgoGEMM;ConvDirectNaiveConvFwd:0.03744,0,miopenConvolutionFwdAlgoDirect
256-20-20-1x1-128-20-20-16-0x0-1x1-1x1-0-NCHW-FP32-F=ConvBinWinogradRxSf2x3g1:0.1376,0,miopenConvolutionFwdAlgoWinograd;ConvBinWinogradRxSf3x2:0.08592,0,miopenConvolutionFwdAlgoWinograd;ConvAsmImplicitGemmGTCDynamicFwdXdlopsNHWC:0.072801,9830400,miopenConvolutionFwdAlgoImplicitGEMM;GemmFwd1x1_0_1:0.06032,0,miopenConvolutionFwdAlgoGEMM;ConvDirectNaiveConvFwd:0.999522,0,miopenConvolutionFwdAlgoDirect
256-20-20-1x1-1280-20-20-16-0x0-1x1-1x1-0-NCHW-FP32-F=ConvBinWinogradRxSf2x3g1:1.10656,0,miopenConvolutionFwdAlgoWinograd;ConvBinWinogradRxSf3x2:0.578561,0,miopenConvolutionFwdAlgoWinograd;ConvAsmImplicitGemmGTCDynamicFwdXdlopsNHWC:0.268961,39321600,miopenConvolutionFwdAlgoImplicitGEMM;GemmFwd1x1_0_1:0.18032,0,miopenConvolutionFwdAlgoGEMM;ConvDirectNaiveConvFwd:7.93394,0,miopenConvolutionFwdAlgoDirect
3-640-640-3x3-16-320-320-3-1x1-2x2-1x1-0-NCHW-FP32-F=ConvBinWinogradRxSf2x3g1:0.16416,0,miopenConvolutionFwdAlgoWinograd;ConvBinWinogradRxSf3x2:0.12288,0,miopenConvolutionFwdAlgoWinograd;ConvAsmImplicitGemmGTCDynamicFwdXdlopsNHWC:0.14416,34408192,miopenConvolutionFwdAlgoImplicitGEMM;GemmFwdRest:0.20976,11059200,miopenConvolutionFwdAlgoGEMM;ConvDirectNaiveConvFwd:3.29713,0,miopenConvolutionFwdAlgoDirect
16-320-320-3x3-32-160-160-3-1x1-2x2-1x1-0-NCHW-FP32-F=ConvBinWinogradRxSf2x3g1:0.122561,0,miopenConvolutionFwdAlgoWinograd;ConvBinWinogradRxSf3x2:0.07648,0,miopenConvolutionFwdAlgoWinograd;ConvAsmImplicitGemmGTCDynamicFwdXdlopsNHWC:0.13056,29509632,miopenConvolutionFwdAlgoImplicitGEMM;GemmFwdRest:0.18816,14745600,miopenConvolutionFwdAlgoGEMM;ConvDirectNaiveConvFwd:4.11953,0,miopenConvolutionFwdAlgoDirect
32-160-160-1x1-32-160-160-3-0x0-1x1-1x1-0-NCHW-FP32-F=ConvBinWinogradRxSf2x3g1:0.08592,0,miopenConvolutionFwdAlgoWinograd;ConvBinWinogradRxSf3x2:0.07328,0,miopenConvolutionFwdAlgoWinograd;ConvAsmImplicitGemmGTCDynamicFwdXdlopsNHWC:0.082561,19660800,miopenConvolutionFwdAlgoImplicitGEMM;GemmFwd1x1_0_1:0.0424,0,miopenConvolutionFwdAlgoGEMM;ConvDirectNaiveConvFwd:1.92064,0,miopenConvolutionFwdAlgoDirect
16-160-160-3x3-8-160-160-3-1x1-1x1-1x1-0-NCHW-FP32-F=ConvBinWinogradRxSf2x3g1:0.05888,0,miopenConvolutionFwdAlgoWinograd;ConvBinWinogradRxSf3x2:0.0816,0,miopenConvolutionFwdAlgoWinograd;ConvAsmImplicitGemmGTCDynamicFwdXdlopsNHWC:0.082881,7377408,miopenConvolutionFwdAlgoImplicitGEMM;GemmFwdRest:0.16272,14745600,miopenConvolutionFwdAlgoGEMM;ConvDirectNaiveConvFwd:4.23761,0,miopenConvolutionFwdAlgoDirect
8-160-160-3x3-16-160-160-3-1x1-1x1-1x1-0-NCHW-FP32-F=ConvBinWinogradRxSf2x3g1:0.04736,0,miopenConvolutionFwdAlgoWinograd;ConvBinWinogradRxSf3x2:0.06128,0,miopenConvolutionFwdAlgoWinograd;ConvAsmImplicitGemmGTCDynamicFwdXdlopsNHWC:0.0816,7377408,miopenConvolutionFwdAlgoImplicitGEMM;GemmFwdRest:0.1272,7372800,miopenConvolutionFwdAlgoGEMM;ConvDirectNaiveConvFwd:2.11904,0,miopenConvolutionFwdAlgoDirect
48-160-160-1x1-64-160-160-3-0x0-1x1-1x1-0-NCHW-FP32-F=ConvBinWinogradRxSf2x3g1:0.16688,0,miopenConvolutionFwdAlgoWinograd;ConvBinWinogradRxSf3x2:0.111681,0,miopenConvolutionFwdAlgoWinograd;ConvAsmImplicitGemmGTCDynamicFwdXdlopsNHWC:0.12256,34406400,miopenConvolutionFwdAlgoImplicitGEMM;GemmFwd1x1_0_1:0.04768,0,miopenConvolutionFwdAlgoGEMM;ConvDirectNaiveConvFwd:2.94129,0,miopenConvolutionFwdAlgoDirect
64-160-160-3x3-64-80-80-3-1x1-2x2-1x1-0-NCHW-FP32-F=ConvBinWinogradRxSf2x3g1:0.205281,0,miopenConvolutionFwdAlgoWinograd;ConvBinWinogradRxSf3x2:0.15344,0,miopenConvolutionFwdAlgoWinograd;ConvAsmImplicitGemmGTCDynamicFwdXdlopsNHWC:0.15456,24723456,miopenConvolutionFwdAlgoImplicitGEMM;GemmFwdRest:0.1944,14745600,miopenConvolutionFwdAlgoGEMM;ConvDirectNaiveConvFwd:4.41825,0,miopenConvolutionFwdAlgoDirect
64-80-80-1x1-64-80-80-3-0x0-1x1-1x1-0-NCHW-FP32-F=ConvBinWinogradRxSf2x3g1:0.07808,0,miopenConvolutionFwdAlgoWinograd;ConvBinWinogradRxSf3x2:0.07232,0,miopenConvolutionFwdAlgoWinograd;ConvAsmImplicitGemmGTCDynamicFwdXdlopsNHWC:0.06464,9830400,miopenConvolutionFwdAlgoImplicitGEMM;GemmFwd1x1_0_1:0.032,0,miopenConvolutionFwdAlgoGEMM;ConvDirectNaiveConvFwd:0.978882,0,miopenConvolutionFwdAlgoDirect
32-80-80-3x3-16-80-80-3-1x1-1x1-1x1-0-NCHW-FP32-F=ConvBinWinogradRxSf2x3g1:0.04336,0,miopenConvolutionFwdAlgoWinograd;ConvBinWinogradRxSf3x2:0.061921,0,miopenConvolutionFwdAlgoWinograd;ConvAsmImplicitGemmGTCDynamicFwdXdlopsNHWC:0.04896,3704832,miopenConvolutionFwdAlgoImplicitGEMM;GemmFwdRest:0.11664,7372800,miopenConvolutionFwdAlgoGEMM;ConvDirectNaiveConvFwd:2.03344,0,miopenConvolutionFwdAlgoDirect
16-80-80-3x3-32-80-80-3-1x1-1x1-1x1-0-NCHW-FP32-F=ConvBinWinogradRxSf2x3g1:0.03648,0,miopenConvolutionFwdAlgoWinograd;ConvBinWinogradRxSf3x2:0.04592,0,miopenConvolutionFwdAlgoWinograd;ConvAsmImplicitGemmGTCDynamicFwdXdlopsNHWC:0.0472,3704832,miopenConvolutionFwdAlgoImplicitGEMM;GemmFwdRest:0.09408,3686400,miopenConvolutionFwdAlgoGEMM;ConvDirectNaiveConvFwd:1.03376,0,miopenConvolutionFwdAlgoDirect
96-80-80-1x1-128-80-80-3-0x0-1x1-1x1-0-NCHW-FP32-F=ConvBinWinogradRxSf2x3g1:0.1496,0,miopenConvolutionFwdAlgoWinograd;ConvBinWinogradRxSf3x2:0.097761,0,miopenConvolutionFwdAlgoWinograd;ConvAsmImplicitGemmGTCDynamicFwdXdlopsNHWC:0.08752,17203200,miopenConvolutionFwdAlgoImplicitGEMM;GemmFwd1x1_0_1:0.03648,0,miopenConvolutionFwdAlgoGEMM;ConvDirectNaiveConvFwd:1.56816,0,miopenConvolutionFwdAlgoDirect
128-80-80-3x3-128-40-40-3-1x1-2x2-1x1-0-NCHW-FP32-F=ConvBinWinogradRxSf2x3g1:0.255841,0,miopenConvolutionFwdAlgoWinograd;ConvBinWinogradRxSf3x2:0.15296,0,miopenConvolutionFwdAlgoWinograd;ConvAsmImplicitGemmGTCDynamicFwdXdlopsNHWC:0.104481,12877824,miopenConvolutionFwdAlgoImplicitGEMM;GemmFwdRest:0.173763,7372800,miopenConvolutionFwdAlgoGEMM;ConvDirectNaiveConvFwd:3.00369,0,miopenConvolutionFwdAlgoDirect
128-40-40-1x1-128-40-40-3-0x0-1x1-1x1-0-NCHW-FP32-F=ConvBinWinogradRxSf2x3g1:0.09024,0,miopenConvolutionFwdAlgoWinograd;ConvBinWinogradRxSf3x2:0.070241,0,miopenConvolutionFwdAlgoWinograd;ConvAsmImplicitGemmGTCDynamicFwdXdlopsNHWC:0.04304,4915200,miopenConvolutionFwdAlgoImplicitGEMM;GemmFwd1x1_0_1:0.03296,0,miopenConvolutionFwdAlgoGEMM;ConvDirectNaiveConvFwd:0.591361,0,miopenConvolutionFwdAlgoDirect
64-40-40-1x1-32-40-40-3-0x0-1x1-1x1-0-NCHW-FP32-F=ConvBinWinogradRxSf2x3g1:0.03984,0,miopenConvolutionFwdAlgoWinograd;ConvBinWinogradRxSf3x2:0.04336,0,miopenConvolutionFwdAlgoWinograd;ConvAsmImplicitGemmGTCDynamicFwdXdlopsNHWC:0.0272,1843200,miopenConvolutionFwdAlgoImplicitGEMM;GemmFwd1x1_0_1:0.01984,0,miopenConvolutionFwdAlgoGEMM;ConvDirectNaiveConvFwd:0.2776,0,miopenConvolutionFwdAlgoDirect
32-40-40-3x3-32-40-40-3-1x1-1x1-1x1-0-NCHW-FP32-F=ConvBinWinogradRxSf2x3g1:0.03312,0,miopenConvolutionFwdAlgoWinograd;ConvBinWinogradRxSf3x2:0.056,0,miopenConvolutionFwdAlgoWinograd;ConvAsmImplicitGemmGTCDynamicFwdXdlopsNHWC:0.03584,1265664,miopenConvolutionFwdAlgoImplicitGEMM;GemmFwdRest:0.08832,1843200,miopenConvolutionFwdAlgoGEMM;ConvDirectNaiveConvFwd:0.628961,0,miopenConvolutionFwdAlgoDirect
64-40-40-1x1-64-40-40-3-0x0-1x1-1x1-0-NCHW-FP32-F=ConvBinWinogradRxSf2x3g1:0.0408,0,miopenConvolutionFwdAlgoWinograd;ConvBinWinogradRxSf3x2:0.04864,0,miopenConvolutionFwdAlgoWinograd;ConvAsmImplicitGemmGTCDynamicFwdXdlopsNHWC:0.03104,2457600,miopenConvolutionFwdAlgoImplicitGEMM;GemmFwd1x1_0_1:0.02352,0,miopenConvolutionFwdAlgoGEMM;ConvDirectNaiveConvFwd:0.288321,0,miopenConvolutionFwdAlgoDirect
192-40-40-1x1-128-40-40-3-0x0-1x1-1x1-0-NCHW-FP32-F=ConvBinWinogradRxSf2x3g1:0.108321,0,miopenConvolutionFwdAlgoWinograd;ConvBinWinogradRxSf3x2:0.07328,0,miopenConvolutionFwdAlgoWinograd;ConvAsmImplicitGemmGTCDynamicFwdXdlopsNHWC:0.04432,6144000,miopenConvolutionFwdAlgoImplicitGEMM;GemmFwd1x1_0_1:0.03968,0,miopenConvolutionFwdAlgoGEMM;ConvDirectNaiveConvFwd:0.876482,0,miopenConvolutionFwdAlgoDirect
128-40-40-3x3-256-20-20-3-1x1-2x2-1x1-0-NCHW-FP32-F=ConvBinWinogradRxSf2x3g1:0.144801,0,miopenConvolutionFwdAlgoWinograd;ConvBinWinogradRxSf3x2:0.15024,0,miopenConvolutionFwdAlgoWinograd;ConvAsmImplicitGemmGTCDynamicFwdXdlopsNHWC:0.0992,4866048,miopenConvolutionFwdAlgoImplicitGEMM;GemmFwdRest:0.1272,1843200,miopenConvolutionFwdAlgoGEMM;ConvDirectNaiveConvFwd:1.40928,0,miopenConvolutionFwdAlgoDirect
256-20-20-1x1-256-20-20-3-0x0-1x1-1x1-0-NCHW-FP32-F=ConvBinWinogradRxSf2x3g1:0.08848,0,miopenConvolutionFwdAlgoWinograd;ConvBinWinogradRxSf3x2:0.09536,0,miopenConvolutionFwdAlgoWinograd;ConvAsmImplicitGemmGTCDynamicFwdXdlopsNHWC:0.04048,2457600,miopenConvolutionFwdAlgoImplicitGEMM;GemmFwd1x1_0_1:0.03152,0,miopenConvolutionFwdAlgoGEMM;ConvDirectNaiveConvFwd:0.434081,0,miopenConvolutionFwdAlgoDirect
128-20-20-1x1-64-20-20-3-0x0-1x1-1x1-0-NCHW-FP32-F=ConvBinWinogradRxSf2x3g1:0.05392,0,miopenConvolutionFwdAlgoWinograd;ConvBinWinogradRxSf3x2:0.05456,0,miopenConvolutionFwdAlgoWinograd;ConvAsmImplicitGemmGTCDynamicFwdXdlopsNHWC:0.02544,921600,miopenConvolutionFwdAlgoImplicitGEMM;GemmFwd1x1_0_1:0.02144,0,miopenConvolutionFwdAlgoGEMM;ConvDirectNaiveConvFwd:0.17648,0,miopenConvolutionFwdAlgoDirect
64-20-20-3x3-64-20-20-3-1x1-1x1-1x1-0-NCHW-FP32-F=ConvBinWinogradRxSf2x3g1:0.04016,0,miopenConvolutionFwdAlgoWinograd;ConvBinWinogradRxSf3x2:0.07984,0,miopenConvolutionFwdAlgoWinograd;ConvAsmImplicitGemmGTCDynamicFwdXdlopsNHWC:0.03712,761856,miopenConvolutionFwdAlgoImplicitGEMM;GemmFwdRest:0.10656,921600,miopenConvolutionFwdAlgoGEMM;ConvDirectNaiveConvFwd:0.350881,0,miopenConvolutionFwdAlgoDirect
128-20-20-1x1-128-20-20-3-0x0-1x1-1x1-0-NCHW-FP32-F=ConvBinWinogradRxSf2x3g1:0.0576,0,miopenConvolutionFwdAlgoWinograd;ConvBinWinogradRxSf3x2:0.0576,0,miopenConvolutionFwdAlgoWinograd;ConvAsmImplicitGemmGTCDynamicFwdXdlopsNHWC:0.02736,1228800,miopenConvolutionFwdAlgoImplicitGEMM;GemmFwd1x1_0_1:0.0224,0,miopenConvolutionFwdAlgoGEMM;ConvDirectNaiveConvFwd:0.186561,0,miopenConvolutionFwdAlgoDirect
384-20-20-1x1-256-20-20-3-0x0-1x1-1x1-0-NCHW-FP32-F=ConvBinWinogradRxSf2x3g1:0.10896,0,miopenConvolutionFwdAlgoWinograd;ConvBinWinogradRxSf3x2:0.105921,0,miopenConvolutionFwdAlgoWinograd;ConvAsmImplicitGemmGTCDynamicFwdXdlopsNHWC:0.05008,3072000,miopenConvolutionFwdAlgoImplicitGEMM;GemmFwd1x1_0_1:0.03792,0,miopenConvolutionFwdAlgoGEMM;ConvDirectNaiveConvFwd:0.631681,0,miopenConvolutionFwdAlgoDirect
128-20-20-1x1-256-20-20-3-0x0-1x1-1x1-0-NCHW-FP32-F=ConvBinWinogradRxSf2x3g1:0.05504,0,miopenConvolutionFwdAlgoWinograd;ConvBinWinogradRxSf3x2:0.05408,0,miopenConvolutionFwdAlgoWinograd;ConvAsmImplicitGemmGTCDynamicFwdXdlopsNHWC:0.03584,1843200,miopenConvolutionFwdAlgoImplicitGEMM;GemmFwd1x1_0_1:0.022881,0,miopenConvolutionFwdAlgoGEMM;ConvDirectNaiveConvFwd:0.22224,0,miopenConvolutionFwdAlgoDirect
128-20-20-3x3-128-20-20-3-1x1-1x1-1x1-0-NCHW-FP32-F_g128=ConvBinWinogradRxSf2x3:0.073761,0,miopenConvolutionFwdAlgoWinograd;ConvBinWinogradRxSf3x2:0.1192,0,miopenConvolutionFwdAlgoWinograd;GemmFwdRest:0.11856,1843200,miopenConvolutionFwdAlgoGEMM;ConvDirectNaiveConvFwd:0.02544,0,miopenConvolutionFwdAlgoDirect
256-20-20-1x1-128-20-20-3-0x0-1x1-1x1-0-NCHW-FP32-F=ConvBinWinogradRxSf2x3g1:0.08128,0,miopenConvolutionFwdAlgoWinograd;ConvBinWinogradRxSf3x2:0.0792,0,miopenConvolutionFwdAlgoWinograd;ConvAsmImplicitGemmGTCDynamicFwdXdlopsNHWC:0.03568,1843200,miopenConvolutionFwdAlgoImplicitGEMM;GemmFwd1x1_0_1:0.23072,0,miopenConvolutionFwdAlgoGEMM;ConvDirectNaiveConvFwd:0.358881,0,miopenConvolutionFwdAlgoDirect
256-20-20-1x1-1280-20-20-3-0x0-1x1-1x1-0-NCHW-FP32-F=ConvBinWinogradRxSf2x3g1:0.250881,0,miopenConvolutionFwdAlgoWinograd;ConvBinWinogradRxSf3x2:0.15104,0,miopenConvolutionFwdAlgoWinograd;ConvAsmImplicitGemmGTCDynamicFwdXdlopsNHWC:0.10048,7372800,miopenConvolutionFwdAlgoImplicitGEMM;GemmFwd1x1_0_1:0.04656,0,miopenConvolutionFwdAlgoGEMM;ConvDirectNaiveConvFwd:1.63296,0,miopenConvolutionFwdAlgoDirect
3-256-256-3x3-16-128-128-1-1x1-2x2-1x1-0-NCHW-FP32-F=ConvBinWinogradRxSf2x3g1:0.04448,0,miopenConvolutionFwdAlgoWinograd;ConvBinWinogradRxSf3x2:0.0504,0,miopenConvolutionFwdAlgoWinograd;GemmFwdRest:0.0592,1769472,miopenConvolutionFwdAlgoGEMM;ConvDirectNaiveConvFwd:0.559521,0,miopenConvolutionFwdAlgoDirect
16-128-128-3x3-32-64-64-1-1x1-2x2-1x1-0-NCHW-FP32-F=ConvBinWinogradRxSf2x3g1:0.05136,0,miopenConvolutionFwdAlgoWinograd;ConvBinWinogradRxSf3x2:0.060801,0,miopenConvolutionFwdAlgoWinograd;GemmFwdRest:0.03296,2359296,miopenConvolutionFwdAlgoGEMM;ConvDirectNaiveConvFwd:0.682082,0,miopenConvolutionFwdAlgoDirect
32-64-64-1x1-32-64-64-1-0x0-1x1-1x1-0-NCHW-FP32-F=ConvBinWinogradRxSf2x3g1:0.04224,0,miopenConvolutionFwdAlgoWinograd;ConvBinWinogradRxSf3x2:0.05232,0,miopenConvolutionFwdAlgoWinograd;GemmFwd1x1_0_1:0.017441,0,miopenConvolutionFwdAlgoGEMM;ConvDirectNaiveConvFwd:0.307361,0,miopenConvolutionFwdAlgoDirect
16-64-64-3x3-8-64-64-1-1x1-1x1-1x1-0-NCHW-FP32-F=ConvBinWinogradRxSf2x3g1:0.03936,0,miopenConvolutionFwdAlgoWinograd;ConvBinWinogradRxSf3x2:0.05904,0,miopenConvolutionFwdAlgoWinograd;GemmFwdRest:0.031521,2359296,miopenConvolutionFwdAlgoGEMM;ConvDirectNaiveConvFwd:0.631042,0,miopenConvolutionFwdAlgoDirect
8-64-64-3x3-16-64-64-1-1x1-1x1-1x1-0-NCHW-FP32-F=ConvBinWinogradRxSf2x3g1:0.024,0,miopenConvolutionFwdAlgoWinograd;ConvBinWinogradRxSf3x2:0.0336,0,miopenConvolutionFwdAlgoWinograd;GemmFwdRest:0.0232,1179648,miopenConvolutionFwdAlgoGEMM;ConvDirectNaiveConvFwd:0.311681,0,miopenConvolutionFwdAlgoDirect
48-64-64-1x1-64-64-64-1-0x0-1x1-1x1-0-NCHW-FP32-F=ConvBinWinogradRxSf2x3g1:0.047041,0,miopenConvolutionFwdAlgoWinograd;ConvBinWinogradRxSf3x2:0.05664,0,miopenConvolutionFwdAlgoWinograd;GemmFwd1x1_0_1:0.02016,0,miopenConvolutionFwdAlgoGEMM;ConvDirectNaiveConvFwd:0.465281,0,miopenConvolutionFwdAlgoDirect
64-64-64-3x3-64-32-32-1-1x1-2x2-1x1-0-NCHW-FP32-F=ConvBinWinogradRxSf2x3g1:0.09072,0,miopenConvolutionFwdAlgoWinograd;ConvBinWinogradRxSf3x2:0.09904,0,miopenConvolutionFwdAlgoWinograd;GemmFwdRest:0.03504,2359296,miopenConvolutionFwdAlgoGEMM;ConvDirectNaiveConvFwd:0.700162,0,miopenConvolutionFwdAlgoDirect
64-32-32-1x1-64-32-32-1-0x0-1x1-1x1-0-NCHW-FP32-F=ConvBinWinogradRxSf2x3g1:0.0488,0,miopenConvolutionFwdAlgoWinograd;ConvBinWinogradRxSf3x2:0.05744,0,miopenConvolutionFwdAlgoWinograd;GemmFwd1x1_0_1:0.016,0,miopenConvolutionFwdAlgoGEMM;ConvDirectNaiveConvFwd:0.15808,0,miopenConvolutionFwdAlgoDirect
32-32-32-3x3-16-32-32-1-1x1-1x1-1x1-0-NCHW-FP32-F=ConvBinWinogradRxSf2x3g1:0.02368,0,miopenConvolutionFwdAlgoWinograd;ConvBinWinogradRxSf3x2:0.04896,0,miopenConvolutionFwdAlgoWinograd;GemmFwdRest:0.03008,1179648,miopenConvolutionFwdAlgoGEMM;ConvDirectNaiveConvFwd:0.316161,0,miopenConvolutionFwdAlgoDirect
16-32-32-3x3-32-32-32-1-1x1-1x1-1x1-0-NCHW-FP32-F=ConvBinWinogradRxSf2x3g1:0.02144,0,miopenConvolutionFwdAlgoWinograd;ConvBinWinogradRxSf3x2:0.03664,0,miopenConvolutionFwdAlgoWinograd;GemmFwdRest:0.029761,589824,miopenConvolutionFwdAlgoGEMM;ConvDirectNaiveConvFwd:0.16544,0,miopenConvolutionFwdAlgoDirect
96-32-32-1x1-128-32-32-1-0x0-1x1-1x1-0-NCHW-FP32-F=ConvBinWinogradRxSf2x3g1:0.040001,0,miopenConvolutionFwdAlgoWinograd;ConvBinWinogradRxSf3x2:0.0448,0,miopenConvolutionFwdAlgoWinograd;GemmFwd1x1_0_1:0.01904,0,miopenConvolutionFwdAlgoGEMM;ConvDirectNaiveConvFwd:0.247041,0,miopenConvolutionFwdAlgoDirect
128-32-32-3x3-128-16-16-1-1x1-2x2-1x1-0-NCHW-FP32-F=ConvBinWinogradRxSf2x3g1:0.142881,0,miopenConvolutionFwdAlgoWinograd;ConvBinWinogradRxSf3x2:0.14944,0,miopenConvolutionFwdAlgoWinograd;GemmFwdRest:0.04032,1179648,miopenConvolutionFwdAlgoGEMM;ConvDirectNaiveConvFwd:0.359841,0,miopenConvolutionFwdAlgoDirect
128-16-16-1x1-128-16-16-1-0x0-1x1-1x1-0-NCHW-FP32-F=ConvBinWinogradRxSf2x3g1:0.0608,0,miopenConvolutionFwdAlgoWinograd;ConvBinWinogradRxSf3x2:0.068,0,miopenConvolutionFwdAlgoWinograd;GemmFwd1x1_0_1:0.02112,0,miopenConvolutionFwdAlgoGEMM;ConvDirectNaiveConvFwd:0.08624,0,miopenConvolutionFwdAlgoDirect
64-16-16-1x1-32-16-16-1-0x0-1x1-1x1-0-NCHW-FP32-F=ConvBinWinogradRxSf2x3g1:0.03168,0,miopenConvolutionFwdAlgoWinograd;ConvBinWinogradRxSf3x2:0.032961,0,miopenConvolutionFwdAlgoWinograd;GemmFwd1x1_0_1:0.01744,0,miopenConvolutionFwdAlgoGEMM;ConvDirectNaiveConvFwd:0.04544,0,miopenConvolutionFwdAlgoDirect
32-16-16-3x3-32-16-16-1-1x1-1x1-1x1-0-NCHW-FP32-F=ConvBinWinogradRxSf2x3g1:0.02448,0,miopenConvolutionFwdAlgoWinograd;ConvBinWinogradRxSf3x2:0.0464,0,miopenConvolutionFwdAlgoWinograd;GemmFwdRest:0.02928,294912,miopenConvolutionFwdAlgoGEMM;ConvDirectNaiveConvFwd:0.08096,0,miopenConvolutionFwdAlgoDirect
64-16-16-1x1-64-16-16-1-0x0-1x1-1x1-0-NCHW-FP32-F=ConvBinWinogradRxSf2x3g1:0.02944,0,miopenConvolutionFwdAlgoWinograd;ConvBinWinogradRxSf3x2:0.03328,0,miopenConvolutionFwdAlgoWinograd;GemmFwd1x1_0_1:0.01712,0,miopenConvolutionFwdAlgoGEMM;ConvDirectNaiveConvFwd:0.04608,0,miopenConvolutionFwdAlgoDirect
192-16-16-1x1-128-16-16-1-0x0-1x1-1x1-0-NCHW-FP32-F=ConvBinWinogradRxSf2x3g1:0.055361,0,miopenConvolutionFwdAlgoWinograd;ConvBinWinogradRxSf3x2:0.05808,0,miopenConvolutionFwdAlgoWinograd;GemmFwd1x1_0_1:0.02048,0,miopenConvolutionFwdAlgoGEMM;ConvDirectNaiveConvFwd:0.129281,0,miopenConvolutionFwdAlgoDirect
128-16-16-3x3-256-8-8-1-1x1-2x2-1x1-0-NCHW-FP32-F=ConvBinWinogradRxSf2x3g1:0.144,0,miopenConvolutionFwdAlgoWinograd;ConvBinWinogradRxSf3x2:0.149121,0,miopenConvolutionFwdAlgoWinograd;GemmFwdRest:0.04608,294912,miopenConvolutionFwdAlgoGEMM;ConvDirectNaiveConvFwd:0.365441,0,miopenConvolutionFwdAlgoDirect
256-8-8-1x1-256-8-8-1-0x0-1x1-1x1-0-NCHW-FP32-F=ConvBinWinogradRxSf2x3g1:0.08624,0,miopenConvolutionFwdAlgoWinograd;ConvBinWinogradRxSf3x2:0.09328,0,miopenConvolutionFwdAlgoWinograd;GemmFwd1x1_0_1:0.03952,0,miopenConvolutionFwdAlgoGEMM;ConvDirectNaiveConvFwd:0.168,0,miopenConvolutionFwdAlgoDirect
128-8-8-1x1-64-8-8-1-0x0-1x1-1x1-0-NCHW-FP32-F=ConvBinWinogradRxSf2x3g1:0.04176,0,miopenConvolutionFwdAlgoWinograd;ConvBinWinogradRxSf3x2:0.04512,0,miopenConvolutionFwdAlgoWinograd;GemmFwd1x1_0_1:0.017601,0,miopenConvolutionFwdAlgoGEMM;ConvDirectNaiveConvFwd:0.08768,0,miopenConvolutionFwdAlgoDirect
64-8-8-3x3-64-8-8-1-1x1-1x1-1x1-0-NCHW-FP32-F=ConvBinWinogradRxSf2x3g1:0.048161,0,miopenConvolutionFwdAlgoWinograd;ConvBinWinogradRxSf3x2:0.09584,0,miopenConvolutionFwdAlgoWinograd;GemmFwdRest:0.036,147456,miopenConvolutionFwdAlgoGEMM;ConvDirectNaiveConvFwd:0.14064,0,miopenConvolutionFwdAlgoDirect
128-8-8-1x1-128-8-8-1-0x0-1x1-1x1-0-NCHW-FP32-F=ConvBinWinogradRxSf2x3g1:0.04352,0,miopenConvolutionFwdAlgoWinograd;ConvBinWinogradRxSf3x2:0.0488,0,miopenConvolutionFwdAlgoWinograd;GemmFwd1x1_0_1:0.02256,0,miopenConvolutionFwdAlgoGEMM;ConvDirectNaiveConvFwd:0.08736,0,miopenConvolutionFwdAlgoDirect
384-8-8-1x1-256-8-8-1-0x0-1x1-1x1-0-NCHW-FP32-F=ConvBinWinogradRxSf2x3g1:0.092801,0,miopenConvolutionFwdAlgoWinograd;ConvBinWinogradRxSf3x2:0.09424,0,miopenConvolutionFwdAlgoWinograd;GemmFwd1x1_0_1:0.04976,0,miopenConvolutionFwdAlgoGEMM;ConvDirectNaiveConvFwd:0.246881,0,miopenConvolutionFwdAlgoDirect
256-8-8-1x1-128-8-8-1-0x0-1x1-1x1-0-NCHW-FP32-F=ConvBinWinogradRxSf2x3g1:0.06816,0,miopenConvolutionFwdAlgoWinograd;ConvBinWinogradRxSf3x2:0.070721,0,miopenConvolutionFwdAlgoWinograd;GemmFwd1x1_0_1:0.01904,0,miopenConvolutionFwdAlgoGEMM;ConvDirectNaiveConvFwd:0.17216,0,miopenConvolutionFwdAlgoDirect
512-8-8-1x1-256-8-8-1-0x0-1x1-1x1-0-NCHW-FP32-F=ConvBinWinogradRxSf2x3g1:0.13696,0,miopenConvolutionFwdAlgoWinograd;ConvBinWinogradRxSf3x2:0.142881,0,miopenConvolutionFwdAlgoWinograd;GemmFwd1x1_0_1:0.03472,0,miopenConvolutionFwdAlgoGEMM;ConvDirectNaiveConvFwd:0.326241,0,miopenConvolutionFwdAlgoDirect
128-8-8-1x1-256-8-8-1-0x0-1x1-1x1-0-NCHW-FP32-F=ConvBinWinogradRxSf2x3g1:0.0432,0,miopenConvolutionFwdAlgoWinograd;ConvBinWinogradRxSf3x2:0.0472,0,miopenConvolutionFwdAlgoWinograd;GemmFwd1x1_0_1:0.02128,0,miopenConvolutionFwdAlgoGEMM;ConvDirectNaiveConvFwd:0.089601,0,miopenConvolutionFwdAlgoDirect
128-8-8-3x3-128-8-8-1-1x1-1x1-1x1-0-NCHW-FP32-F_g128=ConvBinWinogradRxSf2x3:0.04192,0,miopenConvolutionFwdAlgoWinograd;ConvBinWinogradRxSf3x2:0.05856,0,miopenConvolutionFwdAlgoWinograd;GemmFwdRest:0.02416,294912,miopenConvolutionFwdAlgoGEMM;ConvDirectNaiveConvFwd:0.01456,0,miopenConvolutionFwdAlgoDirect
384-16-16-1x1-128-16-16-1-0x0-1x1-1x1-0-NCHW-FP32-F=ConvBinWinogradRxSf2x3g1:0.110881,0,miopenConvolutionFwdAlgoWinograd;ConvBinWinogradRxSf3x2:0.11888,0,miopenConvolutionFwdAlgoWinograd;GemmFwd1x1_0_1:0.02272,0,miopenConvolutionFwdAlgoGEMM;ConvDirectNaiveConvFwd:0.24896,0,miopenConvolutionFwdAlgoDirect
256-32-32-1x1-64-32-32-1-0x0-1x1-1x1-0-NCHW-FP32-F=ConvBinWinogradRxSf2x3g1:0.07072,0,miopenConvolutionFwdAlgoWinograd;ConvBinWinogradRxSf3x2:0.07408,0,miopenConvolutionFwdAlgoWinograd;GemmFwd1x1_0_1:0.0192,0,miopenConvolutionFwdAlgoGEMM;ConvDirectNaiveConvFwd:0.612962,0,miopenConvolutionFwdAlgoDirect
32-32-32-1x1-16-32-32-1-0x0-1x1-1x1-0-NCHW-FP32-F=ConvBinWinogradRxSf2x3g1:0.02336,0,miopenConvolutionFwdAlgoWinograd;ConvBinWinogradRxSf3x2:0.02944,0,miopenConvolutionFwdAlgoWinograd;GemmFwd1x1_0_1:0.01728,0,miopenConvolutionFwdAlgoGEMM;ConvDirectNaiveConvFwd:0.082561,0,miopenConvolutionFwdAlgoDirect
16-32-32-3x3-16-32-32-1-1x1-1x1-1x1-0-NCHW-FP32-F=ConvBinWinogradRxSf2x3g1:0.02096,0,miopenConvolutionFwdAlgoWinograd;ConvBinWinogradRxSf3x2:0.03408,0,miopenConvolutionFwdAlgoWinograd;GemmFwdRest:0.02848,589824,miopenConvolutionFwdAlgoGEMM;ConvDirectNaiveConvFwd:0.165921,0,miopenConvolutionFwdAlgoDirect
32-32-32-1x1-32-32-32-1-0x0-1x1-1x1-0-NCHW-FP32-F=ConvBinWinogradRxSf2x3g1:0.02336,0,miopenConvolutionFwdAlgoWinograd;ConvBinWinogradRxSf3x2:0.02832,0,miopenConvolutionFwdAlgoWinograd;GemmFwd1x1_0_1:0.01824,0,miopenConvolutionFwdAlgoGEMM;ConvDirectNaiveConvFwd:0.0832,0,miopenConvolutionFwdAlgoDirect
96-32-32-1x1-64-32-32-1-0x0-1x1-1x1-0-NCHW-FP32-F=ConvBinWinogradRxSf2x3g1:0.0376,0,miopenConvolutionFwdAlgoWinograd;ConvBinWinogradRxSf3x2:0.04224,0,miopenConvolutionFwdAlgoWinograd;GemmFwd1x1_0_1:0.01888,0,miopenConvolutionFwdAlgoGEMM;ConvDirectNaiveConvFwd:0.235841,0,miopenConvolutionFwdAlgoDirect
64-32-32-3x3-64-16-16-1-1x1-2x2-1x1-0-NCHW-FP32-F=ConvBinWinogradRxSf2x3g1:0.089601,0,miopenConvolutionFwdAlgoWinograd;ConvBinWinogradRxSf3x2:0.09824,0,miopenConvolutionFwdAlgoWinograd;GemmFwdRest:0.03312,589824,miopenConvolutionFwdAlgoGEMM;ConvDirectNaiveConvFwd:0.180481,0,miopenConvolutionFwdAlgoDirect
128-16-16-3x3-128-8-8-1-1x1-2x2-1x1-0-NCHW-FP32-F=ConvBinWinogradRxSf2x3g1:0.140001,0,miopenConvolutionFwdAlgoWinograd;ConvBinWinogradRxSf3x2:0.14512,0,miopenConvolutionFwdAlgoWinograd;GemmFwdRest:0.039041,294912,miopenConvolutionFwdAlgoGEMM;ConvDirectNaiveConvFwd:0.367521,0,miopenConvolutionFwdAlgoDirect
128-8-8-3x3-64-8-8-1-1x1-1x1-1x1-0-NCHW-FP32-F=ConvBinWinogradRxSf2x3g1:0.06112,0,miopenConvolutionFwdAlgoWinograd;ConvBinWinogradRxSf3x2:0.140001,0,miopenConvolutionFwdAlgoWinograd;GemmFwdRest:0.03744,294912,miopenConvolutionFwdAlgoGEMM;ConvDirectNaiveConvFwd:0.272801,0,miopenConvolutionFwdAlgoDirect
64-8-8-3x3-128-8-8-1-1x1-1x1-1x1-0-NCHW-FP32-F=ConvBinWinogradRxSf2x3g1:0.03008,0,miopenConvolutionFwdAlgoWinograd;ConvBinWinogradRxSf3x2:0.06912,0,miopenConvolutionFwdAlgoWinograd;GemmFwdRest:0.0312,147456,miopenConvolutionFwdAlgoGEMM;ConvDirectNaiveConvFwd:0.14224,0,miopenConvolutionFwdAlgoDirect
64-32-32-3x3-16-32-32-1-1x1-1x1-1x1-0-NCHW-FP32-F=ConvBinWinogradRxSf2x3g1:0.03216,0,miopenConvolutionFwdAlgoWinograd;ConvBinWinogradRxSf3x2:0.07552,0,miopenConvolutionFwdAlgoWinograd;GemmFwdRest:0.03216,2359296,miopenConvolutionFwdAlgoGEMM;ConvDirectNaiveConvFwd:0.624642,0,miopenConvolutionFwdAlgoDirect
16-32-32-1x1-4-32-32-1-0x0-1x1-1x1-0-NCHW-FP32-F=ConvBinWinogradRxSf2x3g1:0.02032,0,miopenConvolutionFwdAlgoWinograd;ConvBinWinogradRxSf3x2:0.0232,0,miopenConvolutionFwdAlgoWinograd;GemmFwd1x1_0_1:0.01824,0,miopenConvolutionFwdAlgoGEMM;ConvDirectNaiveConvFwd:0.0456,0,miopenConvolutionFwdAlgoDirect
128-16-16-3x3-16-16-16-1-1x1-1x1-1x1-0-NCHW-FP32-F=ConvBinWinogradRxSf2x3g1:0.0432,0,miopenConvolutionFwdAlgoWinograd;ConvBinWinogradRxSf3x2:0.11856,0,miopenConvolutionFwdAlgoWinograd;GemmFwdRest:0.042881,1179648,miopenConvolutionFwdAlgoGEMM;ConvDirectNaiveConvFwd:0.298721,0,miopenConvolutionFwdAlgoDirect
16-16-16-3x3-16-16-16-1-1x1-1x1-1x1-0-NCHW-FP32-F=ConvBinWinogradRxSf2x3g1:0.02144,0,miopenConvolutionFwdAlgoWinograd;ConvBinWinogradRxSf3x2:0.03488,0,miopenConvolutionFwdAlgoWinograd;GemmFwdRest:0.0256,147456,miopenConvolutionFwdAlgoGEMM;ConvDirectNaiveConvFwd:0.04304,0,miopenConvolutionFwdAlgoDirect
16-16-16-1x1-4-16-16-1-0x0-1x1-1x1-0-NCHW-FP32-F=ConvBinWinogradRxSf2x3g1:0.01712,0,miopenConvolutionFwdAlgoWinograd;ConvBinWinogradRxSf3x2:0.02176,0,miopenConvolutionFwdAlgoWinograd;GemmFwd1x1_0_1:0.0184,0,miopenConvolutionFwdAlgoGEMM;ConvDirectNaiveConvFwd:0.01856,0,miopenConvolutionFwdAlgoDirect
256-8-8-3x3-16-8-8-1-1x1-1x1-1x1-0-NCHW-FP32-F=ConvBinWinogradRxSf2x3g1:0.0672,0,miopenConvolutionFwdAlgoWinograd;ConvBinWinogradRxSf3x2:0.216001,0,miopenConvolutionFwdAlgoWinograd;GemmFwdRest:0.05808,589824,miopenConvolutionFwdAlgoGEMM;ConvDirectNaiveConvFwd:0.542401,0,miopenConvolutionFwdAlgoDirect
16-8-8-3x3-16-8-8-1-1x1-1x1-1x1-0-NCHW-FP32-F=ConvBinWinogradRxSf2x3g1:0.01984,0,miopenConvolutionFwdAlgoWinograd;ConvBinWinogradRxSf3x2:0.0328,0,miopenConvolutionFwdAlgoWinograd;GemmFwdRest:0.03376,36864,miopenConvolutionFwdAlgoGEMM;ConvDirectNaiveConvFwd:0.041121,0,miopenConvolutionFwdAlgoDirect
16-8-8-1x1-4-8-8-1-0x0-1x1-1x1-0-NCHW-FP32-F=ConvBinWinogradRxSf2x3g1:0.02032,0,miopenConvolutionFwdAlgoWinograd;ConvBinWinogradRxSf3x2:0.02624,0,miopenConvolutionFwdAlgoWinograd;GemmFwd1x1_0_1:0.01968,0,miopenConvolutionFwdAlgoGEMM;ConvDirectNaiveConvFwd:0.018241,0,miopenConvolutionFwdAlgoDirect
64-32-32-3x3-64-32-32-1-1x1-1x1-1x1-0-NCHW-FP32-F_g64=ConvBinWinogradRxSf2x3:0.05632,0,miopenConvolutionFwdAlgoWinograd;ConvBinWinogradRxSf3x2:0.054561,0,miopenConvolutionFwdAlgoWinograd;GemmFwdRest:0.04192,2359296,miopenConvolutionFwdAlgoGEMM;ConvDirectNaiveConvFwd:0.0184,0,miopenConvolutionFwdAlgoDirect
64-32-32-1x1-80-32-32-1-0x0-1x1-1x1-0-NCHW-FP32-F=ConvBinWinogradRxSf2x3g1:0.0312,0,miopenConvolutionFwdAlgoWinograd;ConvBinWinogradRxSf3x2:0.03376,0,miopenConvolutionFwdAlgoWinograd;GemmFwd1x1_0_1:0.01968,0,miopenConvolutionFwdAlgoGEMM;ConvDirectNaiveConvFwd:0.158081,0,miopenConvolutionFwdAlgoDirect
80-32-32-3x3-80-32-32-1-1x1-1x1-1x1-0-NCHW-FP32-F_g80=ConvBinWinogradRxSf2x3:0.03392,0,miopenConvolutionFwdAlgoWinograd;ConvBinWinogradRxSf3x2:0.04384,0,miopenConvolutionFwdAlgoWinograd;GemmFwdRest:0.048,2949120,miopenConvolutionFwdAlgoGEMM;ConvDirectNaiveConvFwd:0.020161,0,miopenConvolutionFwdAlgoDirect
80-32-32-1x1-80-32-32-1-0x0-1x1-1x1-0-NCHW-FP32-F=ConvBinWinogradRxSf2x3g1:0.0384,0,miopenConvolutionFwdAlgoWinograd;ConvBinWinogradRxSf3x2:0.040961,0,miopenConvolutionFwdAlgoWinograd;GemmFwd1x1_0_1:0.01872,0,miopenConvolutionFwdAlgoGEMM;ConvDirectNaiveConvFwd:0.1976,0,miopenConvolutionFwdAlgoDirect
128-16-16-3x3-128-16-16-1-1x1-1x1-1x1-0-NCHW-FP32-F_g128=ConvBinWinogradRxSf2x3:0.04176,0,miopenConvolutionFwdAlgoWinograd;ConvBinWinogradRxSf3x2:0.06064,0,miopenConvolutionFwdAlgoWinograd;GemmFwdRest:0.02576,1179648,miopenConvolutionFwdAlgoGEMM;ConvDirectNaiveConvFwd:0.01136,0,miopenConvolutionFwdAlgoDirect
128-16-16-1x1-80-16-16-1-0x0-1x1-1x1-0-NCHW-FP32-F=ConvBinWinogradRxSf2x3g1:0.04624,0,miopenConvolutionFwdAlgoWinograd;ConvBinWinogradRxSf3x2:0.04448,0,miopenConvolutionFwdAlgoWinograd;GemmFwd1x1_0_1:0.02112,0,miopenConvolutionFwdAlgoGEMM;ConvDirectNaiveConvFwd:0.08224,0,miopenConvolutionFwdAlgoDirect
80-16-16-3x3-80-16-16-1-1x1-1x1-1x1-0-NCHW-FP32-F_g80=ConvBinWinogradRxSf2x3:0.01984,0,miopenConvolutionFwdAlgoWinograd;ConvBinWinogradRxSf3x2:0.03056,0,miopenConvolutionFwdAlgoWinograd;GemmFwdRest:0.0248,737280,miopenConvolutionFwdAlgoGEMM;ConvDirectNaiveConvFwd:0.01072,0,miopenConvolutionFwdAlgoDirect
80-16-16-1x1-80-16-16-1-0x0-1x1-1x1-0-NCHW-FP32-F=ConvBinWinogradRxSf2x3g1:0.036,0,miopenConvolutionFwdAlgoWinograd;ConvBinWinogradRxSf3x2:0.0392,0,miopenConvolutionFwdAlgoWinograd;GemmFwd1x1_0_1:0.018721,0,miopenConvolutionFwdAlgoGEMM;ConvDirectNaiveConvFwd:0.05248,0,miopenConvolutionFwdAlgoDirect
256-8-8-3x3-256-8-8-1-1x1-1x1-1x1-0-NCHW-FP32-F_g256=ConvBinWinogradRxSf2x3:0.03632,0,miopenConvolutionFwdAlgoWinograd;ConvBinWinogradRxSf3x2:0.05168,0,miopenConvolutionFwdAlgoWinograd;GemmFwdRest:0.02384,589824,miopenConvolutionFwdAlgoGEMM;ConvDirectNaiveConvFwd:0.01024,0,miopenConvolutionFwdAlgoDirect
256-8-8-1x1-80-8-8-1-0x0-1x1-1x1-0-NCHW-FP32-F=ConvBinWinogradRxSf2x3g1:0.06896,0,miopenConvolutionFwdAlgoWinograd;ConvBinWinogradRxSf3x2:0.06944,0,miopenConvolutionFwdAlgoWinograd;GemmFwd1x1_0_1:0.02192,0,miopenConvolutionFwdAlgoGEMM;ConvDirectNaiveConvFwd:0.171521,0,miopenConvolutionFwdAlgoDirect
80-8-8-3x3-80-8-8-1-1x1-1x1-1x1-0-NCHW-FP32-F_g80=ConvBinWinogradRxSf2x3:0.01792,0,miopenConvolutionFwdAlgoWinograd;ConvBinWinogradRxSf3x2:0.02128,0,miopenConvolutionFwdAlgoWinograd;GemmFwdRest:0.02672,184320,miopenConvolutionFwdAlgoGEMM;ConvDirectNaiveConvFwd:0.01072,0,miopenConvolutionFwdAlgoDirect
80-8-8-1x1-80-8-8-1-0x0-1x1-1x1-0-NCHW-FP32-F=ConvBinWinogradRxSf2x3g1:0.034561,0,miopenConvolutionFwdAlgoWinograd;ConvBinWinogradRxSf3x2:0.03648,0,miopenConvolutionFwdAlgoWinograd;GemmFwd1x1_0_1:0.02688,0,miopenConvolutionFwdAlgoGEMM;ConvDirectNaiveConvFwd:0.05248,0,miopenConvolutionFwdAlgoDirect
3-256-192-3x3-16-128-96-8-1x1-2x2-1x1-0-NCHW-FP32-F=ConvBinWinogradRxSf2x3g1:0.07472,0,miopenConvolutionFwdAlgoWinograd;ConvBinWinogradRxSf3x2:0.073121,0,miopenConvolutionFwdAlgoWinograd;GemmFwdRest:0.24192,1327104,miopenConvolutionFwdAlgoGEMM;ConvDirectNaiveConvFwd:0.429441,0,miopenConvolutionFwdAlgoDirect
16-128-96-3x3-32-64-48-8-1x1-2x2-1x1-0-NCHW-FP32-F=ConvBinWinogradRxSf2x3g1:0.055521,0,miopenConvolutionFwdAlgoWinograd;ConvBinWinogradRxSf3x2:0.0344,0,miopenConvolutionFwdAlgoWinograd;GemmFwdRest:0.2368,1769472,miopenConvolutionFwdAlgoGEMM;ConvDirectNaiveConvFwd:0.624322,0,miopenConvolutionFwdAlgoDirect
32-64-48-1x1-32-64-48-8-0x0-1x1-1x1-0-NCHW-FP32-F=ConvBinWinogradRxSf2x3g1:0.04976,0,miopenConvolutionFwdAlgoWinograd;ConvBinWinogradRxSf3x2:0.05392,0,miopenConvolutionFwdAlgoWinograd;GemmFwd1x1_0_1:0.02016,0,miopenConvolutionFwdAlgoGEMM;ConvDirectNaiveConvFwd:0.24432,0,miopenConvolutionFwdAlgoDirect
16-64-48-3x3-8-64-48-8-1x1-1x1-1x1-0-NCHW-FP32-F=ConvBinWinogradRxSf2x3g1:0.03264,0,miopenConvolutionFwdAlgoWinograd;ConvBinWinogradRxSf3x2:0.04432,0,miopenConvolutionFwdAlgoWinograd;GemmFwdRest:0.2496,1769472,miopenConvolutionFwdAlgoGEMM;ConvDirectNaiveConvFwd:0.560002,0,miopenConvolutionFwdAlgoDirect
8-64-48-3x3-16-64-48-8-1x1-1x1-1x1-0-NCHW-FP32-F=ConvBinWinogradRxSf2x3g1:0.0264,0,miopenConvolutionFwdAlgoWinograd;ConvBinWinogradRxSf3x2:0.035201,0,miopenConvolutionFwdAlgoWinograd;GemmFwdRest:0.23168,884736,miopenConvolutionFwdAlgoGEMM;ConvDirectNaiveConvFwd:0.289601,0,miopenConvolutionFwdAlgoDirect
48-64-48-1x1-64-64-48-8-0x0-1x1-1x1-0-NCHW-FP32-F=ConvBinWinogradRxSf2x3g1:0.06912,0,miopenConvolutionFwdAlgoWinograd;ConvBinWinogradRxSf3x2:0.05584,0,miopenConvolutionFwdAlgoWinograd;GemmFwd1x1_0_1:0.03408,0,miopenConvolutionFwdAlgoGEMM;ConvDirectNaiveConvFwd:0.398401,0,miopenConvolutionFwdAlgoDirect
64-64-48-3x3-64-32-24-8-1x1-2x2-1x1-0-NCHW-FP32-F=ConvBinWinogradRxSf2x3g1:0.092321,0,miopenConvolutionFwdAlgoWinograd;ConvBinWinogradRxSf3x2:0.09856,0,miopenConvolutionFwdAlgoWinograd;GemmFwdRest:0.44416,1769472,miopenConvolutionFwdAlgoGEMM;ConvDirectNaiveConvFwd:0.806082,0,miopenConvolutionFwdAlgoDirect
64-32-24-1x1-64-32-24-8-0x0-1x1-1x1-0-NCHW-FP32-F=ConvBinWinogradRxSf2x3g1:0.050081,0,miopenConvolutionFwdAlgoWinograd;ConvBinWinogradRxSf3x2:0.05616,0,miopenConvolutionFwdAlgoWinograd;GemmFwd1x1_0_1:0.0216,0,miopenConvolutionFwdAlgoGEMM;ConvDirectNaiveConvFwd:0.135681,0,miopenConvolutionFwdAlgoDirect
32-32-24-3x3-16-32-24-8-1x1-1x1-1x1-0-NCHW-FP32-F=ConvBinWinogradRxSf2x3g1:0.03088,0,miopenConvolutionFwdAlgoWinograd;ConvBinWinogradRxSf3x2:0.05824,0,miopenConvolutionFwdAlgoWinograd;GemmFwdRest:0.24704,884736,miopenConvolutionFwdAlgoGEMM;ConvDirectNaiveConvFwd:0.276161,0,miopenConvolutionFwdAlgoDirect
16-32-24-3x3-32-32-24-8-1x1-1x1-1x1-0-NCHW-FP32-F=ConvBinWinogradRxSf2x3g1:0.024961,0,miopenConvolutionFwdAlgoWinograd;ConvBinWinogradRxSf3x2:0.04112,0,miopenConvolutionFwdAlgoWinograd;GemmFwdRest:0.21632,442368,miopenConvolutionFwdAlgoGEMM;ConvDirectNaiveConvFwd:0.153121,0,miopenConvolutionFwdAlgoDirect
96-32-24-1x1-128-32-24-8-0x0-1x1-1x1-0-NCHW-FP32-F=ConvBinWinogradRxSf2x3g1:0.0624,0,miopenConvolutionFwdAlgoWinograd;ConvBinWinogradRxSf3x2:0.04912,0,miopenConvolutionFwdAlgoWinograd;GemmFwd1x1_0_1:0.03472,0,miopenConvolutionFwdAlgoGEMM;ConvDirectNaiveConvFwd:0.378082,0,miopenConvolutionFwdAlgoDirect
128-32-24-3x3-128-16-12-8-1x1-2x2-1x1-0-NCHW-FP32-F=ConvBinWinogradRxSf2x3g1:0.14496,0,miopenConvolutionFwdAlgoWinograd;ConvBinWinogradRxSf3x2:0.150721,0,miopenConvolutionFwdAlgoWinograd;GemmFwdRest:0.32896,884736,miopenConvolutionFwdAlgoGEMM;ConvDirectNaiveConvFwd:0.899203,0,miopenConvolutionFwdAlgoDirect
128-16-12-1x1-128-16-12-8-0x0-1x1-1x1-0-NCHW-FP32-F=ConvBinWinogradRxSf2x3g1:0.062081,0,miopenConvolutionFwdAlgoWinograd;ConvBinWinogradRxSf3x2:0.0672,0,miopenConvolutionFwdAlgoWinograd;GemmFwd1x1_0_1:0.02016,0,miopenConvolutionFwdAlgoGEMM;ConvDirectNaiveConvFwd:0.119521,0,miopenConvolutionFwdAlgoDirect
64-16-12-1x1-32-16-12-8-0x0-1x1-1x1-0-NCHW-FP32-F=ConvBinWinogradRxSf2x3g1:0.0368,0,miopenConvolutionFwdAlgoWinograd;ConvBinWinogradRxSf3x2:0.04144,0,miopenConvolutionFwdAlgoWinograd;GemmFwd1x1_0_1:0.01824,0,miopenConvolutionFwdAlgoGEMM;ConvDirectNaiveConvFwd:0.04864,0,miopenConvolutionFwdAlgoDirect
32-16-12-3x3-32-16-12-8-1x1-1x1-1x1-0-NCHW-FP32-F=ConvBinWinogradRxSf2x3g1:0.02752,0,miopenConvolutionFwdAlgoWinograd;ConvBinWinogradRxSf3x2:0.0504,0,miopenConvolutionFwdAlgoWinograd;GemmFwdRest:0.22784,221184,miopenConvolutionFwdAlgoGEMM;ConvDirectNaiveConvFwd:0.0872,0,miopenConvolutionFwdAlgoDirect
64-16-12-1x1-64-16-12-8-0x0-1x1-1x1-0-NCHW-FP32-F=ConvBinWinogradRxSf2x3g1:0.036001,0,miopenConvolutionFwdAlgoWinograd;ConvBinWinogradRxSf3x2:0.04416,0,miopenConvolutionFwdAlgoWinograd;GemmFwd1x1_0_1:0.01664,0,miopenConvolutionFwdAlgoGEMM;ConvDirectNaiveConvFwd:0.0512,0,miopenConvolutionFwdAlgoDirect
192-16-12-1x1-128-16-12-8-0x0-1x1-1x1-0-NCHW-FP32-F=ConvBinWinogradRxSf2x3g1:0.063361,0,miopenConvolutionFwdAlgoWinograd;ConvBinWinogradRxSf3x2:0.06704,0,miopenConvolutionFwdAlgoWinograd;GemmFwd1x1_0_1:0.0232,0,miopenConvolutionFwdAlgoGEMM;ConvDirectNaiveConvFwd:0.178401,0,miopenConvolutionFwdAlgoDirect
128-16-12-3x3-256-8-6-8-1x1-2x2-1x1-0-NCHW-FP32-F=ConvBinWinogradRxSf2x3g1:0.145921,0,miopenConvolutionFwdAlgoWinograd;ConvBinWinogradRxSf3x2:0.15072,0,miopenConvolutionFwdAlgoWinograd;GemmFwdRest:0.32384,221184,miopenConvolutionFwdAlgoGEMM;ConvDirectNaiveConvFwd:0.694402,0,miopenConvolutionFwdAlgoDirect
256-8-6-1x1-256-8-6-8-0x0-1x1-1x1-0-NCHW-FP32-F=ConvBinWinogradRxSf2x3g1:0.088801,0,miopenConvolutionFwdAlgoWinograd;ConvBinWinogradRxSf3x2:0.09216,0,miopenConvolutionFwdAlgoWinograd;GemmFwd1x1_0_1:0.04,0,miopenConvolutionFwdAlgoGEMM;ConvDirectNaiveConvFwd:0.334241,0,miopenConvolutionFwdAlgoDirect
128-8-6-1x1-64-8-6-8-0x0-1x1-1x1-0-NCHW-FP32-F=ConvBinWinogradRxSf2x3g1:0.05072,0,miopenConvolutionFwdAlgoWinograd;ConvBinWinogradRxSf3x2:0.05152,0,miopenConvolutionFwdAlgoWinograd;GemmFwd1x1_0_1:0.01792,0,miopenConvolutionFwdAlgoGEMM;ConvDirectNaiveConvFwd:0.09104,0,miopenConvolutionFwdAlgoDirect
64-8-6-3x3-64-8-6-8-1x1-1x1-1x1-0-NCHW-FP32-F=ConvBinWinogradRxSf2x3g1:0.03344,0,miopenConvolutionFwdAlgoWinograd;ConvBinWinogradRxSf3x2:0.073441,0,miopenConvolutionFwdAlgoWinograd;GemmFwdRest:0.2496,110592,miopenConvolutionFwdAlgoGEMM;ConvDirectNaiveConvFwd:0.143041,0,miopenConvolutionFwdAlgoDirect
128-8-6-1x1-128-8-6-8-0x0-1x1-1x1-0-NCHW-FP32-F=ConvBinWinogradRxSf2x3g1:0.04624,0,miopenConvolutionFwdAlgoWinograd;ConvBinWinogradRxSf3x2:0.052001,0,miopenConvolutionFwdAlgoWinograd;GemmFwd1x1_0_1:0.02368,0,miopenConvolutionFwdAlgoGEMM;ConvDirectNaiveConvFwd:0.09472,0,miopenConvolutionFwdAlgoDirect
384-8-6-1x1-256-8-6-8-0x0-1x1-1x1-0-NCHW-FP32-F=ConvBinWinogradRxSf2x3g1:0.09664,0,miopenConvolutionFwdAlgoWinograd;ConvBinWinogradRxSf3x2:0.096961,0,miopenConvolutionFwdAlgoWinograd;GemmFwd1x1_0_1:0.04576,0,miopenConvolutionFwdAlgoGEMM;ConvDirectNaiveConvFwd:0.491682,0,miopenConvolutionFwdAlgoDirect
256-8-6-1x1-128-8-6-8-0x0-1x1-1x1-0-NCHW-FP32-F=ConvBinWinogradRxSf2x3g1:0.07504,0,miopenConvolutionFwdAlgoWinograd;ConvBinWinogradRxSf3x2:0.07456,0,miopenConvolutionFwdAlgoWinograd;GemmFwd1x1_0_1:0.0192,0,miopenConvolutionFwdAlgoGEMM;ConvDirectNaiveConvFwd:0.1816,0,miopenConvolutionFwdAlgoDirect
512-8-6-1x1-256-8-6-8-0x0-1x1-1x1-0-NCHW-FP32-F=ConvBinWinogradRxSf2x3g1:0.1264,0,miopenConvolutionFwdAlgoWinograd;ConvBinWinogradRxSf3x2:0.126561,0,miopenConvolutionFwdAlgoWinograd;GemmFwd1x1_0_1:0.0336,0,miopenConvolutionFwdAlgoGEMM;ConvDirectNaiveConvFwd:0.660162,0,miopenConvolutionFwdAlgoDirect
128-8-6-1x1-256-8-6-8-0x0-1x1-1x1-0-NCHW-FP32-F=ConvBinWinogradRxSf2x3g1:0.04864,0,miopenConvolutionFwdAlgoWinograd;ConvBinWinogradRxSf3x2:0.05536,0,miopenConvolutionFwdAlgoWinograd;GemmFwd1x1_0_1:0.02112,0,miopenConvolutionFwdAlgoGEMM;ConvDirectNaiveConvFwd:0.171521,0,miopenConvolutionFwdAlgoDirect
128-8-6-3x3-128-8-6-8-1x1-1x1-1x1-0-NCHW-FP32-F_g128=ConvBinWinogradRxSf2x3:0.05232,0,miopenConvolutionFwdAlgoWinograd;ConvBinWinogradRxSf3x2:0.06496,0,miopenConvolutionFwdAlgoWinograd;GemmFwdRest:0.181768,221184,miopenConvolutionFwdAlgoGEMM;ConvDirectNaiveConvFwd:0.01104,0,miopenConvolutionFwdAlgoDirect
384-16-12-1x1-128-16-12-8-0x0-1x1-1x1-0-NCHW-FP32-F=ConvBinWinogradRxSf2x3g1:0.102241,0,miopenConvolutionFwdAlgoWinograd;ConvBinWinogradRxSf3x2:0.1056,0,miopenConvolutionFwdAlgoWinograd;GemmFwd1x1_0_1:0.02816,0,miopenConvolutionFwdAlgoGEMM;ConvDirectNaiveConvFwd:0.350401,0,miopenConvolutionFwdAlgoDirect
256-32-24-1x1-64-32-24-8-0x0-1x1-1x1-0-NCHW-FP32-F=ConvBinWinogradRxSf2x3g1:0.08224,0,miopenConvolutionFwdAlgoWinograd;ConvBinWinogradRxSf3x2:0.09088,0,miopenConvolutionFwdAlgoWinograd;GemmFwd1x1_0_1:0.02576,0,miopenConvolutionFwdAlgoGEMM;ConvDirectNaiveConvFwd:0.513602,0,miopenConvolutionFwdAlgoDirect
32-32-24-1x1-16-32-24-8-0x0-1x1-1x1-0-NCHW-FP32-F=ConvBinWinogradRxSf2x3g1:0.02832,0,miopenConvolutionFwdAlgoWinograd;ConvBinWinogradRxSf3x2:0.03632,0,miopenConvolutionFwdAlgoWinograd;GemmFwd1x1_0_1:0.0152,0,miopenConvolutionFwdAlgoGEMM;ConvDirectNaiveConvFwd:0.065921,0,miopenConvolutionFwdAlgoDirect
16-32-24-3x3-16-32-24-8-1x1-1x1-1x1-0-NCHW-FP32-F=ConvBinWinogradRxSf2x3g1:0.0232,0,miopenConvolutionFwdAlgoWinograd;ConvBinWinogradRxSf3x2:0.04048,0,miopenConvolutionFwdAlgoWinograd;GemmFwdRest:0.212488,442368,miopenConvolutionFwdAlgoGEMM;ConvDirectNaiveConvFwd:0.13936,0,miopenConvolutionFwdAlgoDirect
32-32-24-1x1-32-32-24-8-0x0-1x1-1x1-0-NCHW-FP32-F=ConvBinWinogradRxSf2x3g1:0.03024,0,miopenConvolutionFwdAlgoWinograd;ConvBinWinogradRxSf3x2:0.03552,0,miopenConvolutionFwdAlgoWinograd;GemmFwd1x1_0_1:0.01648,0,miopenConvolutionFwdAlgoGEMM;ConvDirectNaiveConvFwd:0.06864,0,miopenConvolutionFwdAlgoDirect
96-32-24-1x1-64-32-24-8-0x0-1x1-1x1-0-NCHW-FP32-F=ConvBinWinogradRxSf2x3g1:0.04256,0,miopenConvolutionFwdAlgoWinograd;ConvBinWinogradRxSf3x2:0.048,0,miopenConvolutionFwdAlgoWinograd;GemmFwd1x1_0_1:0.02256,0,miopenConvolutionFwdAlgoGEMM;ConvDirectNaiveConvFwd:0.201121,0,miopenConvolutionFwdAlgoDirect
64-32-24-3x3-64-16-12-8-1x1-2x2-1x1-0-NCHW-FP32-F=ConvBinWinogradRxSf2x3g1:0.08912,0,miopenConvolutionFwdAlgoWinograd;ConvBinWinogradRxSf3x2:0.099841,0,miopenConvolutionFwdAlgoWinograd;GemmFwdRest:0.27904,442368,miopenConvolutionFwdAlgoGEMM;ConvDirectNaiveConvFwd:0.260801,0,miopenConvolutionFwdAlgoDirect
128-16-12-3x3-128-8-6-8-1x1-2x2-1x1-0-NCHW-FP32-F=ConvBinWinogradRxSf2x3g1:0.144481,0,miopenConvolutionFwdAlgoWinograd;ConvBinWinogradRxSf3x2:0.14928,0,miopenConvolutionFwdAlgoWinograd;GemmFwdRest:0.32,221184,miopenConvolutionFwdAlgoGEMM;ConvDirectNaiveConvFwd:0.372321,0,miopenConvolutionFwdAlgoDirect
128-8-6-3x3-64-8-6-8-1x1-1x1-1x1-0-NCHW-FP32-F=ConvBinWinogradRxSf2x3g1:0.060801,0,miopenConvolutionFwdAlgoWinograd;ConvBinWinogradRxSf3x2:0.14432,0,miopenConvolutionFwdAlgoWinograd;GemmFwdRest:0.303368,221184,miopenConvolutionFwdAlgoGEMM;ConvDirectNaiveConvFwd:0.27744,0,miopenConvolutionFwdAlgoDirect
64-8-6-3x3-128-8-6-8-1x1-1x1-1x1-0-NCHW-FP32-F=ConvBinWinogradRxSf2x3g1:0.029281,0,miopenConvolutionFwdAlgoWinograd;ConvBinWinogradRxSf3x2:0.0712,0,miopenConvolutionFwdAlgoWinograd;GemmFwdRest:0.25344,110592,miopenConvolutionFwdAlgoGEMM;ConvDirectNaiveConvFwd:0.173441,0,miopenConvolutionFwdAlgoDirect
64-32-24-3x3-16-32-24-8-1x1-1x1-1x1-0-NCHW-FP32-F=ConvBinWinogradRxSf2x3g1:0.0384,0,miopenConvolutionFwdAlgoWinograd;ConvBinWinogradRxSf3x2:0.08528,0,miopenConvolutionFwdAlgoWinograd;GemmFwdRest:0.48768,1769472,miopenConvolutionFwdAlgoGEMM;ConvDirectNaiveConvFwd:0.541281,0,miopenConvolutionFwdAlgoDirect
16-32-24-1x1-4-32-24-8-0x0-1x1-1x1-0-NCHW-FP32-F=ConvBinWinogradRxSf2x3g1:0.01808,0,miopenConvolutionFwdAlgoWinograd;ConvBinWinogradRxSf3x2:0.02464,0,miopenConvolutionFwdAlgoWinograd;GemmFwd1x1_0_1:0.01504,0,miopenConvolutionFwdAlgoGEMM;ConvDirectNaiveConvFwd:0.03632,0,miopenConvolutionFwdAlgoDirect
128-16-12-3x3-16-16-12-8-1x1-1x1-1x1-0-NCHW-FP32-F=ConvBinWinogradRxSf2x3g1:0.04512,0,miopenConvolutionFwdAlgoWinograd;ConvBinWinogradRxSf3x2:0.12304,0,miopenConvolutionFwdAlgoWinograd;GemmFwdRest:0.3264,884736,miopenConvolutionFwdAlgoGEMM;ConvDirectNaiveConvFwd:0.282081,0,miopenConvolutionFwdAlgoDirect
16-16-12-3x3-16-16-12-8-1x1-1x1-1x1-0-NCHW-FP32-F=ConvBinWinogradRxSf2x3g1:0.02016,0,miopenConvolutionFwdAlgoWinograd;ConvBinWinogradRxSf3x2:0.03424,0,miopenConvolutionFwdAlgoWinograd;GemmFwdRest:0.224,110592,miopenConvolutionFwdAlgoGEMM;ConvDirectNaiveConvFwd:0.0424,0,miopenConvolutionFwdAlgoDirect
16-16-12-1x1-4-16-12-8-0x0-1x1-1x1-0-NCHW-FP32-F=ConvBinWinogradRxSf2x3g1:0.0176,0,miopenConvolutionFwdAlgoWinograd;ConvBinWinogradRxSf3x2:0.0224,0,miopenConvolutionFwdAlgoWinograd;GemmFwd1x1_0_1:0.01616,0,miopenConvolutionFwdAlgoGEMM;ConvDirectNaiveConvFwd:0.01728,0,miopenConvolutionFwdAlgoDirect
256-8-6-3x3-16-8-6-8-1x1-1x1-1x1-0-NCHW-FP32-F=ConvBinWinogradRxSf2x3g1:0.0696,0,miopenConvolutionFwdAlgoWinograd;ConvBinWinogradRxSf3x2:0.213601,0,miopenConvolutionFwdAlgoWinograd;GemmFwdRest:0.4352,442368,miopenConvolutionFwdAlgoGEMM;ConvDirectNaiveConvFwd:0.537762,0,miopenConvolutionFwdAlgoDirect
16-8-6-3x3-16-8-6-8-1x1-1x1-1x1-0-NCHW-FP32-F=ConvBinWinogradRxSf2x3g1:0.02016,0,miopenConvolutionFwdAlgoWinograd;ConvBinWinogradRxSf3x2:0.0328,0,miopenConvolutionFwdAlgoWinograd;GemmFwdRest:0.27008,27648,miopenConvolutionFwdAlgoGEMM;ConvDirectNaiveConvFwd:0.03968,0,miopenConvolutionFwdAlgoDirect
16-8-6-1x1-4-8-6-8-0x0-1x1-1x1-0-NCHW-FP32-F=ConvBinWinogradRxSf2x3g1:0.01744,0,miopenConvolutionFwdAlgoWinograd;ConvBinWinogradRxSf3x2:0.02224,0,miopenConvolutionFwdAlgoWinograd;GemmFwd1x1_0_1:0.01728,0,miopenConvolutionFwdAlgoGEMM;ConvDirectNaiveConvFwd:0.01712,0,miopenConvolutionFwdAlgoDirect
64-32-24-3x3-64-32-24-8-1x1-1x1-1x1-0-NCHW-FP32-F_g64=ConvBinWinogradRxSf2x3:0.09552,0,miopenConvolutionFwdAlgoWinograd;ConvBinWinogradRxSf3x2:0.117921,0,miopenConvolutionFwdAlgoWinograd;GemmFwdRest:0.21888,1769472,miopenConvolutionFwdAlgoGEMM;ConvDirectNaiveConvFwd:0.02128,0,miopenConvolutionFwdAlgoDirect
64-32-24-1x1-80-32-24-8-0x0-1x1-1x1-0-NCHW-FP32-F=ConvBinWinogradRxSf2x3g1:0.0472,0,miopenConvolutionFwdAlgoWinograd;ConvBinWinogradRxSf3x2:0.03584,0,miopenConvolutionFwdAlgoWinograd;GemmFwd1x1_0_1:0.02176,0,miopenConvolutionFwdAlgoGEMM;ConvDirectNaiveConvFwd:0.157761,0,miopenConvolutionFwdAlgoDirect
80-32-24-3x3-80-32-24-8-1x1-1x1-1x1-0-NCHW-FP32-F_g80=ConvBinWinogradRxSf2x3:0.13472,0,miopenConvolutionFwdAlgoWinograd;ConvBinWinogradRxSf3x2:0.14144,0,miopenConvolutionFwdAlgoWinograd;GemmFwdRest:0.22784,2211840,miopenConvolutionFwdAlgoGEMM;ConvDirectNaiveConvFwd:0.02528,0,miopenConvolutionFwdAlgoDirect
80-32-24-1x1-80-32-24-8-0x0-1x1-1x1-0-NCHW-FP32-F=ConvBinWinogradRxSf2x3g1:0.05712,0,miopenConvolutionFwdAlgoWinograd;ConvBinWinogradRxSf3x2:0.04512,0,miopenConvolutionFwdAlgoWinograd;GemmFwd1x1_0_1:0.02432,0,miopenConvolutionFwdAlgoGEMM;ConvDirectNaiveConvFwd:0.19568,0,miopenConvolutionFwdAlgoDirect
128-16-12-3x3-128-16-12-8-1x1-1x1-1x1-0-NCHW-FP32-F_g128=ConvBinWinogradRxSf2x3:0.08768,0,miopenConvolutionFwdAlgoWinograd;ConvBinWinogradRxSf3x2:0.096641,0,miopenConvolutionFwdAlgoWinograd;GemmFwdRest:0.19968,884736,miopenConvolutionFwdAlgoGEMM;ConvDirectNaiveConvFwd:0.01472,0,miopenConvolutionFwdAlgoDirect
128-16-12-1x1-80-16-12-8-0x0-1x1-1x1-0-NCHW-FP32-F=ConvBinWinogradRxSf2x3g1:0.0488,0,miopenConvolutionFwdAlgoWinograd;ConvBinWinogradRxSf3x2:0.04976,0,miopenConvolutionFwdAlgoWinograd;GemmFwd1x1_0_1:0.019361,0,miopenConvolutionFwdAlgoGEMM;ConvDirectNaiveConvFwd:0.09504,0,miopenConvolutionFwdAlgoDirect
80-16-12-3x3-80-16-12-8-1x1-1x1-1x1-0-NCHW-FP32-F_g80=ConvBinWinogradRxSf2x3:0.07456,0,miopenConvolutionFwdAlgoWinograd;ConvBinWinogradRxSf3x2:0.08944,0,miopenConvolutionFwdAlgoWinograd;GemmFwdRest:0.19328,552960,miopenConvolutionFwdAlgoGEMM;ConvDirectNaiveConvFwd:0.01296,0,miopenConvolutionFwdAlgoDirect
80-16-12-1x1-80-16-12-8-0x0-1x1-1x1-0-NCHW-FP32-F=ConvBinWinogradRxSf2x3g1:0.03856,0,miopenConvolutionFwdAlgoWinograd;ConvBinWinogradRxSf3x2:0.04048,0,miopenConvolutionFwdAlgoWinograd;GemmFwd1x1_0_1:0.01728,0,miopenConvolutionFwdAlgoGEMM;ConvDirectNaiveConvFwd:0.06192,0,miopenConvolutionFwdAlgoDirect
256-8-6-3x3-256-8-6-8-1x1-1x1-1x1-0-NCHW-FP32-F_g256=ConvBinWinogradRxSf2x3:0.08672,0,miopenConvolutionFwdAlgoWinograd;ConvBinWinogradRxSf3x2:0.084481,0,miopenConvolutionFwdAlgoWinograd;GemmFwdRest:0.1984,442368,miopenConvolutionFwdAlgoGEMM;ConvDirectNaiveConvFwd:0.01488,0,miopenConvolutionFwdAlgoDirect
256-8-6-1x1-80-8-6-8-0x0-1x1-1x1-0-NCHW-FP32-F=ConvBinWinogradRxSf2x3g1:0.07216,0,miopenConvolutionFwdAlgoWinograd;ConvBinWinogradRxSf3x2:0.07088,0,miopenConvolutionFwdAlgoWinograd;GemmFwd1x1_0_1:0.02128,0,miopenConvolutionFwdAlgoGEMM;ConvDirectNaiveConvFwd:0.1696,0,miopenConvolutionFwdAlgoDirect
80-8-6-3x3-80-8-6-8-1x1-1x1-1x1-0-NCHW-FP32-F_g80=ConvBinWinogradRxSf2x3:0.02544,0,miopenConvolutionFwdAlgoWinograd;ConvBinWinogradRxSf3x2:0.03024,0,miopenConvolutionFwdAlgoWinograd;GemmFwdRest:0.19328,138240,miopenConvolutionFwdAlgoGEMM;ConvDirectNaiveConvFwd:0.01056,0,miopenConvolutionFwdAlgoDirect
80-8-6-1x1-80-8-6-8-0x0-1x1-1x1-0-NCHW-FP32-F=ConvBinWinogradRxSf2x3g1:0.035041,0,miopenConvolutionFwdAlgoWinograd;ConvBinWinogradRxSf3x2:0.0392,0,miopenConvolutionFwdAlgoWinograd;GemmFwd1x1_0_1:0.02416,0,miopenConvolutionFwdAlgoGEMM;ConvDirectNaiveConvFwd:0.0536,0,miopenConvolutionFwdAlgoDirect
3-256-192-3x3-16-128-96-8-1x1-2x2-1x1-0-NCHW-FP16-F=ConvBinWinogradRxSf2x3g1:0.08096,0,miopenConvolutionFwdAlgoWinograd;ConvBinWinogradRxSf3x2:0.0816,0,miopenConvolutionFwdAlgoWinograd;GemmFwdRest:0.43648,663552,miopenConvolutionFwdAlgoGEMM;ConvDirectNaiveConvFwd:0.412961,0,miopenConvolutionFwdAlgoDirect
16-128-96-3x3-32-64-48-8-1x1-2x2-1x1-0-NCHW-FP16-F=ConvBinWinogradRxSf2x3g1:0.05504,0,miopenConvolutionFwdAlgoWinograd;ConvBinWinogradRxSf3x2:0.05584,0,miopenConvolutionFwdAlgoWinograd;GemmFwdRest:0.24192,884736,miopenConvolutionFwdAlgoGEMM;ConvDirectNaiveConvFwd:0.593442,0,miopenConvolutionFwdAlgoDirect
32-64-48-1x1-32-64-48-8-0x0-1x1-1x1-0-NCHW-FP16-F=ConvBinWinogradRxSf2x3g1:0.0536,0,miopenConvolutionFwdAlgoWinograd;ConvBinWinogradRxSf3x2:0.05648,0,miopenConvolutionFwdAlgoWinograd;GemmFwd1x1_0_1:0.01968,0,miopenConvolutionFwdAlgoGEMM;ConvDirectNaiveConvFwd:0.24032,0,miopenConvolutionFwdAlgoDirect
16-64-48-3x3-8-64-48-8-1x1-1x1-1x1-0-NCHW-FP16-F=ConvBinWinogradRxSf2x3g1:0.05088,0,miopenConvolutionFwdAlgoWinograd;ConvBinWinogradRxSf3x2:0.06096,0,miopenConvolutionFwdAlgoWinograd;GemmFwdRest:0.259848,884736,miopenConvolutionFwdAlgoGEMM;ConvDirectNaiveConvFwd:0.522561,0,miopenConvolutionFwdAlgoDirect
8-64-48-3x3-16-64-48-8-1x1-1x1-1x1-0-NCHW-FP16-F=ConvBinWinogradRxSf2x3g1:0.04176,0,miopenConvolutionFwdAlgoWinograd;ConvBinWinogradRxSf3x2:0.05152,0,miopenConvolutionFwdAlgoWinograd;GemmFwdRest:0.22016,442368,miopenConvolutionFwdAlgoGEMM;ConvDirectNaiveConvFwd:0.267361,0,miopenConvolutionFwdAlgoDirect
48-64-48-1x1-64-64-48-8-0x0-1x1-1x1-0-NCHW-FP16-F=ConvBinWinogradRxSf2x3g1:0.064,0,miopenConvolutionFwdAlgoWinograd;ConvBinWinogradRxSf3x2:0.06528,0,miopenConvolutionFwdAlgoWinograd;GemmFwd1x1_0_1:0.029281,0,miopenConvolutionFwdAlgoGEMM;ConvDirectNaiveConvFwd:0.399841,0,miopenConvolutionFwdAlgoDirect
64-64-48-3x3-64-32-24-8-1x1-2x2-1x1-0-NCHW-FP16-F=ConvBinWinogradRxSf2x3g1:0.07696,0,miopenConvolutionFwdAlgoWinograd;ConvBinWinogradRxSf3x2:0.08528,0,miopenConvolutionFwdAlgoWinograd;GemmFwdRest:0.49408,884736,miopenConvolutionFwdAlgoGEMM;ConvDirectNaiveConvFwd:0.766562,0,miopenConvolutionFwdAlgoDirect
64-32-24-1x1-64-32-24-8-0x0-1x1-1x1-0-NCHW-FP16-F=ConvBinWinogradRxSf2x3g1:0.053281,0,miopenConvolutionFwdAlgoWinograd;ConvBinWinogradRxSf3x2:0.06512,0,miopenConvolutionFwdAlgoWinograd;GemmFwd1x1_0_1:0.0176,0,miopenConvolutionFwdAlgoGEMM;ConvDirectNaiveConvFwd:0.137921,0,miopenConvolutionFwdAlgoDirect
32-32-24-3x3-16-32-24-8-1x1-1x1-1x1-0-NCHW-FP16-F=ConvBinWinogradRxSf2x3g1:0.04624,0,miopenConvolutionFwdAlgoWinograd;ConvBinWinogradRxSf3x2:0.068481,0,miopenConvolutionFwdAlgoWinograd;GemmFwdRest:0.24832,442368,miopenConvolutionFwdAlgoGEMM;ConvDirectNaiveConvFwd:0.244321,0,miopenConvolutionFwdAlgoDirect
16-32-24-3x3-32-32-24-8-1x1-1x1-1x1-0-NCHW-FP16-F=ConvBinWinogradRxSf2x3g1:0.03888,0,miopenConvolutionFwdAlgoWinograd;ConvBinWinogradRxSf3x2:0.05296,0,miopenConvolutionFwdAlgoWinograd;GemmFwdRest:0.21504,221184,miopenConvolutionFwdAlgoGEMM;ConvDirectNaiveConvFwd:0.14016,0,miopenConvolutionFwdAlgoDirect
96-32-24-1x1-128-32-24-8-0x0-1x1-1x1-0-NCHW-FP16-F=ConvBinWinogradRxSf2x3g1:0.06656,0,miopenConvolutionFwdAlgoWinograd;ConvBinWinogradRxSf3x2:0.06272,0,miopenConvolutionFwdAlgoWinograd;GemmFwd1x1_0_1:0.01904,0,miopenConvolutionFwdAlgoGEMM;ConvDirectNaiveConvFwd:0.369121,0,miopenConvolutionFwdAlgoDirect
128-32-24-3x3-128-16-12-8-1x1-2x2-1x1-0-NCHW-FP16-F=ConvBinWinogradRxSf2x3g1:0.11408,0,miopenConvolutionFwdAlgoWinograd;ConvBinWinogradRxSf3x2:0.127521,0,miopenConvolutionFwdAlgoWinograd;GemmFwdRest:0.4736,442368,miopenConvolutionFwdAlgoGEMM;ConvDirectNaiveConvFwd:0.773603,0,miopenConvolutionFwdAlgoDirect
128-16-12-1x1-128-16-12-8-0x0-1x1-1x1-0-NCHW-FP16-F=ConvBinWinogradRxSf2x3g1:0.06256,0,miopenConvolutionFwdAlgoWinograd;ConvBinWinogradRxSf3x2:0.07296,0,miopenConvolutionFwdAlgoWinograd;GemmFwd1x1_0_1:0.04736,0,miopenConvolutionFwdAlgoGEMM;ConvDirectNaiveConvFwd:0.12144,0,miopenConvolutionFwdAlgoDirect
64-16-12-1x1-32-16-12-8-0x0-1x1-1x1-0-NCHW-FP16-F=ConvBinWinogradRxSf2x3g1:0.04944,0,miopenConvolutionFwdAlgoWinograd;ConvBinWinogradRxSf3x2:0.05856,0,miopenConvolutionFwdAlgoWinograd;GemmFwd1x1_0_1:0.020161,0,miopenConvolutionFwdAlgoGEMM;ConvDirectNaiveConvFwd:0.04736,0,miopenConvolutionFwdAlgoDirect
32-16-12-3x3-32-16-12-8-1x1-1x1-1x1-0-NCHW-FP16-F=ConvBinWinogradRxSf2x3g1:0.04176,0,miopenConvolutionFwdAlgoWinograd;ConvBinWinogradRxSf3x2:0.0632,0,miopenConvolutionFwdAlgoWinograd;GemmFwdRest:0.23808,110592,miopenConvolutionFwdAlgoGEMM;ConvDirectNaiveConvFwd:0.090721,0,miopenConvolutionFwdAlgoDirect
64-16-12-1x1-64-16-12-8-0x0-1x1-1x1-0-NCHW-FP16-F=ConvBinWinogradRxSf2x3g1:0.04944,0,miopenConvolutionFwdAlgoWinograd;ConvBinWinogradRxSf3x2:0.05952,0,miopenConvolutionFwdAlgoWinograd;GemmFwd1x1_0_1:0.01936,0,miopenConvolutionFwdAlgoGEMM;ConvDirectNaiveConvFwd:0.05056,0,miopenConvolutionFwdAlgoDirect
192-16-12-1x1-128-16-12-8-0x0-1x1-1x1-0-NCHW-FP16-F=ConvBinWinogradRxSf2x3g1:0.062401,0,miopenConvolutionFwdAlgoWinograd;ConvBinWinogradRxSf3x2:0.0728,0,miopenConvolutionFwdAlgoWinograd;GemmFwd1x1_0_1:0.03168,0,miopenConvolutionFwdAlgoGEMM;ConvDirectNaiveConvFwd:0.176001,0,miopenConvolutionFwdAlgoDirect
128-16-12-3x3-256-8-6-8-1x1-2x2-1x1-0-NCHW-FP16-F=ConvBinWinogradRxSf2x3g1:0.11968,0,miopenConvolutionFwdAlgoWinograd;ConvBinWinogradRxSf3x2:0.12592,0,miopenConvolutionFwdAlgoWinograd;GemmFwdRest:0.36224,110592,miopenConvolutionFwdAlgoGEMM;ConvDirectNaiveConvFwd:0.641762,0,miopenConvolutionFwdAlgoDirect
256-8-6-1x1-256-8-6-8-0x0-1x1-1x1-0-NCHW-FP16-F=ConvBinWinogradRxSf2x3g1:0.08368,0,miopenConvolutionFwdAlgoWinograd;ConvBinWinogradRxSf3x2:0.095041,0,miopenConvolutionFwdAlgoWinograd;GemmFwd1x1_0_1:0.02832,0,miopenConvolutionFwdAlgoGEMM;ConvDirectNaiveConvFwd:0.317121,0,miopenConvolutionFwdAlgoDirect
128-8-6-1x1-64-8-6-8-0x0-1x1-1x1-0-NCHW-FP16-F=ConvBinWinogradRxSf2x3g1:0.060481,0,miopenConvolutionFwdAlgoWinograd;ConvBinWinogradRxSf3x2:0.06912,0,miopenConvolutionFwdAlgoWinograd;GemmFwd1x1_0_1:0.01936,0,miopenConvolutionFwdAlgoGEMM;ConvDirectNaiveConvFwd:0.085761,0,miopenConvolutionFwdAlgoDirect
64-8-6-3x3-64-8-6-8-1x1-1x1-1x1-0-NCHW-FP16-F=ConvBinWinogradRxSf2x3g1:0.056001,0,miopenConvolutionFwdAlgoWinograd;ConvBinWinogradRxSf3x2:0.09344,0,miopenConvolutionFwdAlgoWinograd;GemmFwdRest:0.31488,55296,miopenConvolutionFwdAlgoGEMM;ConvDirectNaiveConvFwd:0.153121,0,miopenConvolutionFwdAlgoDirect
128-8-6-1x1-128-8-6-8-0x0-1x1-1x1-0-NCHW-FP16-F=ConvBinWinogradRxSf2x3g1:0.05616,0,miopenConvolutionFwdAlgoWinograd;ConvBinWinogradRxSf3x2:0.068481,0,miopenConvolutionFwdAlgoWinograd;GemmFwd1x1_0_1:0.02224,0,miopenConvolutionFwdAlgoGEMM;ConvDirectNaiveConvFwd:0.08768,0,miopenConvolutionFwdAlgoDirect
384-8-6-1x1-256-8-6-8-0x0-1x1-1x1-0-NCHW-FP16-F=ConvBinWinogradRxSf2x3g1:0.092801,0,miopenConvolutionFwdAlgoWinograd;ConvBinWinogradRxSf3x2:0.10432,0,miopenConvolutionFwdAlgoWinograd;GemmFwd1x1_0_1:0.02448,0,miopenConvolutionFwdAlgoGEMM;ConvDirectNaiveConvFwd:0.467842,0,miopenConvolutionFwdAlgoDirect
256-8-6-1x1-128-8-6-8-0x0-1x1-1x1-0-NCHW-FP16-F=ConvBinWinogradRxSf2x3g1:0.07776,0,miopenConvolutionFwdAlgoWinograd;ConvBinWinogradRxSf3x2:0.08576,0,miopenConvolutionFwdAlgoWinograd;GemmFwd1x1_0_1:0.01664,0,miopenConvolutionFwdAlgoGEMM;ConvDirectNaiveConvFwd:0.17312,0,miopenConvolutionFwdAlgoDirect
512-8-6-1x1-256-8-6-8-0x0-1x1-1x1-0-NCHW-FP16-F=ConvBinWinogradRxSf2x3g1:0.114241,0,miopenConvolutionFwdAlgoWinograd;ConvBinWinogradRxSf3x2:0.12304,0,miopenConvolutionFwdAlgoWinograd;GemmFwd1x1_0_1:0.02944,0,miopenConvolutionFwdAlgoGEMM;ConvDirectNaiveConvFwd:0.625441,0,miopenConvolutionFwdAlgoDirect
128-8-6-1x1-256-8-6-8-0x0-1x1-1x1-0-NCHW-FP16-F=ConvBinWinogradRxSf2x3g1:0.05744,0,miopenConvolutionFwdAlgoWinograd;ConvBinWinogradRxSf3x2:0.068801,0,miopenConvolutionFwdAlgoWinograd;GemmFwd1x1_0_1:0.02672,0,miopenConvolutionFwdAlgoGEMM;ConvDirectNaiveConvFwd:0.164001,0,miopenConvolutionFwdAlgoDirect
128-8-6-3x3-128-8-6-8-1x1-1x1-1x1-0-NCHW-FP16-F_g128=ConvBinWinogradRxSf2x3:0.075521,0,miopenConvolutionFwdAlgoWinograd;ConvBinWinogradRxSf3x2:0.08592,0,miopenConvolutionFwdAlgoWinograd;GemmFwdRest:0.2112,110592,miopenConvolutionFwdAlgoGEMM;ConvDirectNaiveConvFwd:0.01152,0,miopenConvolutionFwdAlgoDirect
384-16-12-1x1-128-16-12-8-0x0-1x1-1x1-0-NCHW-FP16-F=ConvBinWinogradRxSf2x3g1:0.08784,0,miopenConvolutionFwdAlgoWinograd;ConvBinWinogradRxSf3x2:0.10016,0,miopenConvolutionFwdAlgoWinograd;GemmFwd1x1_0_1:0.0344,0,miopenConvolutionFwdAlgoGEMM;ConvDirectNaiveConvFwd:0.345921,0,miopenConvolutionFwdAlgoDirect
256-32-24-1x1-64-32-24-8-0x0-1x1-1x1-0-NCHW-FP16-F=ConvBinWinogradRxSf2x3g1:0.0704,0,miopenConvolutionFwdAlgoWinograd;ConvBinWinogradRxSf3x2:0.07712,0,miopenConvolutionFwdAlgoWinograd;GemmFwd1x1_0_1:0.0312,0,miopenConvolutionFwdAlgoGEMM;ConvDirectNaiveConvFwd:0.521602,0,miopenConvolutionFwdAlgoDirect
32-32-24-1x1-16-32-24-8-0x0-1x1-1x1-0-NCHW-FP16-F=ConvBinWinogradRxSf2x3g1:0.0456,0,miopenConvolutionFwdAlgoWinograd;ConvBinWinogradRxSf3x2:0.05408,0,miopenConvolutionFwdAlgoWinograd;GemmFwd1x1_0_1:0.01584,0,miopenConvolutionFwdAlgoGEMM;ConvDirectNaiveConvFwd:0.06416,0,miopenConvolutionFwdAlgoDirect
16-32-24-3x3-16-32-24-8-1x1-1x1-1x1-0-NCHW-FP16-F=ConvBinWinogradRxSf2x3g1:0.04192,0,miopenConvolutionFwdAlgoWinograd;ConvBinWinogradRxSf3x2:0.05536,0,miopenConvolutionFwdAlgoWinograd;GemmFwdRest:0.2176,221184,miopenConvolutionFwdAlgoGEMM;ConvDirectNaiveConvFwd:0.126721,0,miopenConvolutionFwdAlgoDirect
32-32-24-1x1-32-32-24-8-0x0-1x1-1x1-0-NCHW-FP16-F=ConvBinWinogradRxSf2x3g1:0.04688,0,miopenConvolutionFwdAlgoWinograd;ConvBinWinogradRxSf3x2:0.05488,0,miopenConvolutionFwdAlgoWinograd;GemmFwd1x1_0_1:0.0152,0,miopenConvolutionFwdAlgoGEMM;ConvDirectNaiveConvFwd:0.06592,0,miopenConvolutionFwdAlgoDirect
96-32-24-1x1-64-32-24-8-0x0-1x1-1x1-0-NCHW-FP16-F=ConvBinWinogradRxSf2x3g1:0.05072,0,miopenConvolutionFwdAlgoWinograd;ConvBinWinogradRxSf3x2:0.057761,0,miopenConvolutionFwdAlgoWinograd;GemmFwd1x1_0_1:0.01888,0,miopenConvolutionFwdAlgoGEMM;ConvDirectNaiveConvFwd:0.203841,0,miopenConvolutionFwdAlgoDirect
64-32-24-3x3-64-16-12-8-1x1-2x2-1x1-0-NCHW-FP16-F=ConvBinWinogradRxSf2x3g1:0.079841,0,miopenConvolutionFwdAlgoWinograd;ConvBinWinogradRxSf3x2:0.09088,0,miopenConvolutionFwdAlgoWinograd;GemmFwdRest:0.38528,221184,miopenConvolutionFwdAlgoGEMM;ConvDirectNaiveConvFwd:0.235041,0,miopenConvolutionFwdAlgoDirect
128-16-12-3x3-128-8-6-8-1x1-2x2-1x1-0-NCHW-FP16-F=ConvBinWinogradRxSf2x3g1:0.12224,0,miopenConvolutionFwdAlgoWinograd;ConvBinWinogradRxSf3x2:0.128641,0,miopenConvolutionFwdAlgoWinograd;GemmFwdRest:0.32896,110592,miopenConvolutionFwdAlgoGEMM;ConvDirectNaiveConvFwd:0.374561,0,miopenConvolutionFwdAlgoDirect
128-8-6-3x3-64-8-6-8-1x1-1x1-1x1-0-NCHW-FP16-F=ConvBinWinogradRxSf2x3g1:0.0624,0,miopenConvolutionFwdAlgoWinograd;ConvBinWinogradRxSf3x2:0.12864,0,miopenConvolutionFwdAlgoWinograd;GemmFwdRest:0.30976,110592,miopenConvolutionFwdAlgoGEMM;ConvDirectNaiveConvFwd:0.300801,0,miopenConvolutionFwdAlgoDirect
64-8-6-3x3-128-8-6-8-1x1-1x1-1x1-0-NCHW-FP16-F=ConvBinWinogradRxSf2x3g1:0.04112,0,miopenConvolutionFwdAlgoWinograd;ConvBinWinogradRxSf3x2:0.07424,0,miopenConvolutionFwdAlgoWinograd;GemmFwdRest:0.27264,55296,miopenConvolutionFwdAlgoGEMM;ConvDirectNaiveConvFwd:0.1872,0,miopenConvolutionFwdAlgoDirect
64-32-24-3x3-16-32-24-8-1x1-1x1-1x1-0-NCHW-FP16-F=ConvBinWinogradRxSf2x3g1:0.04928,0,miopenConvolutionFwdAlgoWinograd;ConvBinWinogradRxSf3x2:0.08016,0,miopenConvolutionFwdAlgoWinograd;GemmFwdRest:0.44288,884736,miopenConvolutionFwdAlgoGEMM;ConvDirectNaiveConvFwd:0.482561,0,miopenConvolutionFwdAlgoDirect
16-32-24-1x1-4-32-24-8-0x0-1x1-1x1-0-NCHW-FP16-F=ConvBinWinogradRxSf2x3g1:0.03984,0,miopenConvolutionFwdAlgoWinograd;ConvBinWinogradRxSf3x2:0.04784,0,miopenConvolutionFwdAlgoWinograd;GemmFwd1x1_0_1:0.01536,0,miopenConvolutionFwdAlgoGEMM;ConvDirectNaiveConvFwd:0.03696,0,miopenConvolutionFwdAlgoDirect
128-16-12-3x3-16-16-12-8-1x1-1x1-1x1-0-NCHW-FP16-F=ConvBinWinogradRxSf2x3g1:0.051201,0,miopenConvolutionFwdAlgoWinograd;ConvBinWinogradRxSf3x2:0.1056,0,miopenConvolutionFwdAlgoWinograd;GemmFwdRest:0.4992,442368,miopenConvolutionFwdAlgoGEMM;ConvDirectNaiveConvFwd:0.29152,0,miopenConvolutionFwdAlgoDirect
16-16-12-3x3-16-16-12-8-1x1-1x1-1x1-0-NCHW-FP16-F=ConvBinWinogradRxSf2x3g1:0.03168,0,miopenConvolutionFwdAlgoWinograd;ConvBinWinogradRxSf3x2:0.04624,0,miopenConvolutionFwdAlgoWinograd;GemmFwdRest:0.2368,55296,miopenConvolutionFwdAlgoGEMM;ConvDirectNaiveConvFwd:0.04352,0,miopenConvolutionFwdAlgoDirect
16-16-12-1x1-4-16-12-8-0x0-1x1-1x1-0-NCHW-FP16-F=ConvBinWinogradRxSf2x3g1:0.03248,0,miopenConvolutionFwdAlgoWinograd;ConvBinWinogradRxSf3x2:0.03904,0,miopenConvolutionFwdAlgoWinograd;GemmFwd1x1_0_1:0.02224,0,miopenConvolutionFwdAlgoGEMM;ConvDirectNaiveConvFwd:0.01712,0,miopenConvolutionFwdAlgoDirect
256-8-6-3x3-16-8-6-8-1x1-1x1-1x1-0-NCHW-FP16-F=ConvBinWinogradRxSf2x3g1:0.07936,0,miopenConvolutionFwdAlgoWinograd;ConvBinWinogradRxSf3x2:0.185921,0,miopenConvolutionFwdAlgoWinograd;GemmFwdRest:0.49536,221184,miopenConvolutionFwdAlgoGEMM;ConvDirectNaiveConvFwd:0.543361,0,miopenConvolutionFwdAlgoDirect
16-8-6-3x3-16-8-6-8-1x1-1x1-1x1-0-NCHW-FP16-F=ConvBinWinogradRxSf2x3g1:0.03248,0,miopenConvolutionFwdAlgoWinograd;ConvBinWinogradRxSf3x2:0.04624,0,miopenConvolutionFwdAlgoWinograd;GemmFwdRest:0.256,13824,miopenConvolutionFwdAlgoGEMM;ConvDirectNaiveConvFwd:0.04128,0,miopenConvolutionFwdAlgoDirect
16-8-6-1x1-4-8-6-8-0x0-1x1-1x1-0-NCHW-FP16-F=ConvBinWinogradRxSf2x3g1:0.03136,0,miopenConvolutionFwdAlgoWinograd;ConvBinWinogradRxSf3x2:0.03984,0,miopenConvolutionFwdAlgoWinograd;GemmFwd1x1_0_1:0.02304,0,miopenConvolutionFwdAlgoGEMM;ConvDirectNaiveConvFwd:0.01728,0,miopenConvolutionFwdAlgoDirect
64-32-24-3x3-64-32-24-8-1x1-1x1-1x1-0-NCHW-FP16-F_g64=ConvBinWinogradRxSf2x3:0.11424,0,miopenConvolutionFwdAlgoWinograd;ConvBinWinogradRxSf3x2:0.13968,0,miopenConvolutionFwdAlgoWinograd;GemmFwdRest:0.224,884736,miopenConvolutionFwdAlgoGEMM;ConvDirectNaiveConvFwd:0.0208,0,miopenConvolutionFwdAlgoDirect
64-32-24-1x1-80-32-24-8-0x0-1x1-1x1-0-NCHW-FP16-F=ConvBinWinogradRxSf2x3g1:0.056481,0,miopenConvolutionFwdAlgoWinograd;ConvBinWinogradRxSf3x2:0.05568,0,miopenConvolutionFwdAlgoWinograd;GemmFwd1x1_0_1:0.0184,0,miopenConvolutionFwdAlgoGEMM;ConvDirectNaiveConvFwd:0.158401,0,miopenConvolutionFwdAlgoDirect
80-32-24-3x3-80-32-24-8-1x1-1x1-1x1-0-NCHW-FP16-F_g80=ConvBinWinogradRxSf2x3:0.146401,0,miopenConvolutionFwdAlgoWinograd;ConvBinWinogradRxSf3x2:0.16816,0,miopenConvolutionFwdAlgoWinograd;GemmFwdRest:0.243208,1105920,miopenConvolutionFwdAlgoGEMM;ConvDirectNaiveConvFwd:0.02544,0,miopenConvolutionFwdAlgoDirect
80-32-24-1x1-80-32-24-8-0x0-1x1-1x1-0-NCHW-FP16-F=ConvBinWinogradRxSf2x3g1:0.06176,0,miopenConvolutionFwdAlgoWinograd;ConvBinWinogradRxSf3x2:0.060481,0,miopenConvolutionFwdAlgoWinograd;GemmFwd1x1_0_1:0.04448,0,miopenConvolutionFwdAlgoGEMM;ConvDirectNaiveConvFwd:0.195041,0,miopenConvolutionFwdAlgoDirect
128-16-12-3x3-128-16-12-8-1x1-1x1-1x1-0-NCHW-FP16-F_g128=ConvBinWinogradRxSf2x3:0.1072,0,miopenConvolutionFwdAlgoWinograd;ConvBinWinogradRxSf3x2:0.12096,0,miopenConvolutionFwdAlgoWinograd;GemmFwdRest:0.22272,442368,miopenConvolutionFwdAlgoGEMM;ConvDirectNaiveConvFwd:0.01472,0,miopenConvolutionFwdAlgoDirect
128-16-12-1x1-80-16-12-8-0x0-1x1-1x1-0-NCHW-FP16-F=ConvBinWinogradRxSf2x3g1:0.05536,0,miopenConvolutionFwdAlgoWinograd;ConvBinWinogradRxSf3x2:0.06464,0,miopenConvolutionFwdAlgoWinograd;GemmFwd1x1_0_1:0.04016,0,miopenConvolutionFwdAlgoGEMM;ConvDirectNaiveConvFwd:0.0968,0,miopenConvolutionFwdAlgoDirect
80-16-12-3x3-80-16-12-8-1x1-1x1-1x1-0-NCHW-FP16-F_g80=ConvBinWinogradRxSf2x3:0.0944,0,miopenConvolutionFwdAlgoWinograd;ConvBinWinogradRxSf3x2:0.11376,0,miopenConvolutionFwdAlgoWinograd;GemmFwdRest:0.22144,276480,miopenConvolutionFwdAlgoGEMM;ConvDirectNaiveConvFwd:0.01232,0,miopenConvolutionFwdAlgoDirect
80-16-12-1x1-80-16-12-8-0x0-1x1-1x1-0-NCHW-FP16-F=ConvBinWinogradRxSf2x3g1:0.04944,0,miopenConvolutionFwdAlgoWinograd;ConvBinWinogradRxSf3x2:0.052961,0,miopenConvolutionFwdAlgoWinograd;GemmFwd1x1_0_1:0.04608,0,miopenConvolutionFwdAlgoGEMM;ConvDirectNaiveConvFwd:0.0624,0,miopenConvolutionFwdAlgoDirect
256-8-6-3x3-256-8-6-8-1x1-1x1-1x1-0-NCHW-FP16-F_g256=ConvBinWinogradRxSf2x3:0.11408,0,miopenConvolutionFwdAlgoWinograd;ConvBinWinogradRxSf3x2:0.113121,0,miopenConvolutionFwdAlgoWinograd;GemmFwdRest:0.20608,221184,miopenConvolutionFwdAlgoGEMM;ConvDirectNaiveConvFwd:0.01568,0,miopenConvolutionFwdAlgoDirect
256-8-6-1x1-80-8-6-8-0x0-1x1-1x1-0-NCHW-FP16-F=ConvBinWinogradRxSf2x3g1:0.08064,0,miopenConvolutionFwdAlgoWinograd;ConvBinWinogradRxSf3x2:0.08816,0,miopenConvolutionFwdAlgoWinograd;GemmFwd1x1_0_1:0.0168,0,miopenConvolutionFwdAlgoGEMM;ConvDirectNaiveConvFwd:0.16688,0,miopenConvolutionFwdAlgoDirect
80-8-6-3x3-80-8-6-8-1x1-1x1-1x1-0-NCHW-FP16-F_g80=ConvBinWinogradRxSf2x3:0.0328,0,miopenConvolutionFwdAlgoWinograd;ConvBinWinogradRxSf3x2:0.05312,0,miopenConvolutionFwdAlgoWinograd;GemmFwdRest:0.2432,69120,miopenConvolutionFwdAlgoGEMM;ConvDirectNaiveConvFwd:0.01088,0,miopenConvolutionFwdAlgoDirect
80-8-6-1x1-80-8-6-8-0x0-1x1-1x1-0-NCHW-FP16-F=ConvBinWinogradRxSf2x3g1:0.04672,0,miopenConvolutionFwdAlgoWinograd;ConvBinWinogradRxSf3x2:0.04,0,miopenConvolutionFwdAlgoWinograd;GemmFwd1x1_0_1:0.01776,0,miopenConvolutionFwdAlgoGEMM;ConvDirectNaiveConvFwd:0.0512,0,miopenConvolutionFwdAlgoDirect
